### ISSUE TITLE
no mTLS in latest  edge-21.1.2 for mysql with port 3306 set to opaque

### ISSUE THREAD

**Issue by barkardk** [linkerd/linkerd2#5570]
## Bug Report
Issue #5384 has been marked closed but is is not clear that that only means SSF is now supported , not TLS. So I am creating a new issue for this here 
I have also verified that SSF indeed works on mysql client port but it does not work on galera gcomm port. 

I have tested this on a mysql client connected to a mysql galera cluster and I do not get any connection errors but I cant see any verification that the connection is secured.  
SO I did the following
Installed a galera cluster using bitnami helm chart. just the latest with no data in it on a 3 node cluster
I set these annotations at first in the statefulset hoping that for example the gcomm port would not be an issue
```
config.linkerd.io/opaque-ports: 3306,4567,4568,4444
```
But after a rollout restart the galera internal cluster comm  is not happy 
linkerd-proxy throws this
```
demo-maria-mariadb-galera-2 linkerd-proxy [   372.114184s]  INFO ThreadId(01) outbound:accept{peer.addr=10.96.0.19:60606 target.addr=10.96.2.25:4567}: linkerd_app_core::serve: Connection closed error=received corrupt message
```

and galera throws this 
```
2021-01-19 13:33:50 0 [Warning] WSREP: last inactive check more than PT1.5S ago (PT3.50142S), skipping check
2021-01-19 13:33:53 0 [Note] WSREP: (f50bef99-a0af, 'tcp://0.0.0.0:4567') connection to peer 00000000-0000 with addr tcp://10.96.1.12:4567 timed out, no messages seen in PT3S, socket stats: rtt: 43 rttvar: 21 rto: 201000 lost: 0 last_data_recv: 3000 cwnd: 10 last_queued_since: 3000113127 last_delivered_since: 3000113127 send_queue_length: 0 send_queue_bytes: 0
2021-01-19 13:33:58 0 [Note] WSREP: (f50bef99-a0af, 'tcp://0.0.0.0:4567') connection to peer 00000000-0000 with addr tcp://10.96.1.12:4567 timed out, no messages seen in PT3S, socket stats: rtt: 44 rttvar: 22 rto: 200000 lost: 0 last_data_recv: 3001 cwnd: 10 last_queued_since: 3000210226 last_delivered_since: 3000210226 send_queue_length: 0 send_queue_bytes: 0
2021-01-19 13:34:02 0 [Note] WSREP: (f50bef99-a0af, 'tcp://0.0.0.0:4567') connection to peer 00000000-0000 with addr tcp://10.96.1.12:4567 timed out, no messages seen in PT3S, socket stats: rtt: 37 rttvar: 18 rto: 200000 lost: 0 last_data_recv: 3000 cwnd: 10 last_queued_since: 3000156202 last_delivered_since: 3000156202 send_queue_length: 0 send_queue_bytes: 0
2021-01-19 13:34:06 0 [Note] WSREP: (f50bef99-a0af, 'tcp://0.0.0.0:4567') connection to peer 00000000-0000 with addr tcp://10.96.1.12:4567 timed out, no messages seen in PT3S, socket stats: rtt: 46 rttvar: 23 rto: 200000 lost: 0 last_data_recv: 3001 cwnd: 10 last_queued_since: 3000137555 last_delivered_since: 3000137555 send_queue_length: 0 send_queue_bytes: 0
2021-01-19 13:34:10 0 [Note] WSREP: (f50bef99-a0af, 'tcp://0.0.0.0:4567') connection to peer 00000000-0000 with addr tcp://10.96.1.12:4567 timed out, no messages seen in PT3S, socket stats: rtt: 45 rttvar: 22 rto: 200000 lost: 0 last_data_recv: 3000 cwnd: 10 last_queued_since: 3000133197 last_delivered_since: 3000133197 send_queue_length: 0 send_queue_bytes: 0
2021-01-19 13:34:14 0 [Note] WSREP: (f50bef99-a0af, 'tcp://0.0.0.0:4567') connection to peer 00000000-0000 with addr tcp://10.96.1.12:4567 timed out, no messages seen in PT3S, socket stats: rtt: 70 rttvar: 35 rto: 200000 lost: 0 last_data_recv: 3000 cwnd: 10 last_queued_since: 3000182005 last_delivered_since: 3000182005 send_queue_length: 0 send_queue_bytes: 0
2021-01-19 13:34:18 0 [Note] WSREP: (f50bef99-a0af, 'tcp://0.0.0.0:4567') connection to peer 00000000-0000 with addr tcp://10.96.1.12:4567 timed out, no messages seen in PT3S, socket stats: rtt: 43 rttvar: 21 rto: 200000 lost: 0 last_data_recv: 3000 cwnd: 10 last_queued_since: 3000141468 last_delivered_since: 3000141468 send_queue_length: 0 send_queue_bytes: 0
2021-01-19 13:34:19 0 [Note] WSREP: PC protocol downgrade 1 -> 0
2021-01-19 13:34:19 0 [Note] WSREP: view((empty))
2021-01-19 13:34:19 0 [ERROR] WSREP: failed to open gcomm backend connection: 110: failed to reach primary view: 110 (Connection timed out)
	 at gcomm/src/pc.cpp:connect():160
2021-01-19 13:34:19 0 [ERROR] WSREP: gcs/src/gcs_core.cpp:gcs_core_open():220: Failed to open backend connection: -110 (Connection timed out)
2021-01-19 13:34:19 0 [ERROR] WSREP: gcs/src/gcs.cpp:gcs_open():1632: Failed to open channel 'galera' at 'gcomm://demo-maria-mariadb-galera-headless.default.svc.cluster.local': -110 (Connection timed out)
2021-01-19 13:34:19 0 [ERROR] WSREP: gcs connect failed: Connection timed out
2021-01-19 13:34:19 0 [ERROR] WSREP: wsrep::connect(gcomm://demo-maria-mariadb-galera-headless.default.svc.cluster.local) failed:
```
So I set the galera ports to be skipped and keep the client port in the opaque setting 
```
        config.linkerd.io/opaque-ports: "3306"
        config.linkerd.io/skip-inbound-ports: 4567,4568,4444
        config.linkerd.io/skip-outbound-ports: 4567,4568,4444
```
The proxy iptables looks like this now and galera works
```
-A PREROUTING -m comment --comment "proxy-init/install-proxy-init-prerouting/1611063483" -j PROXY_INIT_REDIRECT
-A OUTPUT -m comment --comment "proxy-init/install-proxy-init-output/1611063483" -j PROXY_INIT_OUTPUT
-A PROXY_INIT_OUTPUT ! -d 127.0.0.1/32 -o lo -m owner --uid-owner 2102 -m comment --comment "proxy-init/redirect-non-loopback-local-traffic/1611063483" -j PROXY_INIT_REDIRECT
-A PROXY_INIT_OUTPUT -m owner --uid-owner 2102 -m comment --comment "proxy-init/ignore-proxy-user-id/1611063483" -j RETURN
-A PROXY_INIT_OUTPUT -o lo -m comment --comment "proxy-init/ignore-loopback/1611063483" -j RETURN
-A PROXY_INIT_OUTPUT -p tcp -m multiport --dports 4567,4568,4444 -m comment --comment "proxy-init/ignore-port-4567,4568,4444/1611063483" -j RETURN
-A PROXY_INIT_OUTPUT -p tcp -m comment --comment "proxy-init/redirect-all-outgoing-to-proxy-port/1611063483" -j REDIRECT --to-ports 4140
-A PROXY_INIT_REDIRECT -p tcp -m multiport --dports 4190,4191,4567,4568,4444 -m comment --comment "proxy-init/ignore-port-4190,4191,4567,4568,4444/1611063483" -j RETURN
-A PROXY_INIT_REDIRECT -p tcp -m comment --comment "proxy-init/redirect-all-incoming-to-proxy-port/1611063483" -j REDIRECT --to-ports 4143
```

Now I installed a separate mysql instance to use as a client and meshes that with the same opaque port setting for port 3306 
also I have to set skip-inbound and outbound port annotations to empty or the default setting will skip meshing 3306 entirely 
so my mysql client looks like this 
```
        config.linkerd.io/opaque-ports: "3306"
        config.linkerd.io/skip-inbound-ports: ""
        config.linkerd.io/skip-outbound-ports: ""
```
If I now try to connect to the galera cluster from the client (I verified first that I had no issue connecting when 3306 was set to be skipped on both the client and the cluster)  
And I succesfully connect , which looks great but 
I tried to verify ssl using linkerd edges, that no longer works (Ill create a separate issue for this) as it is trying to connect to a service that is not created linkerd-prometheus.linkerd-viz.svc.cluster.local 

```
linkerd viz edges po
Error: Edges API response error: Post "http://linkerd-prometheus.linkerd-viz.svc.cluster.local:9090/api/v1/query": dial tcp: lookup linkerd-prometheus.linkerd-viz.svc.cluster.local on 10.99.240.10:53: no such host

```
So I used wireshark instead 
I get the greeting header which is great (yay) but all communication between client and server looks unencrypted to me 
```
10888	2193.768394	10.99.255.76	10.96.2.24	MySQL	164	Server Greeting proto=10 version=10.5.8-MariaDB-log
```
This is a port 3306 tcp packet  intercepting mysql queries that are meshed and have the opaque port 3306 set  
```
Frame 10906: 244 bytes on wire (1952 bits), 244 bytes captured (1952 bits) on interface -, id 0
    Interface id: 0 (-)
    Encapsulation type: Linux cooked-mode capture v1 (25)
    Arrival Time: Jan 19, 2021 14:02:25.572887000 GMT
    [Time shift for this packet: 0.000000000 seconds]
    Epoch Time: 1611064945.572887000 seconds
    [Time delta from previous captured frame: 0.000138000 seconds]
    [Time delta from previous displayed frame: 0.001185000 seconds]
    [Time since reference or first frame: 2193.772067000 seconds]
    Frame Number: 10906
    Frame Length: 244 bytes (1952 bits)
    Capture Length: 244 bytes (1952 bits)
    [Frame is marked: False]
    [Frame is ignored: False]
    [Protocols in frame: sll:ethertype:ip:tcp:mysql]
    [Coloring Rule Name: TCP]
    [Coloring Rule String: tcp]
Linux cooked capture v1
    Packet type: Unicast to us (0)
    Link-layer address type: Loopback (772)
    Link-layer address length: 6
    Source: 00:00:00_00:00:00 (00:00:00:00:00:00)
    Unused: 0000
    Protocol: IPv4 (0x0800)
Internet Protocol Version 4, Src: 10.99.255.76, Dst: 10.96.2.24
    0100 .... = Version: 4
    .... 0101 = Header Length: 20 bytes (5)
    Differentiated Services Field: 0x00 (DSCP: CS0, ECN: Not-ECT)
    Total Length: 228
    Identification: 0xa938 (43320)
    Flags: 0x40, Don't fragment
    Fragment Offset: 0
    Time to Live: 64
    Protocol: TCP (6)
    Header Checksum: 0x7ab4 [validation disabled]
    [Header checksum status: Unverified]
    Source Address: 10.99.255.76
    Destination Address: 10.96.2.24
Transmission Control Protocol, Src Port: 3306, Dst Port: 41160, Seq: 249, Ack: 265, Len: 176
    Source Port: 3306
    Destination Port: 41160
    [Stream index: 445]
    [TCP Segment Len: 176]
    Sequence Number: 249    (relative sequence number)
    Sequence Number (raw): 699215131
    [Next Sequence Number: 425    (relative sequence number)]
    Acknowledgment Number: 265    (relative ack number)
    Acknowledgment number (raw): 4023083351
    1000 .... = Header Length: 32 bytes (8)
    Flags: 0x018 (PSH, ACK)
    Window: 342
    [Calculated window size: 43776]
    [Window size scaling factor: 128]
    Checksum: 0x16fe [unverified]
    [Checksum Status: Unverified]
    Urgent Pointer: 0
    Options: (12 bytes), No-Operation (NOP), No-Operation (NOP), Timestamps
    [SEQ/ACK analysis]
    [Timestamps]
    TCP payload (176 bytes)
    [PDU Size: 5]
    [PDU Size: 79]
    [PDU Size: 23]
    [PDU Size: 16]
    [PDU Size: 10]
    [PDU Size: 23]
    [PDU Size: 9]
    [PDU Size: 11]
MySQL Protocol
    Packet Length: 1
    Packet Number: 1
[Malformed Packet: MySQL]
    [Expert Info (Error/Malformed): Malformed Packet (Exception occurred)]
        [Malformed Packet (Exception occurred)]
        [Severity level: Error]
        [Group: Malformed]
MySQL Protocol
    Packet Length: 75
    Packet Number: 2
    text: def
    text: information_schema
    text: SCHEMATA
    text: SCHEMATA
    text: Database
    text: SCHEMA_NAME
    text: \b
        [Expert Info (Warning/Undecoded): Trailing stray characters]
            [Trailing stray characters]
            [Severity level: Warning]
            [Group: Undecoded]
MySQL Protocol
    Packet Length: 19
    Packet Number: 3
    text: information_schema
MySQL Protocol
    Packet Length: 12
    Packet Number: 4
    text: my_database
MySQL Protocol
    Packet Length: 6
    Packet Number: 5
    text: mysql
MySQL Protocol
    Packet Length: 19
    Packet Number: 6
    text: performance_schema
MySQL Protocol
    Packet Length: 5
    Packet Number: 7
    text: test
MySQL Protocol
    Packet Length: 7
    Packet Number: 8
    Response Code: EOF Packet (0xfe)
    EOF marker: 254
    Warnings: 0
    Server Status: 0x0022
    Payload: 0000
        [Expert Info (Warning/Undecoded): FIXME - dissector is incomplete]
            [FIXME - dissector is incomplete]
            [Severity level: Warning]
            [Group: Undecoded]

### Environment

- Kubernetes Version:
- 1.15
- Cluster Environment: (GKE, AKS, kops, ...)
- GKE

- Linkerd version:
edge-21.1.2

**Comment by olix0r** [comment]
@barkardk Thanks for the detailed issue!

Is the `opaque-ports` annotation set on the _server_ workload? Or on the client workload? It should be set on the serverside workload, and will be discovered by the client. If you've configured it properly on the serverside, it would be helpful to see debug logs from the client proxy (i.e. with `config.linkerd.io/proxy-log-level: linkerd=debug,warn`).

**Comment by barkardk** [comment]
I actually set the opaque-ports annotation on both sides 
I have one galera 3 node mariadb cluster acting as server with 3306 annotated as opaque and galera in-cluster ports annotated as skip-inbound/skip-outbound   
Acting as a client was a mysql database setup as a single instance. I annotated the 3306 port on that instance as well.  
Here is the proxy log from the mysql "client" database while I run a select statement from it 
```bash
# select statement run from mysql client pod
 kubectl exec -it mysql-698bd97486-dnt2s -- mysql -h demo-maria-mariadb-galera -uroot -p58RX7iFuDv -e 'SHOW databases;' -c mysql  
```
```bash
#linkerd proxy logs from mysql client pod
kubectl logs mysql-698bd97486-dnt2s -c linkerd-proxy  -f
time="2021-01-20T13:18:13Z" level=info msg="running version edge-21.1.2"
[     0.002886s] DEBUG ThreadId(01) linkerd_app::env: Adding 4143 to LINKERD2_PROXY_INBOUND_PORTS_REQUIRE_IDENTITY
[     0.002935s]  INFO ThreadId(01) linkerd2_proxy::rt: Using single-threaded proxy runtime
[     0.003062s] DEBUG ThreadId(01) linkerd_app: building app
[     0.003550s]  INFO ThreadId(01) linkerd2_proxy: Admin interface on 0.0.0.0:4191
[     0.003567s]  INFO ThreadId(01) linkerd2_proxy: Inbound interface on 0.0.0.0:4143
[     0.003571s]  INFO ThreadId(01) linkerd2_proxy: Outbound interface on 127.0.0.1:4140
[     0.003576s]  INFO ThreadId(01) linkerd2_proxy: Tap interface on 0.0.0.0:4190
[     0.003580s]  INFO ThreadId(01) linkerd2_proxy: Local identity is default.default.serviceaccount.identity.linkerd.cluster.local
[     0.003585s]  INFO ThreadId(01) linkerd2_proxy: Identity verified via linkerd-identity-headless.linkerd.svc.cluster.local:8080 (linkerd-identity.linkerd.serviceaccount.identity.linkerd.cluster.local)
[     0.003589s]  INFO ThreadId(01) linkerd2_proxy: Destinations resolved via linkerd-dst-headless.linkerd.svc.cluster.local:8086 (linkerd-destination.linkerd.serviceaccount.identity.linkerd.cluster.local)
[     0.003598s] DEBUG ThreadId(01) linkerd_app: spawning daemon thread
[     0.003827s]  INFO ThreadId(01) outbound: linkerd_app: listen.addr=127.0.0.1:4140 ingress_mode=false
[     0.004016s]  INFO ThreadId(01) inbound: linkerd_app: listen.addr=0.0.0.0:4143
[     0.004049s] DEBUG ThreadId(02) daemon: linkerd_app: running admin thread
[     0.004173s] DEBUG ThreadId(02) daemon:identity: linkerd_app::identity: running peer.addr=ControlAddr { addr: Name(NameAddr { name: "linkerd-identity-headless.linkerd.svc.cluster.local", port: 8080 }), identity: Some("linkerd-identity.linkerd.serviceaccount.identity.linkerd.cluster.local") }
[     0.004410s] DEBUG ThreadId(01) identity: linkerd_dns: resolve_srv name=linkerd-identity-headless.linkerd.svc.cluster.local
[     0.022024s] DEBUG ThreadId(01) identity: linkerd_dns: resolve_a name=linkerd-identity-headless.linkerd.svc.cluster.local
[     0.046659s] DEBUG ThreadId(01) identity: linkerd_tls::client: Initiating TLS connection peer.identity="linkerd-identity.linkerd.serviceaccount.identity.linkerd.cluster.local"
[     0.046692s] DEBUG ThreadId(01) identity: linkerd_proxy_transport::connect: Connecting peer.addr=10.96.0.16:8080
[     0.047940s] DEBUG ThreadId(01) identity:h2: linkerd_proxy_transport::connect: Connected local.addr=10.96.2.35:37770 keepalive=Some(10s)
[     0.064073s] DEBUG ThreadId(02) daemon:identity: linkerd_identity: certified default.default.serviceaccount.identity.linkerd.cluster.local
[     0.064148s] DEBUG ThreadId(02) daemon:identity: linkerd_proxy_identity::certify: daemon certified until SystemTime { tv_sec: 1611235113, tv_nsec: 0 }
[     0.064169s]  INFO ThreadId(02) daemon:identity: linkerd_app: Certified identity: default.default.serviceaccount.identity.linkerd.cluster.local
[     1.952631s] DEBUG ThreadId(02) daemon:admin{listen.addr=0.0.0.0:4191}:accept{peer.addr=10.96.2.1:60834 target.addr=10.96.2.35:4191}: linkerd_tls::accept: Peeked bytes from TCP stream sz=118
[     1.952987s] DEBUG ThreadId(02) daemon:admin{listen.addr=0.0.0.0:4191}:accept{peer.addr=10.96.2.1:60834 target.addr=10.96.2.35:4191}: linkerd_app_core::serve: Connection closed
[     6.632399s] DEBUG ThreadId(02) daemon:admin{listen.addr=0.0.0.0:4191}:accept{peer.addr=10.96.1.8:41728 target.addr=10.96.2.35:4191}: linkerd_tls::accept: Peeked bytes from TCP stream sz=276
[    11.953666s] DEBUG ThreadId(02) daemon:admin{listen.addr=0.0.0.0:4191}:accept{peer.addr=10.96.2.1:60874 target.addr=10.96.2.35:4191}: linkerd_tls::accept: Peeked bytes from TCP stream sz=118
[    11.953879s] DEBUG ThreadId(02) daemon:admin{listen.addr=0.0.0.0:4191}:accept{peer.addr=10.96.2.1:60874 target.addr=10.96.2.35:4191}: linkerd_app_core::serve: Connection closed
[    16.136267s] DEBUG ThreadId(02) daemon:admin{listen.addr=0.0.0.0:4191}:accept{peer.addr=10.96.2.1:60894 target.addr=10.96.2.35:4191}: linkerd_tls::accept: Peeked bytes from TCP stream sz=117
[    16.136563s] DEBUG ThreadId(02) daemon:admin{listen.addr=0.0.0.0:4191}:accept{peer.addr=10.96.2.1:60894 target.addr=10.96.2.35:4191}: linkerd_app_core::serve: Connection closed
[    21.952820s] DEBUG ThreadId(02) daemon:admin{listen.addr=0.0.0.0:4191}:accept{peer.addr=10.96.2.1:60914 target.addr=10.96.2.35:4191}: linkerd_tls::accept: Peeked bytes from TCP stream sz=118
[    21.953019s] DEBUG ThreadId(02) daemon:admin{listen.addr=0.0.0.0:4191}:accept{peer.addr=10.96.2.1:60914 target.addr=10.96.2.35:4191}: linkerd_app_core::serve: Connection closed
[    26.136429s] DEBUG ThreadId(02) daemon:admin{listen.addr=0.0.0.0:4191}:accept{peer.addr=10.96.2.1:60938 target.addr=10.96.2.35:4191}: linkerd_tls::accept: Peeked bytes from TCP stream sz=117
[    26.136601s] DEBUG ThreadId(02) daemon:admin{listen.addr=0.0.0.0:4191}:accept{peer.addr=10.96.2.1:60938 target.addr=10.96.2.35:4191}: linkerd_app_core::serve: Connection closed
[    30.047949s] DEBUG ThreadId(01) identity: linkerd_dns: resolve_srv name=linkerd-identity-headless.linkerd.svc.cluster.local
[    30.069066s] DEBUG ThreadId(01) identity: linkerd_dns: resolve_a name=linkerd-identity-headless.linkerd.svc.cluster.local
[    30.094344s] DEBUG ThreadId(01) identity: linkerd_proxy_dns_resolve: addrs=[10.96.0.16:8080]
[    31.952910s] DEBUG ThreadId(02) daemon:admin{listen.addr=0.0.0.0:4191}:accept{peer.addr=10.96.2.1:60956 target.addr=10.96.2.35:4191}: linkerd_tls::accept: Peeked bytes from TCP stream sz=118
[    31.953087s] DEBUG ThreadId(02) daemon:admin{listen.addr=0.0.0.0:4191}:accept{peer.addr=10.96.2.1:60956 target.addr=10.96.2.35:4191}: linkerd_app_core::serve: Connection closed
[    36.136622s] DEBUG ThreadId(02) daemon:admin{listen.addr=0.0.0.0:4191}:accept{peer.addr=10.96.2.1:60978 target.addr=10.96.2.35:4191}: linkerd_tls::accept: Peeked bytes from TCP stream sz=117
[    36.136817s] DEBUG ThreadId(02) daemon:admin{listen.addr=0.0.0.0:4191}:accept{peer.addr=10.96.2.1:60978 target.addr=10.96.2.35:4191}: linkerd_app_core::serve: Connection closed
[    41.952922s] DEBUG ThreadId(02) daemon:admin{listen.addr=0.0.0.0:4191}:accept{peer.addr=10.96.2.1:32770 target.addr=10.96.2.35:4191}: linkerd_tls::accept: Peeked bytes from TCP stream sz=118
[    41.953179s] DEBUG ThreadId(02) daemon:admin{listen.addr=0.0.0.0:4191}:accept{peer.addr=10.96.2.1:32770 target.addr=10.96.2.35:4191}: linkerd_app_core::serve: Connection closed
[    46.136459s] DEBUG ThreadId(02) daemon:admin{listen.addr=0.0.0.0:4191}:accept{peer.addr=10.96.2.1:32790 target.addr=10.96.2.35:4191}: linkerd_tls::accept: Peeked bytes from TCP stream sz=117
[    46.136656s] DEBUG ThreadId(02) daemon:admin{listen.addr=0.0.0.0:4191}:accept{peer.addr=10.96.2.1:32790 target.addr=10.96.2.35:4191}: linkerd_app_core::serve: Connection closed
[    51.952696s] DEBUG ThreadId(02) daemon:admin{listen.addr=0.0.0.0:4191}:accept{peer.addr=10.96.2.1:32812 target.addr=10.96.2.35:4191}: linkerd_tls::accept: Peeked bytes from TCP stream sz=118
[    51.953030s] DEBUG ThreadId(02) daemon:admin{listen.addr=0.0.0.0:4191}:accept{peer.addr=10.96.2.1:32812 target.addr=10.96.2.35:4191}: linkerd_app_core::serve: Connection closed
[    56.136464s] DEBUG ThreadId(02) daemon:admin{listen.addr=0.0.0.0:4191}:accept{peer.addr=10.96.2.1:32848 target.addr=10.96.2.35:4191}: linkerd_tls::accept: Peeked bytes from TCP stream sz=117
[    56.136656s] DEBUG ThreadId(02) daemon:admin{listen.addr=0.0.0.0:4191}:accept{peer.addr=10.96.2.1:32848 target.addr=10.96.2.35:4191}: linkerd_app_core::serve: Connection closed
[    60.095668s] DEBUG ThreadId(01) identity: linkerd_dns: resolve_srv name=linkerd-identity-headless.linkerd.svc.cluster.local
[    60.111785s] DEBUG ThreadId(01) identity: linkerd_dns: resolve_a name=linkerd-identity-headless.linkerd.svc.cluster.local
[    60.137541s] DEBUG ThreadId(01) identity: linkerd_proxy_dns_resolve: addrs=[10.96.0.16:8080]
[    61.952847s] DEBUG ThreadId(02) daemon:admin{listen.addr=0.0.0.0:4191}:accept{peer.addr=10.96.2.1:32868 target.addr=10.96.2.35:4191}: linkerd_tls::accept: Peeked bytes from TCP stream sz=118
[    61.953027s] DEBUG ThreadId(02) daemon:admin{listen.addr=0.0.0.0:4191}:accept{peer.addr=10.96.2.1:32868 target.addr=10.96.2.35:4191}: linkerd_app_core::serve: Connection closed
[    66.136512s] DEBUG ThreadId(02) daemon:admin{listen.addr=0.0.0.0:4191}:accept{peer.addr=10.96.2.1:32888 target.addr=10.96.2.35:4191}: linkerd_tls::accept: Peeked bytes from TCP stream sz=117
[    66.136716s] DEBUG ThreadId(02) daemon:admin{listen.addr=0.0.0.0:4191}:accept{peer.addr=10.96.2.1:32888 target.addr=10.96.2.35:4191}: linkerd_app_core::serve: Connection closed
[    71.952599s] DEBUG ThreadId(02) daemon:admin{listen.addr=0.0.0.0:4191}:accept{peer.addr=10.96.2.1:32908 target.addr=10.96.2.35:4191}: linkerd_tls::accept: Peeked bytes from TCP stream sz=118
[    71.952857s] DEBUG ThreadId(02) daemon:admin{listen.addr=0.0.0.0:4191}:accept{peer.addr=10.96.2.1:32908 target.addr=10.96.2.35:4191}: linkerd_app_core::serve: Connection closed
[    76.136295s] DEBUG ThreadId(02) daemon:admin{listen.addr=0.0.0.0:4191}:accept{peer.addr=10.96.2.1:32930 target.addr=10.96.2.35:4191}: linkerd_tls::accept: Peeked bytes from TCP stream sz=117
[    76.136491s] DEBUG ThreadId(02) daemon:admin{listen.addr=0.0.0.0:4191}:accept{peer.addr=10.96.2.1:32930 target.addr=10.96.2.35:4191}: linkerd_app_core::serve: Connection closed
[    81.952832s] DEBUG ThreadId(02) daemon:admin{listen.addr=0.0.0.0:4191}:accept{peer.addr=10.96.2.1:32948 target.addr=10.96.2.35:4191}: linkerd_tls::accept: Peeked bytes from TCP stream sz=118
[    81.953029s] DEBUG ThreadId(02) daemon:admin{listen.addr=0.0.0.0:4191}:accept{peer.addr=10.96.2.1:32948 target.addr=10.96.2.35:4191}: linkerd_app_core::serve: Connection closed
[    86.136217s] DEBUG ThreadId(02) daemon:admin{listen.addr=0.0.0.0:4191}:accept{peer.addr=10.96.2.1:32972 target.addr=10.96.2.35:4191}: linkerd_tls::accept: Peeked bytes from TCP stream sz=117
[    86.136398s] DEBUG ThreadId(02) daemon:admin{listen.addr=0.0.0.0:4191}:accept{peer.addr=10.96.2.1:32972 target.addr=10.96.2.35:4191}: linkerd_app_core::serve: Connection closed
[    91.952815s] DEBUG ThreadId(02) daemon:admin{listen.addr=0.0.0.0:4191}:accept{peer.addr=10.96.2.1:32992 target.addr=10.96.2.35:4191}: linkerd_tls::accept: Peeked bytes from TCP stream sz=118
[    91.952992s] DEBUG ThreadId(02) daemon:admin{listen.addr=0.0.0.0:4191}:accept{peer.addr=10.96.2.1:32992 target.addr=10.96.2.35:4191}: linkerd_app_core::serve: Connection closed
[    96.136449s] DEBUG ThreadId(02) daemon:admin{listen.addr=0.0.0.0:4191}:accept{peer.addr=10.96.2.1:33012 target.addr=10.96.2.35:4191}: linkerd_tls::accept: Peeked bytes from TCP stream sz=117
[    96.136619s] DEBUG ThreadId(02) daemon:admin{listen.addr=0.0.0.0:4191}:accept{peer.addr=10.96.2.1:33012 target.addr=10.96.2.35:4191}: linkerd_app_core::serve: Connection closed
[   101.952765s] DEBUG ThreadId(02) daemon:admin{listen.addr=0.0.0.0:4191}:accept{peer.addr=10.96.2.1:33030 target.addr=10.96.2.35:4191}: linkerd_tls::accept: Peeked bytes from TCP stream sz=118
[   101.952974s] DEBUG ThreadId(02) daemon:admin{listen.addr=0.0.0.0:4191}:accept{peer.addr=10.96.2.1:33030 target.addr=10.96.2.35:4191}: linkerd_app_core::serve: Connection closed
[   106.136495s] DEBUG ThreadId(02) daemon:admin{listen.addr=0.0.0.0:4191}:accept{peer.addr=10.96.2.1:33052 target.addr=10.96.2.35:4191}: linkerd_tls::accept: Peeked bytes from TCP stream sz=117
[   106.136676s] DEBUG ThreadId(02) daemon:admin{listen.addr=0.0.0.0:4191}:accept{peer.addr=10.96.2.1:33052 target.addr=10.96.2.35:4191}: linkerd_app_core::serve: Connection closed
[   111.952674s] DEBUG ThreadId(02) daemon:admin{listen.addr=0.0.0.0:4191}:accept{peer.addr=10.96.2.1:33074 target.addr=10.96.2.35:4191}: linkerd_tls::accept: Peeked bytes from TCP stream sz=118
[   111.952866s] DEBUG ThreadId(02) daemon:admin{listen.addr=0.0.0.0:4191}:accept{peer.addr=10.96.2.1:33074 target.addr=10.96.2.35:4191}: linkerd_app_core::serve: Connection closed
[   116.136509s] DEBUG ThreadId(02) daemon:admin{listen.addr=0.0.0.0:4191}:accept{peer.addr=10.96.2.1:33106 target.addr=10.96.2.35:4191}: linkerd_tls::accept: Peeked bytes from TCP stream sz=117
[   116.136671s] DEBUG ThreadId(02) daemon:admin{listen.addr=0.0.0.0:4191}:accept{peer.addr=10.96.2.1:33106 target.addr=10.96.2.35:4191}: linkerd_app_core::serve: Connection closed
[   121.952972s] DEBUG ThreadId(02) daemon:admin{listen.addr=0.0.0.0:4191}:accept{peer.addr=10.96.2.1:33126 target.addr=10.96.2.35:4191}: linkerd_tls::accept: Peeked bytes from TCP stream sz=118
[   121.953208s] DEBUG ThreadId(02) daemon:admin{listen.addr=0.0.0.0:4191}:accept{peer.addr=10.96.2.1:33126 target.addr=10.96.2.35:4191}: linkerd_app_core::serve: Connection closed
[   126.136452s] DEBUG ThreadId(02) daemon:admin{listen.addr=0.0.0.0:4191}:accept{peer.addr=10.96.2.1:33148 target.addr=10.96.2.35:4191}: linkerd_tls::accept: Peeked bytes from TCP stream sz=117
[   126.136622s] DEBUG ThreadId(02) daemon:admin{listen.addr=0.0.0.0:4191}:accept{peer.addr=10.96.2.1:33148 target.addr=10.96.2.35:4191}: linkerd_app_core::serve: Connection closed
[   128.005799s] DEBUG ThreadId(01) outbound: linkerd_cache: Caching new service target=Accept { orig_dst: 10.99.255.76:3306, protocol: () }
[   128.006001s] DEBUG ThreadId(01) dst: linkerd_dns: resolve_srv name=linkerd-dst-headless.linkerd.svc.cluster.local
[   128.023773s] DEBUG ThreadId(01) dst: linkerd_dns: resolve_a name=linkerd-dst-headless.linkerd.svc.cluster.local
[   128.050555s] DEBUG ThreadId(01) dst: linkerd_tls::client: Initiating TLS connection peer.identity="linkerd-destination.linkerd.serviceaccount.identity.linkerd.cluster.local"
[   128.050593s] DEBUG ThreadId(01) dst: linkerd_proxy_transport::connect: Connecting peer.addr=10.96.2.23:8086
[   128.050859s] DEBUG ThreadId(01) dst:h2: linkerd_proxy_transport::connect: Connected local.addr=10.96.2.35:41304 keepalive=Some(10s)
[   128.056124s] DEBUG ThreadId(01) outbound:poll_profile: linkerd_service_profiles::client: profile received: DestinationProfile { fully_qualified_name: "demo-maria-mariadb-galera.default.svc.cluster.local", opaque_protocol: true, routes: [], retry_budget: Some(RetryBudget { retry_ratio: 0.2, min_retries_per_second: 10, ttl: Some(Duration { seconds: 10, nanos: 0 }) }), dst_overrides: [], endpoint: None }
[   128.056219s] DEBUG ThreadId(01) outbound:tcp.opaque: linkerd_service_profiles::split: Updating targets=[Target { addr: Name(NameAddr { name: "demo-maria-mariadb-galera.default.svc.cluster.local", port: 3306 }), weight: 1 }]
[   128.056242s] DEBUG ThreadId(01) outbound:tcp.opaque: linkerd_proxy_api_resolve::resolve: Resolving dst=demo-maria-mariadb-galera.default.svc.cluster.local:3306 context={"ns":"default", "nodeName":"gke-nkdev-sweet-kbarkard-default-pool-82d881cf-25tz"}

[   128.056281s] DEBUG ThreadId(01) outbound:poll_profile: linkerd_service_profiles::client: profile received: DestinationProfile { fully_qualified_name: "demo-maria-mariadb-galera.default.svc.cluster.local", opaque_protocol: true, routes: [], retry_budget: Some(RetryBudget { retry_ratio: 0.2, min_retries_per_second: 10, ttl: Some(Duration { seconds: 10, nanos: 0 }) }), dst_overrides: [WeightedDst { authority: "demo-maria-mariadb-galera.default.svc.cluster.local.:3306", weight: 10000 }], endpoint: None }
[   128.056305s] DEBUG ThreadId(01) outbound:poll_profile: linkerd_service_profiles::client: profile received: DestinationProfile { fully_qualified_name: "demo-maria-mariadb-galera.default.svc.cluster.local", opaque_protocol: true, routes: [], retry_budget: Some(RetryBudget { retry_ratio: 0.2, min_retries_per_second: 10, ttl: Some(Duration { seconds: 10, nanos: 0 }) }), dst_overrides: [WeightedDst { authority: "demo-maria-mariadb-galera.default.svc.cluster.local.:3306", weight: 10000 }], endpoint: None }
[   128.056351s] DEBUG ThreadId(01) outbound:tcp.opaque: linkerd_service_profiles::split: Updating targets=[Target { addr: Name(NameAddr { name: "demo-maria-mariadb-galera.default.svc.cluster.local.", port: 3306 }), weight: 10000 }]
[   128.056363s] DEBUG ThreadId(01) outbound:tcp.opaque: linkerd_service_profiles::split: Creating target addr=demo-maria-mariadb-galera.default.svc.cluster.local:3306
[   128.056383s] DEBUG ThreadId(01) outbound:tcp.opaque: linkerd_proxy_api_resolve::resolve: Resolving dst=demo-maria-mariadb-galera.default.svc.cluster.local:3306 context={"ns":"default", "nodeName":"gke-nkdev-sweet-kbarkard-default-pool-82d881cf-25tz"}

[   128.062685s] DEBUG ThreadId(01) outbound:tcp.opaque: linkerd_proxy_api_resolve::resolve: Add endpoints=3
[   128.062832s] DEBUG ThreadId(01) outbound:tcp.opaque:endpoint{peer.addr=10.96.1.13:3306 peer.id=Some("default.default.serviceaccount.identity.linkerd.cluster.local")}: linkerd_app_outbound::tcp::opaque_transport: Using opaque transport header=TransportHeader { port: 3306, name: None } override_port=4143
[   128.062853s] DEBUG ThreadId(01) outbound:tcp.opaque:endpoint{peer.addr=10.96.1.13:3306 peer.id=Some("default.default.serviceaccount.identity.linkerd.cluster.local")}: linkerd_tls::client: Initiating TLS connection peer.identity="default.default.serviceaccount.identity.linkerd.cluster.local"
[   128.062863s] DEBUG ThreadId(01) outbound:tcp.opaque:endpoint{peer.addr=10.96.1.13:3306 peer.id=Some("default.default.serviceaccount.identity.linkerd.cluster.local")}: linkerd_proxy_transport::connect: Connecting peer.addr=10.96.1.13:4143
[   128.064551s] DEBUG ThreadId(01) outbound:tcp.opaque:endpoint{peer.addr=10.96.1.13:3306 peer.id=Some("default.default.serviceaccount.identity.linkerd.cluster.local")}: linkerd_proxy_transport::connect: Connected local.addr=10.96.2.35:51146 keepalive=Some(10s)
[   128.066760s] DEBUG ThreadId(01) outbound:tcp.opaque:endpoint{peer.addr=10.96.1.13:3306 peer.id=Some("default.default.serviceaccount.identity.linkerd.cluster.local")}: linkerd_app_outbound::tcp::opaque_transport: Wrote header to transport sz=30
[   128.066784s] DEBUG ThreadId(01) outbound:tcp.opaque:endpoint{peer.addr=10.96.1.13:3306 peer.id=Some("default.default.serviceaccount.identity.linkerd.cluster.local")}: linkerd_proxy_transport::metrics: client connection open
[   128.130970s] DEBUG ThreadId(01) outbound:accept{peer.addr=10.96.2.35:49818 target.addr=10.99.255.76:3306}: linkerd_app_core::serve: Connection closed
[   128.131013s] DEBUG ThreadId(01) evict{target=Accept { orig_dst: 10.99.255.76:3306, protocol: () }}: linkerd_cache: Awaiting idleness
[   131.952761s] DEBUG ThreadId(02) daemon:admin{listen.addr=0.0.0.0:4191}:accept{peer.addr=10.96.2.1:33180 target.addr=10.96.2.35:4191}: linkerd_tls::accept: Peeked bytes from TCP stream sz=118
[   131.952961s] DEBUG ThreadId(02) daemon:admin{listen.addr=0.0.0.0:4191}:accept{peer.addr=10.96.2.1:33180 target.addr=10.96.2.35:4191}: linkerd_app_core::serve: Connection closed
[   133.131872s] DEBUG ThreadId(01) evict{target=Accept { orig_dst: 10.99.255.76:3306, protocol: () }}: linkerd_cache: Cache entry dropped
[   136.136311s] DEBUG ThreadId(02) daemon:admin{listen.addr=0.0.0.0:4191}:accept{peer.addr=10.96.2.1:33200 target.addr=10.96.2.35:4191}: linkerd_tls::accept: Peeked bytes from TCP stream sz=117
[   136.136513s] DEBUG ThreadId(02) daemon:admin{listen.addr=0.0.0.0:4191}:accept{peer.addr=10.96.2.1:33200 target.addr=10.96.2.35:4191}: linkerd_app_core::serve: Connection closed
[   141.952796s] DEBUG ThreadId(02) daemon:admin{listen.addr=0.0.0.0:4191}:accept{peer.addr=10.96.2.1:33222 target.addr=10.96.2.35:4191}: linkerd_tls::accept: Peeked bytes from TCP stream sz=118
[   141.952969s] DEBUG ThreadId(02) daemon:admin{listen.addr=0.0.0.0:4191}:accept{peer.addr=10.96.2.1:33222 target.addr=10.96.2.35:4191}: linkerd_app_core::serve: Connection closed
[   144.365179s] DEBUG ThreadId(01) outbound: linkerd_cache: Caching new service target=Accept { orig_dst: 10.99.255.76:3306, protocol: () }
[   144.367048s] DEBUG ThreadId(01) outbound:poll_profile: linkerd_service_profiles::client: profile received: DestinationProfile { fully_qualified_name: "demo-maria-mariadb-galera.default.svc.cluster.local", opaque_protocol: true, routes: [], retry_budget: Some(RetryBudget { retry_ratio: 0.2, min_retries_per_second: 10, ttl: Some(Duration { seconds: 10, nanos: 0 }) }), dst_overrides: [], endpoint: None }
[   144.367148s] DEBUG ThreadId(01) outbound:tcp.opaque: linkerd_service_profiles::split: Updating targets=[Target { addr: Name(NameAddr { name: "demo-maria-mariadb-galera.default.svc.cluster.local", port: 3306 }), weight: 1 }]
[   144.367230s] DEBUG ThreadId(01) outbound:tcp.opaque: linkerd_proxy_api_resolve::resolve: Resolving dst=demo-maria-mariadb-galera.default.svc.cluster.local:3306 context={"ns":"default", "nodeName":"gke-nkdev-sweet-kbarkard-default-pool-82d881cf-25tz"}

[   144.367323s] DEBUG ThreadId(01) outbound:poll_profile: linkerd_service_profiles::client: profile received: DestinationProfile { fully_qualified_name: "demo-maria-mariadb-galera.default.svc.cluster.local", opaque_protocol: true, routes: [], retry_budget: Some(RetryBudget { retry_ratio: 0.2, min_retries_per_second: 10, ttl: Some(Duration { seconds: 10, nanos: 0 }) }), dst_overrides: [WeightedDst { authority: "demo-maria-mariadb-galera.default.svc.cluster.local.:3306", weight: 10000 }], endpoint: None }
[   144.367365s] DEBUG ThreadId(01) outbound:poll_profile: linkerd_service_profiles::client: profile received: DestinationProfile { fully_qualified_name: "demo-maria-mariadb-galera.default.svc.cluster.local", opaque_protocol: true, routes: [], retry_budget: Some(RetryBudget { retry_ratio: 0.2, min_retries_per_second: 10, ttl: Some(Duration { seconds: 10, nanos: 0 }) }), dst_overrides: [WeightedDst { authority: "demo-maria-mariadb-galera.default.svc.cluster.local.:3306", weight: 10000 }], endpoint: None }
[   144.367417s] DEBUG ThreadId(01) outbound:tcp.opaque: linkerd_service_profiles::split: Updating targets=[Target { addr: Name(NameAddr { name: "demo-maria-mariadb-galera.default.svc.cluster.local.", port: 3306 }), weight: 10000 }]
[   144.367430s] DEBUG ThreadId(01) outbound:tcp.opaque: linkerd_service_profiles::split: Creating target addr=demo-maria-mariadb-galera.default.svc.cluster.local:3306
[   144.367452s] DEBUG ThreadId(01) outbound:tcp.opaque: linkerd_proxy_api_resolve::resolve: Resolving dst=demo-maria-mariadb-galera.default.svc.cluster.local:3306 context={"ns":"default", "nodeName":"gke-nkdev-sweet-kbarkard-default-pool-82d881cf-25tz"}

[   144.380437s] DEBUG ThreadId(01) outbound:tcp.opaque: linkerd_proxy_api_resolve::resolve: Add endpoints=3
[   144.380571s] DEBUG ThreadId(01) outbound:tcp.opaque:endpoint{peer.addr=10.96.2.26:3306 peer.id=Some("default.default.serviceaccount.identity.linkerd.cluster.local")}: linkerd_app_outbound::tcp::opaque_transport: Using opaque transport header=TransportHeader { port: 3306, name: None } override_port=4143
[   144.380593s] DEBUG ThreadId(01) outbound:tcp.opaque:endpoint{peer.addr=10.96.2.26:3306 peer.id=Some("default.default.serviceaccount.identity.linkerd.cluster.local")}: linkerd_tls::client: Initiating TLS connection peer.identity="default.default.serviceaccount.identity.linkerd.cluster.local"
[   144.380603s] DEBUG ThreadId(01) outbound:tcp.opaque:endpoint{peer.addr=10.96.2.26:3306 peer.id=Some("default.default.serviceaccount.identity.linkerd.cluster.local")}: linkerd_proxy_transport::connect: Connecting peer.addr=10.96.2.26:4143
[   144.380861s] DEBUG ThreadId(01) outbound:tcp.opaque:endpoint{peer.addr=10.96.2.26:3306 peer.id=Some("default.default.serviceaccount.identity.linkerd.cluster.local")}: linkerd_proxy_transport::connect: Connected local.addr=10.96.2.35:56612 keepalive=Some(10s)
[   144.382607s] DEBUG ThreadId(01) outbound:tcp.opaque:endpoint{peer.addr=10.96.2.26:3306 peer.id=Some("default.default.serviceaccount.identity.linkerd.cluster.local")}: linkerd_app_outbound::tcp::opaque_transport: Wrote header to transport sz=30
[   144.382628s] DEBUG ThreadId(01) outbound:tcp.opaque:endpoint{peer.addr=10.96.2.26:3306 peer.id=Some("default.default.serviceaccount.identity.linkerd.cluster.local")}: linkerd_proxy_transport::metrics: client connection open
[   144.426338s] DEBUG ThreadId(01) outbound:accept{peer.addr=10.96.2.35:49900 target.addr=10.99.255.76:3306}: linkerd_app_core::serve: Connection closed
[   144.426379s] DEBUG ThreadId(01) evict{target=Accept { orig_dst: 10.99.255.76:3306, protocol: () }}: linkerd_cache: Awaiting idleness
[   146.136483s] DEBUG ThreadId(02) daemon:admin{listen.addr=0.0.0.0:4191}:accept{peer.addr=10.96.2.1:33252 target.addr=10.96.2.35:4191}: linkerd_tls::accept: Peeked bytes from TCP stream sz=117
[   146.136684s] DEBUG ThreadId(02) daemon:admin{listen.addr=0.0.0.0:4191}:accept{peer.addr=10.96.2.1:33252 target.addr=10.96.2.35:4191}: linkerd_app_core::serve: Connection closed
[   149.427448s] DEBUG ThreadId(01) evict{target=Accept { orig_dst: 10.99.255.76:3306, protocol: () }}: linkerd_cache: Cache entry dropped
[   151.952819s] DEBUG ThreadId(02) daemon:admin{listen.addr=0.0.0.0:4191}:accept{peer.addr=10.96.2.1:33270 target.addr=10.96.2.35:4191}: linkerd_tls::accept: Peeked bytes from TCP stream sz=118
[   151.953047s] DEBUG ThreadId(02) daemon:admin{listen.addr=0.0.0.0:4191}:accept{peer.addr=10.96.2.1:33270 target.addr=10.96.2.35:4191}: linkerd_app_core::serve: Connection closed
[   156.066284s] DEBUG ThreadId(01) outbound: linkerd_cache: Caching new service target=Accept { orig_dst: 10.99.255.76:3306, protocol: () }
[   156.067949s] DEBUG ThreadId(01) outbound:poll_profile: linkerd_service_profiles::client: profile received: DestinationProfile { fully_qualified_name: "demo-maria-mariadb-galera.default.svc.cluster.local", opaque_protocol: true, routes: [], retry_budget: Some(RetryBudget { retry_ratio: 0.2, min_retries_per_second: 10, ttl: Some(Duration { seconds: 10, nanos: 0 }) }), dst_overrides: [], endpoint: None }
[   156.068016s] DEBUG ThreadId(01) outbound:tcp.opaque: linkerd_service_profiles::split: Updating targets=[Target { addr: Name(NameAddr { name: "demo-maria-mariadb-galera.default.svc.cluster.local", port: 3306 }), weight: 1 }]
[   156.068044s] DEBUG ThreadId(01) outbound:tcp.opaque: linkerd_proxy_api_resolve::resolve: Resolving dst=demo-maria-mariadb-galera.default.svc.cluster.local:3306 context={"ns":"default", "nodeName":"gke-nkdev-sweet-kbarkard-default-pool-82d881cf-25tz"}

[   156.068080s] DEBUG ThreadId(01) outbound:poll_profile: linkerd_service_profiles::client: profile received: DestinationProfile { fully_qualified_name: "demo-maria-mariadb-galera.default.svc.cluster.local", opaque_protocol: true, routes: [], retry_budget: Some(RetryBudget { retry_ratio: 0.2, min_retries_per_second: 10, ttl: Some(Duration { seconds: 10, nanos: 0 }) }), dst_overrides: [WeightedDst { authority: "demo-maria-mariadb-galera.default.svc.cluster.local.:3306", weight: 10000 }], endpoint: None }
[   156.068132s] DEBUG ThreadId(01) outbound:poll_profile: linkerd_service_profiles::client: profile received: DestinationProfile { fully_qualified_name: "demo-maria-mariadb-galera.default.svc.cluster.local", opaque_protocol: true, routes: [], retry_budget: Some(RetryBudget { retry_ratio: 0.2, min_retries_per_second: 10, ttl: Some(Duration { seconds: 10, nanos: 0 }) }), dst_overrides: [WeightedDst { authority: "demo-maria-mariadb-galera.default.svc.cluster.local.:3306", weight: 10000 }], endpoint: None }
[   156.068196s] DEBUG ThreadId(01) outbound:tcp.opaque: linkerd_service_profiles::split: Updating targets=[Target { addr: Name(NameAddr { name: "demo-maria-mariadb-galera.default.svc.cluster.local.", port: 3306 }), weight: 10000 }]
[   156.068219s] DEBUG ThreadId(01) outbound:tcp.opaque: linkerd_service_profiles::split: Creating target addr=demo-maria-mariadb-galera.default.svc.cluster.local:3306
[   156.068239s] DEBUG ThreadId(01) outbound:tcp.opaque: linkerd_proxy_api_resolve::resolve: Resolving dst=demo-maria-mariadb-galera.default.svc.cluster.local:3306 context={"ns":"default", "nodeName":"gke-nkdev-sweet-kbarkard-default-pool-82d881cf-25tz"}

[   156.073759s] DEBUG ThreadId(01) outbound:tcp.opaque: linkerd_proxy_api_resolve::resolve: Add endpoints=3
[   156.073881s] DEBUG ThreadId(01) outbound:tcp.opaque:endpoint{peer.addr=10.96.2.26:3306 peer.id=Some("default.default.serviceaccount.identity.linkerd.cluster.local")}: linkerd_app_outbound::tcp::opaque_transport: Using opaque transport header=TransportHeader { port: 3306, name: None } override_port=4143
[   156.073896s] DEBUG ThreadId(01) outbound:tcp.opaque:endpoint{peer.addr=10.96.2.26:3306 peer.id=Some("default.default.serviceaccount.identity.linkerd.cluster.local")}: linkerd_tls::client: Initiating TLS connection peer.identity="default.default.serviceaccount.identity.linkerd.cluster.local"
[   156.073906s] DEBUG ThreadId(01) outbound:tcp.opaque:endpoint{peer.addr=10.96.2.26:3306 peer.id=Some("default.default.serviceaccount.identity.linkerd.cluster.local")}: linkerd_proxy_transport::connect: Connecting peer.addr=10.96.2.26:4143
[   156.074127s] DEBUG ThreadId(01) outbound:tcp.opaque:endpoint{peer.addr=10.96.2.26:3306 peer.id=Some("default.default.serviceaccount.identity.linkerd.cluster.local")}: linkerd_proxy_transport::connect: Connected local.addr=10.96.2.35:56668 keepalive=Some(10s)
[   156.074618s] DEBUG ThreadId(01) outbound:tcp.opaque:endpoint{peer.addr=10.96.2.26:3306 peer.id=Some("default.default.serviceaccount.identity.linkerd.cluster.local")}: linkerd_app_outbound::tcp::opaque_transport: Wrote header to transport sz=30
[   156.074634s] DEBUG ThreadId(01) outbound:tcp.opaque:endpoint{peer.addr=10.96.2.26:3306 peer.id=Some("default.default.serviceaccount.identity.linkerd.cluster.local")}: linkerd_proxy_transport::metrics: client connection open
[   156.077416s] DEBUG ThreadId(01) outbound:accept{peer.addr=10.96.2.35:49956 target.addr=10.99.255.76:3306}: linkerd_app_core::serve: Connection closed
[   156.077444s] DEBUG ThreadId(01) evict{target=Accept { orig_dst: 10.99.255.76:3306, protocol: () }}: linkerd_cache: Awaiting idleness
[   156.136328s] DEBUG ThreadId(02) daemon:admin{listen.addr=0.0.0.0:4191}:accept{peer.addr=10.96.2.1:33300 target.addr=10.96.2.35:4191}: linkerd_tls::accept: Peeked bytes from TCP stream sz=117
[   156.136611s] DEBUG ThreadId(02) daemon:admin{listen.addr=0.0.0.0:4191}:accept{peer.addr=10.96.2.1:33300 target.addr=10.96.2.35:4191}: linkerd_app_core::serve: Connection closed
[   158.051834s] DEBUG ThreadId(01) dst: linkerd_dns: resolve_srv name=linkerd-dst-headless.linkerd.svc.cluster.local
[   158.068092s] DEBUG ThreadId(01) dst: linkerd_dns: resolve_a name=linkerd-dst-headless.linkerd.svc.cluster.local
[   158.092469s] DEBUG ThreadId(01) dst: linkerd_proxy_dns_resolve: addrs=[10.96.2.23:8086]
[   161.078720s] DEBUG ThreadId(01) evict{target=Accept { orig_dst: 10.99.255.76:3306, protocol: () }}: linkerd_cache: Cache entry dropped
[   161.952806s] DEBUG ThreadId(02) daemon:admin{listen.addr=0.0.0.0:4191}:accept{peer.addr=10.96.2.1:33322 target.addr=10.96.2.35:4191}: linkerd_tls::accept: Peeked bytes from TCP stream sz=118
[   161.952997s] DEBUG ThreadId(02) daemon:admin{listen.addr=0.0.0.0:4191}:accept{peer.addr=10.96.2.1:33322 target.addr=10.96.2.35:4191}: linkerd_app_core::serve: Connection closed
[   166.136380s] DEBUG ThreadId(02) daemon:admin{listen.addr=0.0.0.0:4191}:accept{peer.addr=10.96.2.1:33342 target.addr=10.96.2.35:4191}: linkerd_tls::accept: Peeked bytes from TCP stream sz=117
[   166.136578s] DEBUG ThreadId(02) daemon:admin{listen.addr=0.0.0.0:4191}:accept{peer.addr=10.96.2.1:33342 target.addr=10.96.2.35:4191}: linkerd_app_core::serve: Connection closed
[   171.952757s] DEBUG ThreadId(02) daemon:admin{listen.addr=0.0.0.0:4191}:accept{peer.addr=10.96.2.1:33364 target.addr=10.96.2.35:4191}: linkerd_tls::accept: Peeked bytes from TCP stream sz=118
[   171.952934s] DEBUG ThreadId(02) daemon:admin{listen.addr=0.0.0.0:4191}:accept{peer.addr=10.96.2.1:33364 target.addr=10.96.2.35:4191}: linkerd_app_core::serve: Connection closed
[   176.136478s] DEBUG ThreadId(02) daemon:admin{listen.addr=0.0.0.0:4191}:accept{peer.addr=10.96.2.1:33398 target.addr=10.96.2.35:4191}: linkerd_tls::accept: Peeked bytes from TCP stream sz=117
[   176.136679s] DEBUG ThreadId(02) daemon:admin{listen.addr=0.0.0.0:4191}:accept{peer.addr=10.96.2.1:33398 target.addr=10.96.2.35:4191}: linkerd_app_core::serve: Connection closed
[   181.952898s] DEBUG ThreadId(02) daemon:admin{listen.addr=0.0.0.0:4191}:accept{peer.addr=10.96.2.1:33418 target.addr=10.96.2.35:4191}: linkerd_tls::accept: Peeked bytes from TCP stream sz=118
[   181.953072s] DEBUG ThreadId(02) daemon:admin{listen.addr=0.0.0.0:4191}:accept{peer.addr=10.96.2.1:33418 target.addr=10.96.2.35:4191}: linkerd_app_core::serve: Connection closed
[   186.136374s] DEBUG ThreadId(02) daemon:admin{listen.addr=0.0.0.0:4191}:accept{peer.addr=10.96.2.1:33438 target.addr=10.96.2.35:4191}: linkerd_tls::accept: Peeked bytes from TCP stream sz=117
[   186.136546s] DEBUG ThreadId(02) daemon:admin{listen.addr=0.0.0.0:4191}:accept{peer.addr=10.96.2.1:33438 target.addr=10.96.2.35:4191}: linkerd_app_core::serve: Connection closed
[   188.093233s] DEBUG ThreadId(01) dst: linkerd_dns: resolve_srv name=linkerd-dst-headless.linkerd.svc.cluster.local
[   188.111987s] DEBUG ThreadId(01) dst: linkerd_dns: resolve_a name=linkerd-dst-headless.linkerd.svc.cluster.local
[   188.138003s] DEBUG ThreadId(01) dst: linkerd_proxy_dns_resolve: addrs=[10.96.2.23:8086]
[   191.952899s] DEBUG ThreadId(02) daemon:admin{listen.addr=0.0.0.0:4191}:accept{peer.addr=10.96.2.1:33462 target.addr=10.96.2.35:4191}: linkerd_tls::accept: Peeked bytes from TCP stream sz=118
[   191.953152s] DEBUG ThreadId(02) daemon:admin{listen.addr=0.0.0.0:4191}:accept{peer.addr=10.96.2.1:33462 target.addr=10.96.2.35:4191}: linkerd_app_core::serve: Connection closed
[   196.136414s] DEBUG ThreadId(02) daemon:admin{listen.addr=0.0.0.0:4191}:accept{peer.addr=10.96.2.1:33482 target.addr=10.96.2.35:4191}: linkerd_tls::accept: Peeked bytes from TCP stream sz=117
[   196.136606s] DEBUG ThreadId(02) daemon:admin{listen.addr=0.0.0.0:4191}:accept{peer.addr=10.96.2.1:33482 target.addr=10.96.2.35:4191}: linkerd_app_core::serve: Connection closed
[   201.952774s] DEBUG ThreadId(02) daemon:admin{listen.addr=0.0.0.0:4191}:accept{peer.addr=10.96.2.1:33502 target.addr=10.96.2.35:4191}: linkerd_tls::accept: Peeked bytes from TCP stream sz=118
[   201.953048s] DEBUG ThreadId(02) daemon:admin{listen.addr=0.0.0.0:4191}:accept{peer.addr=10.96.2.1:33502 target.addr=10.96.2.35:4191}: linkerd_app_core::serve: Connection closed
[   206.136389s] DEBUG ThreadId(02) daemon:admin{listen.addr=0.0.0.0:4191}:accept{peer.addr=10.96.2.1:33526 target.addr=10.96.2.35:4191}: linkerd_tls::accept: Peeked bytes from TCP stream sz=117
[   206.136579s] DEBUG ThreadId(02) daemon:admin{listen.addr=0.0.0.0:4191}:accept{peer.addr=10.96.2.1:33526 target.addr=10.96.2.35:4191}: linkerd_app_core::serve: Connection closed
[   211.952752s] DEBUG ThreadId(02) daemon:admin{listen.addr=0.0.0.0:4191}:accept{peer.addr=10.96.2.1:33544 target.addr=10.96.2.35:4191}: linkerd_tls::accept: Peeked bytes from TCP stream sz=118
[   211.952947s] DEBUG ThreadId(02) daemon:admin{listen.addr=0.0.0.0:4191}:accept{peer.addr=10.96.2.1:33544 target.addr=10.96.2.35:4191}: linkerd_app_core::serve: Connection closed
[   216.136558s] DEBUG ThreadId(02) daemon:admin{listen.addr=0.0.0.0:4191}:accept{peer.addr=10.96.2.1:33564 target.addr=10.96.2.35:4191}: linkerd_tls::accept: Peeked bytes from TCP stream sz=117
[   216.136763s] DEBUG ThreadId(02) daemon:admin{listen.addr=0.0.0.0:4191}:accept{peer.addr=10.96.2.1:33564 target.addr=10.96.2.35:4191}: linkerd_app_core::serve: Connection closed
[   218.581877s] DEBUG ThreadId(01) outbound: linkerd_cache: Caching new service target=Accept { orig_dst: 10.99.255.76:3306, protocol: () }
[   218.582080s] DEBUG ThreadId(01) dst: linkerd_dns: resolve_srv name=linkerd-dst-headless.linkerd.svc.cluster.local
[   218.585159s] DEBUG ThreadId(01) outbound:poll_profile: linkerd_service_profiles::client: profile received: DestinationProfile { fully_qualified_name: "demo-maria-mariadb-galera.default.svc.cluster.local", opaque_protocol: true, routes: [], retry_budget: Some(RetryBudget { retry_ratio: 0.2, min_retries_per_second: 10, ttl: Some(Duration { seconds: 10, nanos: 0 }) }), dst_overrides: [], endpoint: None }
[   218.585244s] DEBUG ThreadId(01) outbound:tcp.opaque: linkerd_service_profiles::split: Updating targets=[Target { addr: Name(NameAddr { name: "demo-maria-mariadb-galera.default.svc.cluster.local", port: 3306 }), weight: 1 }]
[   218.585267s] DEBUG ThreadId(01) outbound:tcp.opaque: linkerd_proxy_api_resolve::resolve: Resolving dst=demo-maria-mariadb-galera.default.svc.cluster.local:3306 context={"ns":"default", "nodeName":"gke-nkdev-sweet-kbarkard-default-pool-82d881cf-25tz"}

[   218.585901s] DEBUG ThreadId(01) outbound:poll_profile: linkerd_service_profiles::client: profile received: DestinationProfile { fully_qualified_name: "demo-maria-mariadb-galera.default.svc.cluster.local", opaque_protocol: true, routes: [], retry_budget: Some(RetryBudget { retry_ratio: 0.2, min_retries_per_second: 10, ttl: Some(Duration { seconds: 10, nanos: 0 }) }), dst_overrides: [WeightedDst { authority: "demo-maria-mariadb-galera.default.svc.cluster.local.:3306", weight: 10000 }], endpoint: None }
[   218.585948s] DEBUG ThreadId(01) outbound:poll_profile: linkerd_service_profiles::client: profile received: DestinationProfile { fully_qualified_name: "demo-maria-mariadb-galera.default.svc.cluster.local", opaque_protocol: true, routes: [], retry_budget: Some(RetryBudget { retry_ratio: 0.2, min_retries_per_second: 10, ttl: Some(Duration { seconds: 10, nanos: 0 }) }), dst_overrides: [WeightedDst { authority: "demo-maria-mariadb-galera.default.svc.cluster.local.:3306", weight: 10000 }], endpoint: None }
[   218.585973s] DEBUG ThreadId(01) outbound:tcp.opaque: linkerd_service_profiles::split: Updating targets=[Target { addr: Name(NameAddr { name: "demo-maria-mariadb-galera.default.svc.cluster.local.", port: 3306 }), weight: 10000 }]
[   218.585985s] DEBUG ThreadId(01) outbound:tcp.opaque: linkerd_service_profiles::split: Creating target addr=demo-maria-mariadb-galera.default.svc.cluster.local:3306
[   218.586001s] DEBUG ThreadId(01) outbound:tcp.opaque: linkerd_proxy_api_resolve::resolve: Resolving dst=demo-maria-mariadb-galera.default.svc.cluster.local:3306 context={"ns":"default", "nodeName":"gke-nkdev-sweet-kbarkard-default-pool-82d881cf-25tz"}

[   218.592481s] DEBUG ThreadId(01) outbound:tcp.opaque: linkerd_proxy_api_resolve::resolve: Add endpoints=3
[   218.592611s] DEBUG ThreadId(01) outbound:tcp.opaque:endpoint{peer.addr=10.96.0.20:3306 peer.id=Some("default.default.serviceaccount.identity.linkerd.cluster.local")}: linkerd_app_outbound::tcp::opaque_transport: Using opaque transport header=TransportHeader { port: 3306, name: None } override_port=4143
[   218.592630s] DEBUG ThreadId(01) outbound:tcp.opaque:endpoint{peer.addr=10.96.0.20:3306 peer.id=Some("default.default.serviceaccount.identity.linkerd.cluster.local")}: linkerd_tls::client: Initiating TLS connection peer.identity="default.default.serviceaccount.identity.linkerd.cluster.local"
[   218.592641s] DEBUG ThreadId(01) outbound:tcp.opaque:endpoint{peer.addr=10.96.0.20:3306 peer.id=Some("default.default.serviceaccount.identity.linkerd.cluster.local")}: linkerd_proxy_transport::connect: Connecting peer.addr=10.96.0.20:4143
[   218.594067s] DEBUG ThreadId(01) outbound:tcp.opaque:endpoint{peer.addr=10.96.0.20:3306 peer.id=Some("default.default.serviceaccount.identity.linkerd.cluster.local")}: linkerd_proxy_transport::connect: Connected local.addr=10.96.2.35:54522 keepalive=Some(10s)
[   218.596383s] DEBUG ThreadId(01) outbound:tcp.opaque:endpoint{peer.addr=10.96.0.20:3306 peer.id=Some("default.default.serviceaccount.identity.linkerd.cluster.local")}: linkerd_app_outbound::tcp::opaque_transport: Wrote header to transport sz=30
[   218.596411s] DEBUG ThreadId(01) outbound:tcp.opaque:endpoint{peer.addr=10.96.0.20:3306 peer.id=Some("default.default.serviceaccount.identity.linkerd.cluster.local")}: linkerd_proxy_transport::metrics: client connection open
[   218.599690s] DEBUG ThreadId(01) dst: linkerd_dns: resolve_a name=linkerd-dst-headless.linkerd.svc.cluster.local
[   218.600699s] DEBUG ThreadId(01) outbound:accept{peer.addr=10.96.2.35:50234 target.addr=10.99.255.76:3306}: linkerd_app_core::serve: Connection closed
[   218.600769s] DEBUG ThreadId(01) evict{target=Accept { orig_dst: 10.99.255.76:3306, protocol: () }}: linkerd_cache: Awaiting idleness
[   218.629354s] DEBUG ThreadId(01) dst: linkerd_proxy_dns_resolve: addrs=[10.96.2.23:8086]
```

**Comment by barkardk** [comment]
To add to this just to make sure that the fact that I had opaque ports set on both the client and the server was not causing issues. 
I tested by taking port 3306 out from the annotations in the mysql client that also serves as a database.   
My client (mysql database) annotations
```yaml
        config.linkerd.io/opaque-ports: ""
        config.linkerd.io/proxy-log-level: linkerd=debug,warn
        config.linkerd.io/skip-inbound-ports: ""
        config.linkerd.io/skip-outbound-ports: ""
```
My server (mariadb galera) annotations
```yaml
        config.linkerd.io/opaque-ports: "3306"
        config.linkerd.io/proxy-log-level: linkerd=debug,warn
        config.linkerd.io/skip-inbound-ports: 4567,4568,4444
        config.linkerd.io/skip-outbound-ports: 4567,4568,4444
```
* queries from mysql-client to mariadb-server work just fine 
* queries from mariadb-server to mysql-client get connection error  
```log
ERROR 2013 (HY000): Lost connection to MySQL server at 'reading initial communication packet', system error: 0
```
I used wireshark to verify that I can easily read the payload of the packets between client and server so no TLS

**Comment by barkardk** [comment]
@olix0r  I setup the latest linker-proxy release `v2.129.0`  
I have again tested with both client and server port annotates as opaque. 
Querying the server from the client now times out but in wireshark it looks like the connection is encrypted.  
 
```log
668	160.581763	10.96.2.70	10.96.2.69	TCP	76	34964 → 4143 [SYN] Seq=0 Win=42600 Len=0 MSS=1420 SACK_PERM=1 TSval=548715908 TSecr=0 WS=128
669	160.581796	10.96.2.69	10.96.2.70	TCP	76	4143 → 34964 [SYN, ACK] Seq=0 Ack=1 Win=43648 Len=0 MSS=1420 SACK_PERM=1 TSval=3820010870 TSecr=548715908 WS=128
670	160.581845	10.96.2.70	10.96.2.69	TCP	68	34964 → 4143 [ACK] Seq=1 Ack=1 Win=42624 Len=0 TSval=548715908 TSecr=3820010870
671	160.582068	10.96.2.70	10.96.2.69	TLSv1.2	346	Client Hello
672	160.582093	10.96.2.69	10.96.2.70	TCP	68	4143 → 34964 [ACK] Seq=1 Ack=279 Win=43392 Len=0 TSval=3820010871 TSecr=548715909
673	160.582524	10.96.2.69	10.96.2.70	TLSv1.2	1324	Server Hello, Certificate, Server Key Exchange, Certificate Request, Server Hello Done
674	160.582530	10.96.2.70	10.96.2.69	TCP	68	34964 → 4143 [ACK] Seq=279 Ack=1257 Win=42368 Len=0 TSval=548715909 TSecr=3820010871
675	160.583029	10.96.2.70	10.96.2.69	TLSv1.2	1193	Certificate, Client Key Exchange, Certificate Verify, Change Cipher Spec, Encrypted Handshake Message
676	160.583445	10.96.2.69	10.96.2.70	TLSv1.2	111	Change Cipher Spec, Encrypted Handshake Message
677	160.583578	10.96.2.70	10.96.2.69	TLSv1.2	119	Application Data
678	160.623715	10.96.2.69	10.96.2.70	TCP	68	4143 → 34964 [ACK] Seq=1300 Ack=1455 Win=42368 Len=0 TSval=3820010912 TSecr=548715910
682	163.074230	10.96.2.54	10.96.2.70	TLSv1.2	106	Application Data
683	163.074405	10.96.2.70	10.96.2.54	TLSv1.2	106	Application Data
684	163.114739	10.96.2.54	10.96.2.70	TCP	68	8086 → 59776 [ACK] Seq=2667 Ack=2083 Win=42368 Len=0 TSval=3122458707 TSecr=1874052587
688	165.576792	10.96.2.54	10.96.2.70	TLSv1.2	106	Application Data
689	165.576974	10.96.2.70	10.96.2.54	TLSv1.2	106	Application Data
690	165.577011	10.96.2.54	10.96.2.70	TCP	68	8086 → 59776 [ACK] Seq=2705 Ack=2121 Win=42368 Len=0 TSval=3122461169 TSecr=1874055089
691	165.943710	7e:2c:02:77:25:ed		ARP	44	Who has 10.96.2.70? Tell 10.96.2.69
692	165.943716	7a:75:ba:01:e2:a4		ARP	44	10.96.2.70 is at 7a:75:ba:01:e2:a4
706	168.078164	10.96.2.54	10.96.2.70	TLSv1.2	106	Application Data
707	168.078333	10.96.2.70	10.96.2.54	TLSv1.2	106	Application Data
708	168.078363	10.96.2.54	10.96.2.70	TCP	68	8086 → 59776 [ACK] Seq=2743 Ack=2159 Win=42368 Len=0 TSval=3122463670 TSecr=1874057590
722	170.581196	10.96.2.54	10.96.2.70	TLSv1.2	106	Application Data
723	170.581374	10.96.2.70	10.96.2.54	TLSv1.2	106	Application Data
724	170.581413	10.96.2.54	10.96.2.70	TCP	68	8086 → 59776 [ACK] Seq=2781 Ack=2197 Win=42368 Len=0 TSval=3122466173 TSecr=1874060093
725	170.584452	10.96.2.69	10.96.2.70	TCP	68	4143 → 34964 [FIN, ACK] Seq=1300 Ack=1455 Win=42368 Len=0 TSval=3820020872 TSecr=548715910
726	170.584549	10.99.242.187	10.96.2.70	TCP	68	3306 → 39186 [FIN, ACK] Seq=1 Ack=1 Win=43776 Len=0 TSval=862355425 TSecr=2818501890
727	170.584668	10.96.2.70	127.0.0.1	TCP	68	39186 → 4140 [FIN, ACK] Seq=1 Ack=2 Win=42624 Len=0 TSval=2818511964 TSecr=862355425
728	170.584688	10.99.242.187	10.96.2.70	TCP	68	3306 → 39186 [ACK] Seq=2 Ack=2 Win=43776 Len=0 TSval=862355425 TSecr=2818511964
729	170.584758	10.96.2.70	10.96.2.69	TLSv1.2	91	Encrypted Alert
730	170.584795	10.96.2.69	10.96.2.70	TCP	56	4143 → 34964 [RST] Seq=1301 Win=0 Len=0
``` 
After what loks like a succesfull handshake and key exchange to start communicating using encryption  the server sends a RST package and ends the communication 
my sql query from the client 
```bash
kubectl exec -it mysql-567bcf9c7d-vmktk -- mysql -h demo-mb-mariadb-galera -uroot -password -e 'SHOW databases;' -c mysql
Defaulting container name to mysql.
Use 'kubectl describe pod/mysql-567bcf9c7d-vmktk -n default' to see all of the containers in this pod.
mysql: [Warning] Using a password on the command line interface can be insecure.
ERROR 2013 (HY000): Lost connection to MySQL server at 'reading initial communication packet', system error: 0
command terminated with exit code 1
```
Wireshark shows I got a RST package from the galera cluster 
```log
Frame 730: 56 bytes on wire (448 bits), 56 bytes captured (448 bits) on interface -, id 0
Linux cooked capture v1
Internet Protocol Version 4, Src: 10.96.2.69, Dst: 10.96.2.70
Transmission Control Protocol, Src Port: 4143, Dst Port: 34964, Seq: 1301, Len: 0
    Source Port: 4143
    Destination Port: 34964
    [Stream index: 37]
    [TCP Segment Len: 0]
    Sequence Number: 1301    (relative sequence number)
    Sequence Number (raw): 4111929046
    [Next Sequence Number: 1301    (relative sequence number)]
    Acknowledgment Number: 0
    Acknowledgment number (raw): 0
    0101 .... = Header Length: 20 bytes (5)
    Flags: 0x004 (RST)
        000. .... .... = Reserved: Not set
        ...0 .... .... = Nonce: Not set
        .... 0... .... = Congestion Window Reduced (CWR): Not set
        .... .0.. .... = ECN-Echo: Not set
        .... ..0. .... = Urgent: Not set
        .... ...0 .... = Acknowledgment: Not set
        .... .... 0... = Push: Not set
        .... .... .1.. = Reset: Set
        .... .... ..0. = Syn: Not set
        .... .... ...0 = Fin: Not set
        [TCP Flags: ·········R··]
    Window: 0
    [Calculated window size: 0]
    [Window size scaling factor: 128]
    Checksum: 0xf9e4 [unverified]
    [Checksum Status: Unverified]
    Urgent Pointer: 0
    [Timestamps]
        [Time since first frame in this TCP stream: 10.003032000 seconds]
        [Time since previous frame in this TCP stream: 0.000037000 seconds]
```
And linkerd-proxy on the galera cluster logs this 
```log
demo-mb-mariadb-galera-1 linkerd-proxy [   844.924426s] DEBUG ThreadId(01) inbound:accept{peer.addr=10.96.2.70:36302 target.addr=10.96.2.69:4143}: linkerd_app_inbound::require_identity: client.id=Some(Some(ClientId("default.default.serviceaccount.identity.linkerd.cluster.local")))
demo-mb-mariadb-galera-1 linkerd-proxy [   854.926297s]  INFO ThreadId(01) inbound:accept{peer.addr=10.96.2.70:36302 target.addr=10.96.2.69:4143}: linkerd_app_core::serve: Connection closed error=Protocol detection timeout after: 0B after 10.001593641s
```

**Comment by olix0r** [comment]
@barkardk Thanks. This is extremely helpful.

Do you see this log message on the client side?
https://github.com/linkerd/linkerd2-proxy/blob/0d6471c46e50aad7afdf509b4ecac080c53e56d5/linkerd/app/outbound/src/tcp/opaque_transport.rs#L78

**Comment by barkardk** [comment]
@olix0r  yes I do 
```log
peer.id=Some(ServerId("default.default.serviceaccount.identity.linkerd.cluster.local"))}: linkerd_app_outbound::tcp::opaque_transport: Wrote header to transport sz=30
```
full log from client
```log
mysql-567bcf9c7d-vmktk linkerd-proxy [ 12146.574444s] DEBUG ThreadId(01) outbound: linkerd_timeout::failfast: TCP Server service has become unavailable
mysql-567bcf9c7d-vmktk linkerd-proxy [ 12146.574894s] DEBUG ThreadId(01) dst: linkerd_dns: resolve_srv name=linkerd-dst-headless.linkerd.svc.cluster.local
mysql-567bcf9c7d-vmktk linkerd-proxy [ 12146.587067s] DEBUG ThreadId(01) poll_profile: linkerd_service_profiles::client: profile received: DestinationProfile { fully_qualified_name: "demo-mb-mariadb-galera.default.svc.cluster.local", opaque_protocol: true, routes: [], retry_budget: Some(RetryBudget { retry_ratio: 0.2, min_retries_per_second: 10, ttl: Some(Duration { seconds: 10, nanos: 0 }) }), dst_overrides: [], endpoint: None }
mysql-567bcf9c7d-vmktk linkerd-proxy [ 12146.587207s] DEBUG ThreadId(01) tcp.opaque: linkerd_service_profiles::split: Updating targets=[Target { addr: Name(NameAddr { name: "demo-mb-mariadb-galera.default.svc.cluster.local", port: 3306 }), weight: 1 }]
mysql-567bcf9c7d-vmktk linkerd-proxy [ 12146.587294s] DEBUG ThreadId(01) tcp.opaque: linkerd_proxy_api_resolve::resolve: Resolving dst=demo-mb-mariadb-galera.default.svc.cluster.local:3306 context={"ns":"default", "nodeName":"gke-nkdev-sweet-kbarkard-default-pool-82d881cf-25tz"}
mysql-567bcf9c7d-vmktk linkerd-proxy
mysql-567bcf9c7d-vmktk linkerd-proxy [ 12146.587400s] DEBUG ThreadId(01) poll_profile: linkerd_service_profiles::client: profile received: DestinationProfile { fully_qualified_name: "demo-mb-mariadb-galera.default.svc.cluster.local", opaque_protocol: true, routes: [], retry_budget: Some(RetryBudget { retry_ratio: 0.2, min_retries_per_second: 10, ttl: Some(Duration { seconds: 10, nanos: 0 }) }), dst_overrides: [WeightedDst { authority: "demo-mb-mariadb-galera.default.svc.cluster.local.:3306", weight: 10000 }], endpoint: None }
mysql-567bcf9c7d-vmktk linkerd-proxy [ 12146.587435s] DEBUG ThreadId(01) poll_profile: linkerd_service_profiles::client: profile received: DestinationProfile { fully_qualified_name: "demo-mb-mariadb-galera.default.svc.cluster.local", opaque_protocol: true, routes: [], retry_budget: Some(RetryBudget { retry_ratio: 0.2, min_retries_per_second: 10, ttl: Some(Duration { seconds: 10, nanos: 0 }) }), dst_overrides: [WeightedDst { authority: "demo-mb-mariadb-galera.default.svc.cluster.local.:3306", weight: 10000 }], endpoint: None }
mysql-567bcf9c7d-vmktk linkerd-proxy [ 12146.587491s] DEBUG ThreadId(01) tcp.opaque: linkerd_service_profiles::split: Updating targets=[Target { addr: Name(NameAddr { name: "demo-mb-mariadb-galera.default.svc.cluster.local.", port: 3306 }), weight: 10000 }]
mysql-567bcf9c7d-vmktk linkerd-proxy [ 12146.587503s] DEBUG ThreadId(01) tcp.opaque: linkerd_service_profiles::split: Creating target addr=demo-mb-mariadb-galera.default.svc.cluster.local:3306
mysql-567bcf9c7d-vmktk linkerd-proxy [ 12146.587573s] DEBUG ThreadId(01) tcp.opaque: linkerd_proxy_api_resolve::resolve: Resolving dst=demo-mb-mariadb-galera.default.svc.cluster.local:3306 context={"ns":"default", "nodeName":"gke-nkdev-sweet-kbarkard-default-pool-82d881cf-25tz"}
mysql-567bcf9c7d-vmktk linkerd-proxy
mysql-567bcf9c7d-vmktk linkerd-proxy [ 12146.592247s] DEBUG ThreadId(01) dst: linkerd_dns: resolve_a name=linkerd-dst-headless.linkerd.svc.cluster.local
mysql-567bcf9c7d-vmktk linkerd-proxy [ 12146.599188s] DEBUG ThreadId(01) tcp.opaque: linkerd_proxy_api_resolve::resolve: Add endpoints=3
mysql-567bcf9c7d-vmktk linkerd-proxy [ 12146.599437s] DEBUG ThreadId(01) tcp.opaque:endpoint{peer.addr=10.96.0.55:3306 peer.id=Some(ServerId("default.default.serviceaccount.identity.linkerd.cluster.local"))}: linkerd_app_outbound::tcp::opaque_transport: Using opaque transport header=TransportHeader { port: 3306, name: None } override_port=4143
mysql-567bcf9c7d-vmktk linkerd-proxy [ 12146.599459s] DEBUG ThreadId(01) tcp.opaque:endpoint{peer.addr=10.96.0.55:3306 peer.id=Some(ServerId("default.default.serviceaccount.identity.linkerd.cluster.local"))}: linkerd_tls::client: Initiating TLS connection target.id="default.default.serviceaccount.identity.linkerd.cluster.local"
mysql-567bcf9c7d-vmktk linkerd-proxy [ 12146.599470s] DEBUG ThreadId(01) tcp.opaque:endpoint{peer.addr=10.96.0.55:3306 peer.id=Some(ServerId("default.default.serviceaccount.identity.linkerd.cluster.local"))}: linkerd_proxy_transport::connect: Connecting peer.addr=10.96.0.55:4143
mysql-567bcf9c7d-vmktk linkerd-proxy [ 12146.600913s] DEBUG ThreadId(01) tcp.opaque:endpoint{peer.addr=10.96.0.55:3306 peer.id=Some(ServerId("default.default.serviceaccount.identity.linkerd.cluster.local"))}: linkerd_proxy_transport::connect: Connected local.addr=10.96.2.70:39590 keepalive=Some(10s)
mysql-567bcf9c7d-vmktk linkerd-proxy [ 12146.603161s] DEBUG ThreadId(01) tcp.opaque:endpoint{peer.addr=10.96.0.55:3306 peer.id=Some(ServerId("default.default.serviceaccount.identity.linkerd.cluster.local"))}: linkerd_app_outbound::tcp::opaque_transport: Wrote header to transport sz=30
mysql-567bcf9c7d-vmktk linkerd-proxy [ 12146.603183s] DEBUG ThreadId(01) tcp.opaque:endpoint{peer.addr=10.96.0.55:3306 peer.id=Some(ServerId("default.default.serviceaccount.identity.linkerd.cluster.local"))}: linkerd_proxy_transport::metrics: client connection open
mysql-567bcf9c7d-vmktk linkerd-proxy [ 12146.624759s] DEBUG ThreadId(01) dst: linkerd_proxy_dns_resolve: addrs=[10.96.2.54:8086]
mysql-567bcf9c7d-vmktk linkerd-proxy [ 12153.437099s] DEBUG ThreadId(02) daemon:admin{listen.addr=0.0.0.0:4191}:accept{peer.addr=10.96.2.1:42492 target.addr=10.96.2.70:4191}: linkerd_tls::server: Peeked bytes from TCP stream sz=117
mysql-567bcf9c7d-vmktk linkerd-proxy [ 12153.437453s] DEBUG ThreadId(02) daemon:admin{listen.addr=0.0.0.0:4191}:accept{peer.addr=10.96.2.1:42492 target.addr=10.96.2.70:4191}: linkerd_app_core::serve: Connection closed
mysql-567bcf9c7d-vmktk linkerd-proxy [ 12155.814351s] DEBUG ThreadId(02) daemon:admin{listen.addr=0.0.0.0:4191}:accept{peer.addr=10.96.2.1:42500 target.addr=10.96.2.70:4191}: linkerd_tls::server: Peeked bytes from TCP stream sz=118
mysql-567bcf9c7d-vmktk linkerd-proxy [ 12155.814556s] DEBUG ThreadId(02) daemon:admin{listen.addr=0.0.0.0:4191}:accept{peer.addr=10.96.2.1:42500 target.addr=10.96.2.70:4191}: linkerd_app_core::serve: Connection closed
mysql-567bcf9c7d-vmktk linkerd-proxy [ 12156.606802s] DEBUG ThreadId(01) outbound:accept{peer.addr=10.96.2.70:44330 target.addr=10.99.242.187:3306}: linkerd_app_core::serve: Connection closed
mysql-567bcf9c7d-vmktk linkerd-proxy [ 12156.606857s] DEBUG ThreadId(01) evict{target=Accept { orig_dst: 10.99.242.187:3306, protocol: () }}: linkerd_cache: Awaiting idleness
```

**Comment by olix0r** [comment]
@barkardk How did you build this proxy image? Are you sure it's the release artifact? Or is it possible it included https://github.com/linkerd/linkerd2-proxy/commit/1a7de34ae44e04ce3acc32d10c54ee3032b8e0a3 (which was merged after the release was tag). I just found (and fixed) and issue with that commit that could potentially cause the behavior you're seeing..

**Comment by barkardk** [comment]
Ah yes you are correct , it is built using the 1a7de34 merge.  Ill update to include your fix and rerun

**Comment by barkardk** [comment]
@olix0r  I have now verified  
I used the latest linkerd-proxy and I installed linkerd-edge-21.1.3 
mysql queries look encrypted now 
```bash
❯ linkerd-edge-21.1.3 viz edges po
SRC                                   DST                        SRC_NS        DST_NS    SECURED
mysql-66786cd89c-js5sm                demo-mb-mariadb-galera-1   default       default   √
mysql-66786cd89c-js5sm                demo-mb-mariadb-galera-2   default       default   √
```
Thank you so much for the fantastic work

**Comment by olix0r** [comment]
Thanks @barkardk. I'm also improving some of our test apps to exercise this behavior. E.g. https://github.com/olix0r/tcp-echo/commit/975d4a97c47ef6bb9b05f9ed665a2b8bf342adca
