### ISSUE TITLE
linkerd-proxy does not close socket for misbehaved TCP client

### ISSUE THREAD

**Issue by yangl900** [linkerd/linkerd2#5180]
### What is the issue?
We see lots of leaked connections from linkerd-proxy, it seems always leaks in a pair, that the socket for inbound stayed in `FIN_WAIT2` and the socket for localhost (outbound) stayed in `CLOSE_WAIT`.

This only happens when server sends FIN and client only send ACK but did not send second FIN/ACK, and possibly only SSL traffic (so pass-through).

Our setup is same as described in issue #3403 , the inbound traffic is HTTPS and lands on nginx ingress pod that does SSL termination. The problem happens in the nginx pod sidecar.

Inside the nginx pod with sidecar, if we do netstat, we can see the stuck sockets in above 2 states, and it will grow over time:
```bash
root@nginx-ingress-controller-5b7ffd475f-nvhmp:/# netstat -tn | grep FIN_WAIT2 | wc -l
1196

root@nginx-ingress-controller-5b7ffd475f-nvhmp:/# netstat -tn | grep CLOSE_WAIT | wc -l
1198
```

All FIN_WAIT2 connections are from external clients to linkerd side car linkerd-proxy (port 4143, linkerd-proxy as server side)

```
tcp        0      0 172.31.47.207:4143      52.253.153.38:4442      FIN_WAIT2
tcp        0      0 172.31.47.207:4143      20.39.19.11:41684       FIN_WAIT2
tcp        0      0 172.31.47.207:4143      52.253.224.182:12656    FIN_WAIT2
tcp        0      0 172.31.47.207:4143      20.39.6.61:6161         FIN_WAIT2
```

All CLOSE_WAIT connections are from linkerd-proxy to nginx (destination port 443, linkerd-proxy as client side)
```
tcp        0      0 127.0.0.1:32988         127.0.0.1:443           CLOSE_WAIT
tcp        0      0 127.0.0.1:39374         127.0.0.1:443           CLOSE_WAIT
tcp        0      0 127.0.0.1:45830         127.0.0.1:443           CLOSE_WAIT
tcp        0      0 127.0.0.1:48946         127.0.0.1:443           CLOSE_WAIT
tcp        0      0 127.0.0.1:40082         127.0.0.1:443           CLOSE_WAIT
```

If we pick one that is in FIN_WAIT2 state, we can see client is still sending keepalive ACK and server side still ACK back.

```
root@nginx-ingress-controller-5b7ffd475f-nvhmp:/# netstat -o -n | grep 4223
tcp        0      0 172.31.47.207:4143      20.39.7.103:4223        FIN_WAIT2   keepalive (30.88/0/0)

root@nginx-ingress-controller-5b7ffd475f-nvhmp:/# tcpdump -nn -i any port 4223
tcpdump: verbose output suppressed, use -v or -vv for full protocol decode
listening on any, link-type LINUX_SLL (Linux cooked), capture size 262144 bytes
00:43:23.789502 IP 20.39.7.103.4223 > 172.31.47.207.443: Flags [.], ack 543308295, win 501, options [nop,nop,TS val 623341075 ecr 2568407810], length 0
00:43:23.789546 IP 172.31.47.207.443 > 20.39.7.103.4223: Flags [.], ack 1, win 501, options [nop,nop,TS val 2568422914 ecr 623324422], length 0
00:43:38.893597 IP 20.39.7.103.4223 > 172.31.47.207.443: Flags [.], ack 1, win 501, options [nop,nop,TS val 623356179 ecr 2568422914], length 0
00:43:38.893613 IP 172.31.47.207.443 > 20.39.7.103.4223: Flags [.], ack 1, win 501, options [nop,nop,TS val 2568438018 ecr 623324422], length 0
00:43:53.997629 IP 20.39.7.103.4223 > 172.31.47.207.443: Flags [.], ack 1, win 501, options [nop,nop,TS val 623371283 ecr 2568438018], length 0
00:43:53.997674 IP 172.31.47.207.443 > 20.39.7.103.4223: Flags [.], ack 1, win 501, options [nop,nop,TS val 2568453122 ecr 623324422], length 0
```

We believe the "upstream" connection (linkerd-proxy as client) is now in CLOSE_WAIT state. And also, we can see the socket that was hold by nginx (as server side) has been closed already.

For example, an healthy, established socket has 2 entries:
```
root@nginx-ingress-controller-5b7ffd475f-wktzx:/# ss -p | grep 53792
tcp   ESTAB      0      0               127.0.0.1:443                 127.0.0.1:53792
tcp   ESTAB      0      0               127.0.0.1:53792               127.0.0.1:443
```

But the stuck socket only as client side left open:
```
root@nginx-ingress-controller-5b7ffd475f-wktzx:/# ss | grep 59514
tcp   CLOSE-WAIT 0      0               127.0.0.1:59514               127.0.0.1:443
```

We captured one traffic from external client (the inbound SSL traffic). We can see that server side sent FIN, client ACK'ed but did not send FIN back. Instead, it kept sending the keepalive forever.

```
tcpdump: verbose output suppressed, use -v or -vv for full protocol decode
listening on eth0, link-type EN10MB (Ethernet), capture size 262144 bytes
22:13:10.167826 IP nginx-ingress-controller-569bd4d58-9tlxd.443 > 52.253.224.182.12530: Flags [P.], seq 1:32, ack 1, win 501, options [nop,nop,TS val 2894503596 ecr 1128950321], length 31
22:13:10.167926 IP nginx-ingress-controller-569bd4d58-9tlxd.443 > 52.253.224.182.12530: Flags [F.], seq 32, ack 1, win 501, options [nop,nop,TS val 2894503596 ecr 1128950321], length 0
22:13:10.168046 IP 52.253.224.182.12530 > nginx-ingress-controller-569bd4d58-9tlxd.443: Flags [.], ack 32, win 501, options [nop,nop,TS val 1129015324 ecr 2894503596], length 0
22:13:10.211606 IP 52.253.224.182.12530 > nginx-ingress-controller-569bd4d58-9tlxd.443: Flags [.], ack 33, win 501, options [nop,nop,TS val 1129015368 ecr 2894503596], length 0
22:13:20.563658 IP nginx-ingress-controller-569bd4d58-9tlxd.443 > 52.253.224.182.12530: Flags [.], ack 1, win 501, options [nop,nop,TS val 2894513992 ecr 1129015368], length 0
22:13:20.563951 IP 52.253.224.182.12530 > nginx-ingress-controller-569bd4d58-9tlxd.443: Flags [.], ack 33, win 501, options [nop,nop,TS val 1129025720 ecr 2894503596], length 0
22:13:25.223802 IP 52.253.224.182.12530 > nginx-ingress-controller-569bd4d58-9tlxd.443: Flags [.], ack 33, win 501, options [nop,nop,TS val 1129030380 ecr 2894503596], length 0
22:13:25.223812 IP nginx-ingress-controller-569bd4d58-9tlxd.443 > 52.253.224.182.12530: Flags [.], ack 1, win 501, options [nop,nop,TS val 2894518652 ecr 1129025720], length 0
```

I can also see if the client sends FIN/ACK back, the socket will be closed properly. 

Based on the symptom we saw, I suspect this is a bug in the linkerd-proxy. The workaround for us is also straightforward, we added the nginx 443 to `--skip-inbound-ports` so that inbound does not go through the proxy. The issue is gone after that.

However, this is still a concern that the sidecar proxy could potentially be DDoS by a bad client and leak the socket.

### How can it be reproduced?
Enable linkerd on an nginx ingress with SSL termination, when server close the connection, client side only ACK but not sending FIN/ACK.

### Logs, error output, etc

(If the output is long, please create a [gist](https://gist.github.com/) and
paste the link here.)

#### `linkerd check` output

```text
kubernetes-api
--------------
√ can initialize the client
√ can query the Kubernetes API
kubernetes-version
------------------
√ is running the minimum Kubernetes API version
√ is running the minimum kubectl version
linkerd-existence
-----------------
√ 'linkerd-config' config map exists
√ heartbeat ServiceAccount exist
√ control plane replica sets are ready
√ no unschedulable pods
√ controller pod is running
√ can initialize the client
√ can query the control plane API
linkerd-config
--------------
√ control plane Namespace exists
```

### Environment

- Kubernetes Version: 1.15.11
- Cluster Environment: (GKE, AKS, kops, ...) self-hosted
- Host OS: Ubuntu
- Linkerd version: stable-2.8.1

### Additional context
we thought about `net.ipv4.tcp_fin_timeout` setting, that value is the default value (60s) in our environment. However, the connection stayed in FIN_WAIT2 forever.
