### ISSUE TITLE
Network connectivity blocked for when connecting with an upstream that uses a server-first protocol

### ISSUE THREAD

**Issue by fullykubed** [linkerd/linkerd2#13364]
### What is the issue?

UPDATE: This appears to affect any service trying to communicate with NATS over a linkerd mesh. As long
as the pod initiating the request to NATS is in linkerd mesh and `config.linkerd.io/skip-outbound-ports` is NOT set to `4222`, no network connection can be established with an upstream NATS server. Ideally, we would like to mark 4222 opaque rather than skipping it; however, opaque ports do not fix this issue.

I have deployed Hashicorp Vault with an [external plugin integration.](https://developer.hashicorp.com/vault/docs/plugins/plugin-architecture)

The external plugin runs as a forked process inside the main vault container:

```
PID   USER     TIME  COMMAND
    1 vault     0:00 /bin/sh -ec cp /vault/config/extraconfig-from-values.hcl /tmp/storageconfig.hcl; [
   11 vault     0:00 {docker-entrypoi} /usr/bin/dumb-init /bin/sh /usr/local/bin/docker-entrypoint.sh va
   12 vault     0:01 vault server -config=/tmp/storageconfig.hcl
  102 vault     0:00 sh
  131 vault     0:00 watch -n 1 ps aux
  225 vault     0:00 /plugins/vault-plugin-secrets-nats
  245 vault     0:00 ps aux
```

When the Vault pod has a linkerd proxy injected, the external plugin (`/plugins/vault-plugin-secrets-nats`) starts having connection timeout errors. The plugin works fine without linkerd.

### How can it be reproduced?

1. Deploy linkerd `edge-24.11.2` with native sidecars enabled and using the linkerd CNI
2. Deploy vault 1.14.7 with a plugin integration that makes network requests
3. Inject the linkerd proxy sidecar into the Vault pods
4. Notice that the Vault plugin cannot make network requests

### Logs, error output, etc

Vault - Connectivity Failure Logs

```
vault-1 vault {"@level":"debug","@message":"{\"level\":\"warn\",\"operator\":\"nats-e33f\",\"account\":\"default\",\"error\":\"read tcp 10.0.114.159:60930-\u003e172.20.39.221:4222: i/o timeout\",\"time\":1732228415,\"message\":\"cannot create conection to account server\"}","@module":"secrets.nats-secrets.nats-secrets_b3b73875.nats-secrets.vault-plugin-secrets-nats","@timestamp":"2024-11-21T22:33:35.910136Z"}
```

Vault - linkerd-proxy sidecar logs

```
{"timestamp":"2024-11-21T22:33:35.704774Z","level":"DEBUG","fields":{"message":"Resolving a SRV record","name":"linkerd-policy.linkerd.svc.cluster.local."},"target":"linkerd_dns","threadId":"ThreadId(1)"}
{"timestamp":"2024-11-21T22:33:35.704829Z","level":"DEBUG","fields":{"message":"querying: linkerd-policy.linkerd.svc.cluster.local. SRV"},"target":"hickory_proto::xfer::dns_handle","threadId":"ThreadId(1)"}
{"timestamp":"2024-11-21T22:33:35.704886Z","level":"DEBUG","fields":{"message":"sending request: [Query { name: Name(\"linkerd-policy.linkerd.svc.cluster.local.\"), query_type: SRV, query_class: IN }]"},"target":"hickory_resolver::name_server::name_server_pool","threadId":"ThreadId(1)"}
{"timestamp":"2024-11-21T22:33:35.704906Z","level":"DEBUG","fields":{"message":"existing connection: NameServerConfig { socket_addr: 172.20.0.10:53, protocol: Udp, tls_dns_name: None, trust_negative_responses: false, bind_addr: None }"},"target":"hickory_resolver::name_server::name_server","threadId":"ThreadId(1)"}
{"timestamp":"2024-11-21T22:33:35.704916Z","level":"DEBUG","fields":{"message":"enqueueing message:QUERY:[Query { name: Name(\"linkerd-policy.linkerd.svc.cluster.local.\"), query_type: SRV, query_class: IN }]"},"target":"hickory_proto::xfer","threadId":"ThreadId(1)"}
{"timestamp":"2024-11-21T22:33:35.704939Z","level":"DEBUG","fields":{"message":"final message: ; header 3073:QUERY:RD:NoError:QUERY:0/0/0\n; query\n;; linkerd-policy.linkerd.svc.cluster.local. IN SRV\n"},"target":"hickory_proto::udp::udp_client_stream","threadId":"ThreadId(1)"}
{"timestamp":"2024-11-21T22:33:35.705023Z","level":"DEBUG","fields":{"message":"created socket successfully"},"target":"hickory_proto::udp::udp_stream","threadId":"ThreadId(1)"}
{"timestamp":"2024-11-21T22:33:35.706129Z","level":"DEBUG","fields":{"message":"received message id: 3073"},"target":"hickory_proto::udp::udp_client_stream","threadId":"ThreadId(1)"}
{"timestamp":"2024-11-21T22:33:35.706174Z","level":"DEBUG","fields":{"message":"Response:; header 3073:RESPONSE:RD,AA:NoError:QUERY:2/0/2\n; query\n;; linkerd-policy.linkerd.svc.cluster.local. IN SRV\n; answers 2\nlinkerd-policy.linkerd.svc.cluster.local. 5 IN SRV 0 50 8090 10-0-178-133.linkerd-policy.linkerd.svc.cluster.local.\nlinkerd-policy.linkerd.svc.cluster.local. 5 IN SRV 0 50 8090 10-0-99-124.linkerd-policy.linkerd.svc.cluster.local.\n; nameservers 0\n; additionals 2\n10-0-99-124.linkerd-policy.linkerd.svc.cluster.local. 5 IN A 10.0.99.124\n10-0-178-133.linkerd-policy.linkerd.svc.cluster.local. 5 IN A 10.0.178.133\n"},"target":"hickory_resolver::error","threadId":"ThreadId(1)"}
{"timestamp":"2024-11-21T22:33:35.706209Z","level":"DEBUG","fields":{"message":"Response:; header 3073:RESPONSE:RD,AA:NoError:QUERY:2/0/2\n; query\n;; linkerd-policy.linkerd.svc.cluster.local. IN SRV\n; answers 2\nlinkerd-policy.linkerd.svc.cluster.local. 5 IN SRV 0 50 8090 10-0-178-133.linkerd-policy.linkerd.svc.cluster.local.\nlinkerd-policy.linkerd.svc.cluster.local. 5 IN SRV 0 50 8090 10-0-99-124.linkerd-policy.linkerd.svc.cluster.local.\n; nameservers 0\n; additionals 2\n10-0-99-124.linkerd-policy.linkerd.svc.cluster.local. 5 IN A 10.0.99.124\n10-0-178-133.linkerd-policy.linkerd.svc.cluster.local. 5 IN A 10.0.178.133\n"},"target":"hickory_resolver::error","threadId":"ThreadId(1)"}
{"timestamp":"2024-11-21T22:33:35.706250Z","level":"DEBUG","fields":{"ttl":"4.999988087s","addrs":"[10.0.178.133:8090, 10.0.99.124:8090]"},"target":"linkerd_dns","threadId":"ThreadId(1)"}
{"timestamp":"2024-11-21T22:33:35.706259Z","level":"DEBUG","fields":{"addrs":"[10.0.178.133:8090, 10.0.99.124:8090]","name":"linkerd-policy.linkerd.svc.cluster.local:8090"},"target":"linkerd_proxy_dns_resolve","threadId":"ThreadId(1)"}
{"timestamp":"2024-11-21T22:33:35.706273Z","level":"DEBUG","fields":{"message":"Discovered","update":"Reset([(10.0.178.133:8090, ()), (10.0.99.124:8090, ())])"},"target":"linkerd_proxy_balance_queue::worker","threadId":"ThreadId(1)"}
{"timestamp":"2024-11-21T22:33:35.706280Z","level":"DEBUG","fields":{"message":"Endpoint unchanged","addr":"10.0.178.133:8090"},"target":"linkerd_pool_p2c","threadId":"ThreadId(1)"}
{"timestamp":"2024-11-21T22:33:35.706286Z","level":"DEBUG","fields":{"message":"Endpoint unchanged","addr":"10.0.99.124:8090"},"target":"linkerd_pool_p2c","threadId":"ThreadId(1)"}
{"timestamp":"2024-11-21T22:33:35.902255Z","level":"DEBUG","fields":{"message":"Could not detect protocol","read":0},"target":"linkerd_proxy_http::detect","threadId":"ThreadId(1)"}
{"timestamp":"2024-11-21T22:33:35.902293Z","level":"DEBUG","fields":{"message":"Detected protocol","protocol":"None","elapsed":"4.995037625s"},"target":"linkerd_detect","threadId":"ThreadId(1)"}
{"timestamp":"2024-11-21T22:33:35.902305Z","level":"DEBUG","fields":{"message":"Using ClientPolicy routes","addr":"nats-e33f.default.svc.cluster.local:4222"},"target":"linkerd_app_outbound::opaq","threadId":"ThreadId(1)"}
{"timestamp":"2024-11-21T22:33:35.902319Z","level":"DEBUG","fields":{"message":"Caching new value","key":"Opaq(OpaqSidecar { orig_dst: OrigDstAddr(172.20.39.221:4222), routes: Receiver { shared: Shared { value: RwLock(PhantomData<std::sync::rwlock::RwLock<linkerd_app_outbound::opaq::logical::Routes>>, RwLock { data: Routes { logical: Logical { meta: ParentRef(Resource { group: \"core\", kind: \"Service\", name: \"nats-e33f\", namespace: \"default\", section: None, port: Some(4222) }), addr: Name(NameAddr { name: Name(\"nats-e33f.default.svc.cluster.local\"), port: 4222 }) }, routes: Some(Route { policy: RoutePolicy { meta: Default { name: \"opaq\" }, filters: ], distribution: FirstAvailable([RouteBackend { filters: ], backend: Backend { meta: Resource { group: \"core\", kind: \"Service\", name: \"nats-e33f\", namespace: \"default\", section: None, port: Some(4222) }, queue: Queue { capacity: 100, failfast_timeout: 3s }, dispatcher: BalanceP2c(PeakEwma(PeakEwma { decay: 10s, default_rtt: 30ms }), DestinationGet { path: \"nats-e33f.default.svc.cluster.local:4222\" }) } }]), params: () } }), backends: [Backend { meta: Resource { group: \"core\", kind: \"Service\", name: \"nats-e33f\", namespace: \"default\", section: None, port: Some(4222) }, queue: Queue { capacity: 100, failfast_timeout: 3s }, dispatcher: BalanceP2c(PeakEwma(PeakEwma { decay: 10s, default_rtt: 30ms }), DestinationGet { path: \"nats-e33f.default.svc.cluster.local:4222\" }) }] } }), version: Version(0), is_closed: false, ref_count_rx: 1 }, version: Version(0) } })"},"target":"linkerd_idle_cache","threadId":"ThreadId(1)"}
{"timestamp":"2024-11-21T22:33:35.902601Z","level":"DEBUG","fields":{"message":"Adding","backend":"Concrete { target: Balance(NameAddr { name: Name(\"nats-e33f.default.svc.cluster.local\"), port: 4222 }, EwmaConfig { default_rtt: 30ms, decay: 10s }), parent: Opaq(OpaqSidecar { orig_dst: OrigDstAddr(172.20.39.221:4222), routes: Receiver { shared: Shared { value: RwLock(PhantomData<std::sync::rwlock::RwLock<linkerd_app_outbound::opaq::logical::Routes>>, RwLock { data: Routes { logical: Logical { meta: ParentRef(Resource { group: \"core\", kind: \"Service\", name: \"nats-e33f\", namespace: \"default\", section: None, port: Some(4222) }), addr: Name(NameAddr { name: Name(\"nats-e33f.default.svc.cluster.local\"), port: 4222 }) }, routes: Some(Route { policy: RoutePolicy { meta: Default { name: \"opaq\" }, filters: ], distribution: FirstAvailable([RouteBackend { filters: ], backend: Backend { meta: Resource { group: \"core\", kind: \"Service\", name: \"nats-e33f\", namespace: \"default\", section: None, port: Some(4222) }, queue: Queue { capacity: 100, failfast_timeout: 3s }, dispatcher: BalanceP2c(PeakEwma(PeakEwma { decay: 10s, default_rtt: 30ms }), DestinationGet { path: \"nats-e33f.default.svc.cluster.local:4222\" }) } }]), params: () } }), backends: [Backend { meta: Resource { group: \"core\", kind: \"Service\", name: \"nats-e33f\", namespace: \"default\", section: None, port: Some(4222) }, queue: Queue { capacity: 100, failfast_timeout: 3s }, dispatcher: BalanceP2c(PeakEwma(PeakEwma { decay: 10s, default_rtt: 30ms }), DestinationGet { path: \"nats-e33f.default.svc.cluster.local:4222\" }) }] } }), version: Version(0), is_closed: false, ref_count_rx: 9 }, version: Version(0) } }), logical: Logical { meta: ParentRef(Resource { group: \"core\", kind: \"Service\", name: \"nats-e33f\", namespace: \"default\", section: None, port: Some(4222) }), addr: Name(NameAddr { name: Name(\"nats-e33f.default.svc.cluster.local\"), port: 4222 }) }, backend_ref: BackendRef(Resource { group: \"core\", kind: \"Service\", name: \"nats-e33f\", namespace: \"default\", section: None, port: Some(4222) }) }"},"target":"linkerd_distribute::cache","threadId":"ThreadId(1)"}
{"timestamp":"2024-11-21T22:33:35.902658Z","level":"DEBUG","fields":{"message":"Resolving"},"target":"linkerd_proxy_balance","threadId":"ThreadId(1)"}
{"timestamp":"2024-11-21T22:33:35.902683Z","level":"DEBUG","fields":{"message":"Spawning p2c pool queue","capacity":10000,"failfast":"3s"},"target":"linkerd_proxy_balance","threadId":"ThreadId(1)"}
{"timestamp":"2024-11-21T22:33:35.902721Z","level":"DEBUG","fields":{"message":"Selected route","meta":"RouteRef(Default { name: \"opaq\" })"},"target":"linkerd_app_outbound::opaq::logical::router","threadId":"ThreadId(1)"}
{"timestamp":"2024-11-21T22:33:35.902730Z","level":"DEBUG","fields":{"message":"New distribution","backends":"FirstAvailable(ServiceKeys { ids: [KeyId { idx: 0 }], keys: {KeyId { idx: 0 }: Backend { route_ref: RouteRef(Default { name: \"opaq\" }), concrete: Concrete { target: Balance(NameAddr { name: Name(\"nats-e33f.default.svc.cluster.local\"), port: 4222 }, EwmaConfig { default_rtt: 30ms, decay: 10s }), parent: Opaq(OpaqSidecar { orig_dst: OrigDstAddr(172.20.39.221:4222), routes: Receiver { shared: Shared { value: RwLock(PhantomData<std::sync::rwlock::RwLock<linkerd_app_outbound::opaq::logical::Routes>>, RwLock { data: Routes { logical: Logical { meta: ParentRef(Resource { group: \"core\", kind: \"Service\", name: \"nats-e33f\", namespace: \"default\", section: None, port: Some(4222) }), addr: Name(NameAddr { name: Name(\"nats-e33f.default.svc.cluster.local\"), port: 4222 }) }, routes: Some(Route { policy: RoutePolicy { meta: Default { name: \"opaq\" }, filters: ], distribution: FirstAvailable([RouteBackend { filters: ], backend: Backend { meta: Resource { group: \"core\", kind: \"Service\", name: \"nats-e33f\", namespace: \"default\", section: None, port: Some(4222) }, queue: Queue { capacity: 100, failfast_timeout: 3s }, dispatcher: BalanceP2c(PeakEwma(PeakEwma { decay: 10s, default_rtt: 30ms }), DestinationGet { path: \"nats-e33f.default.svc.cluster.local:4222\" }) } }]), params: () } }), backends: [Backend { meta: Resource { group: \"core\", kind: \"Service\", name: \"nats-e33f\", namespace: \"default\", section: None, port: Some(4222) }, queue: Queue { capacity: 100, failfast_timeout: 3s }, dispatcher: BalanceP2c(PeakEwma(PeakEwma { decay: 10s, default_rtt: 30ms }), DestinationGet { path: \"nats-e33f.default.svc.cluster.local:4222\" }) }] } }), version: Version(0), is_closed: false, ref_count_rx: 28 }, version: Version(0) } }), logical: Logical { meta: ParentRef(Resource { group: \"core\", kind: \"Service\", name: \"nats-e33f\", namespace: \"default\", section: None, port: Some(4222) }), addr: Name(NameAddr { name: Name(\"nats-e33f.default.svc.cluster.local\"), port: 4222 }) }, backend_ref: BackendRef(Resource { group: \"core\", kind: \"Service\", name: \"nats-e33f\", namespace: \"default\", section: None, port: Some(4222) }) } }} })"},"target":"linkerd_distribute::stack","threadId":"ThreadId(1)"}
{"timestamp":"2024-11-21T22:33:35.902845Z","level":"DEBUG","fields":{"message":"Resolving","dst":"nats-e33f.default.svc.cluster.local:4222","context":"{\"ns\":\"vault\", \"nodeName\":\"ip-10-0-101-156.us-east-2.compute.internal\", \"pod\":\"vault-1\"}\n"},"target":"linkerd_proxy_api_resolve::resolve","threadId":"ThreadId(1)"}
{"timestamp":"2024-11-21T22:33:35.902880Z","level":"DEBUG","fields":{"message":"No ready endpoints"},"target":"linkerd_pool_p2c","threadId":"ThreadId(1)"}
{"timestamp":"2024-11-21T22:33:35.902951Z","level":"DEBUG","fields":{"message":"No ready endpoints"},"target":"linkerd_pool_p2c","threadId":"ThreadId(1)"}
{"timestamp":"2024-11-21T22:33:35.902978Z","level":"DEBUG","fields":{"message":"send","frame":"Headers { stream_id: StreamId(37), flags: (0x4: END_HEADERS) }"},"target":"h2::codec::framed_write","threadId":"ThreadId(1)"}
{"timestamp":"2024-11-21T22:33:35.902997Z","level":"DEBUG","fields":{"message":"send","frame":"Data { stream_id: StreamId(37) }"},"target":"h2::codec::framed_write","threadId":"ThreadId(1)"}
{"timestamp":"2024-11-21T22:33:35.903004Z","level":"DEBUG","fields":{"message":"send","frame":"Data { stream_id: StreamId(37), flags: (0x1: END_STREAM) }"},"target":"h2::codec::framed_write","threadId":"ThreadId(1)"}
{"timestamp":"2024-11-21T22:33:35.904322Z","level":"DEBUG","fields":{"message":"received","frame":"Headers { stream_id: StreamId(37), flags: (0x4: END_HEADERS) }"},"target":"h2::codec::framed_read","threadId":"ThreadId(1)"}
{"timestamp":"2024-11-21T22:33:35.904377Z","level":"DEBUG","fields":{"message":"received","frame":"Data { stream_id: StreamId(37) }"},"target":"h2::codec::framed_read","threadId":"ThreadId(1)"}
{"timestamp":"2024-11-21T22:33:35.904524Z","level":"DEBUG","fields":{"message":"Add","endpoints":"3"},"target":"linkerd_proxy_api_resolve::resolve","threadId":"ThreadId(1)"}
{"timestamp":"2024-11-21T22:33:35.904537Z","level":"DEBUG","fields":{"message":"Discovered","update":"Reset([(10.0.101.57:4222, Metadata { labels: {\"control_plane_ns\": \"linkerd\", \"namespace\": \"default\", \"pod\": \"nats-e33f-0\", \"service\": \"nats-e33f\", \"serviceaccount\": \"nats-e33f\", \"statefulset\": \"nats-e33f\", \"zone\": \"us-east-2a\", \"zone_locality\": \"local\"}, weight: 10000, protocol_hint: Http2, tagged_transport_port: None, identity: Some(ClientTls { server_name: ServerName(Name(\"nats-e33f.default.serviceaccount.identity.linkerd.cluster.local\")), server_id: ServerId(Dns(Name(\"nats-e33f.default.serviceaccount.identity.linkerd.cluster.local\"))), alpn: None }), authority_override: None, http2: ClientParams { flow_control: None, keep_alive: Some(ClientKeepAlive { interval: 10s, timeout: 3s, while_idle: true }), max_concurrent_reset_streams: None, max_frame_size: None, max_send_buf_size: None }, is_zone_local: Some(true) }), (10.0.181.53:4222, Metadata { labels: {\"control_plane_ns\": \"linkerd\", \"namespace\": \"default\", \"pod\": \"nats-e33f-2\", \"service\": \"nats-e33f\", \"serviceaccount\": \"nats-e33f\", \"statefulset\": \"nats-e33f\", \"zone\": \"us-east-2b\", \"zone_locality\": \"remote\"}, weight: 10000, protocol_hint: Http2, tagged_transport_port: None, identity: Some(ClientTls { server_name: ServerName(Name(\"nats-e33f.default.serviceaccount.identity.linkerd.cluster.local\")), server_id: ServerId(Dns(Name(\"nats-e33f.default.serviceaccount.identity.linkerd.cluster.local\"))), alpn: None }), authority_override: None, http2: ClientParams { flow_control: None, keep_alive: Some(ClientKeepAlive { interval: 10s, timeout: 3s, while_idle: true }), max_concurrent_reset_streams: None, max_frame_size: None, max_send_buf_size: None }, is_zone_local: Some(false) }), (10.0.243.151:4222, Metadata { labels: {\"control_plane_ns\": \"linkerd\", \"namespace\": \"default\", \"pod\": \"nats-e33f-1\", \"service\": \"nats-e33f\", \"serviceaccount\": \"nats-e33f\", \"statefulset\": \"nats-e33f\", \"zone\": \"us-east-2c\", \"zone_locality\": \"remote\"}, weight: 10000, protocol_hint: Http2, tagged_transport_port: None, identity: Some(ClientTls { server_name: ServerName(Name(\"nats-e33f.default.serviceaccount.identity.linkerd.cluster.local\")), server_id: ServerId(Dns(Name(\"nats-e33f.default.serviceaccount.identity.linkerd.cluster.local\"))), alpn: None }), authority_override: None, http2: ClientParams { flow_control: None, keep_alive: Some(ClientKeepAlive { interval: 10s, timeout: 3s, while_idle: true }), max_concurrent_reset_streams: None, max_frame_size: None, max_send_buf_size: None }, is_zone_local: Some(false) })])"},"target":"linkerd_proxy_balance_queue::worker","threadId":"ThreadId(1)"}
{"timestamp":"2024-11-21T22:33:35.904629Z","level":"INFO","fields":{"message":"Adding endpoint","addr":"10.0.101.57:4222"},"target":"linkerd_pool_p2c","threadId":"ThreadId(1)"}
{"timestamp":"2024-11-21T22:33:35.904645Z","level":"INFO","fields":{"message":"Adding endpoint","addr":"10.0.181.53:4222"},"target":"linkerd_pool_p2c","threadId":"ThreadId(1)"}
{"timestamp":"2024-11-21T22:33:35.904680Z","level":"INFO","fields":{"message":"Adding endpoint","addr":"10.0.243.151:4222"},"target":"linkerd_pool_p2c","threadId":"ThreadId(1)"}
{"timestamp":"2024-11-21T22:33:35.904716Z","level":"DEBUG","fields":{"message":"Connecting","server.addr":"10.0.101.57:4222"},"target":"linkerd_proxy_transport::connect","threadId":"ThreadId(1)"}
{"timestamp":"2024-11-21T22:33:35.905441Z","level":"DEBUG","fields":{"message":"Connected","local.addr":"10.0.114.159:50474","keepalive":"Some(10s)"},"target":"linkerd_proxy_transport::connect","threadId":"ThreadId(1)"}
{"timestamp":"2024-11-21T22:33:35.905492Z","level":"DEBUG","fields":{"message":"No cached session for DnsName(\"nats-e33f.default.serviceaccount.identity.linkerd.cluster.local\")","log.target":"rustls::client::hs","log.module_path":"rustls::client::hs","log.file":"/usr/local/cargo/registry/src/index.crates.io-6f17d22bba15001f/rustls-0.21.12/src/client/hs.rs","log.line":73},"target":"rustls::client::hs","threadId":"ThreadId(1)"}
{"timestamp":"2024-11-21T22:33:35.905635Z","level":"DEBUG","fields":{"message":"Not resuming any session","log.target":"rustls::client::hs","log.module_path":"rustls::client::hs","log.file":"/usr/local/cargo/registry/src/index.crates.io-6f17d22bba15001f/rustls-0.21.12/src/client/hs.rs","log.line":132},"target":"rustls::client::hs","threadId":"ThreadId(1)"}
{"timestamp":"2024-11-21T22:33:35.906393Z","level":"DEBUG","fields":{"message":"Using ciphersuite TLS13_CHACHA20_POLY1305_SHA256","log.target":"rustls::client::hs","log.module_path":"rustls::client::hs","log.file":"/usr/local/cargo/registry/src/index.crates.io-6f17d22bba15001f/rustls-0.21.12/src/client/hs.rs","log.line":615},"target":"rustls::client::hs","threadId":"ThreadId(1)"}
{"timestamp":"2024-11-21T22:33:35.906421Z","level":"DEBUG","fields":{"message":"Not resuming","log.target":"rustls::client::tls13","log.module_path":"rustls::client::tls13","log.file":"/usr/local/cargo/registry/src/index.crates.io-6f17d22bba15001f/rustls-0.21.12/src/client/tls13.rs","log.line":142},"target":"rustls::client::tls13","threadId":"ThreadId(1)"}
{"timestamp":"2024-11-21T22:33:35.907166Z","level":"DEBUG","fields":{"message":"TLS1.3 encrypted extensions: [ServerNameAck]","log.target":"rustls::client::tls13","log.module_path":"rustls::client::tls13","log.file":"/usr/local/cargo/registry/src/index.crates.io-6f17d22bba15001f/rustls-0.21.12/src/client/tls13.rs","log.line":381},"target":"rustls::client::tls13","threadId":"ThreadId(1)"}
{"timestamp":"2024-11-21T22:33:35.907211Z","level":"DEBUG","fields":{"message":"ALPN protocol is None","log.target":"rustls::client::hs","log.module_path":"rustls::client::hs","log.file":"/usr/local/cargo/registry/src/index.crates.io-6f17d22bba15001f/rustls-0.21.12/src/client/hs.rs","log.line":472},"target":"rustls::client::hs","threadId":"ThreadId(1)"}
{"timestamp":"2024-11-21T22:33:35.907239Z","level":"DEBUG","fields":{"message":"Got CertificateRequest CertificateRequestPayloadTLS13 { context: , extensions: [SignatureAlgorithms([ECDSA_NISTP384_SHA384, ECDSA_NISTP256_SHA256, ED25519, RSA_PSS_SHA512, RSA_PSS_SHA384, RSA_PSS_SHA256, RSA_PKCS1_SHA512, RSA_PKCS1_SHA384, RSA_PKCS1_SHA256]), AuthorityNames([DistinguishedName(306531123010060355040a130970616e66616374756d31143012060355040b130b656e67696e656572696e673139303706035504031330687474703a2f2f7661756c742d6163746976652e7661756c742e7376632e636c75737465722e6c6f63616c3a38323030)])] }","log.target":"rustls::client::tls13","log.module_path":"rustls::client::tls13","log.file":"/usr/local/cargo/registry/src/index.crates.io-6f17d22bba15001f/rustls-0.21.12/src/client/tls13.rs","log.line":538},"target":"rustls::client::tls13","threadId":"ThreadId(1)"}
{"timestamp":"2024-11-21T22:33:35.907420Z","level":"DEBUG","fields":{"message":"Attempting client auth","log.target":"rustls::client::common","log.module_path":"rustls::client::common","log.file":"/usr/local/cargo/registry/src/index.crates.io-6f17d22bba15001f/rustls-0.21.12/src/client/common.rs","log.line":100},"target":"rustls::client::common","threadId":"ThreadId(1)"}
{"timestamp":"2024-11-21T22:33:35.908499Z","level":"DEBUG","fields":{},"target":"linkerd_tls::client","threadId":"ThreadId(1)"}
{"timestamp":"2024-11-21T22:33:35.908517Z","level":"DEBUG","fields":{"message":"client connection open"},"target":"linkerd_transport_metrics::client","threadId":"ThreadId(1)"}
{"timestamp":"2024-11-21T22:33:35.908575Z","level":"DEBUG","fields":{"message":"Sending warning alert CloseNotify","log.target":"rustls::common_state","log.module_path":"rustls::common_state","log.file":"/usr/local/cargo/registry/src/index.crates.io-6f17d22bba15001f/rustls-0.21.12/src/common_state.rs","log.line":498},"target":"rustls::common_state","threadId":"ThreadId(1)"}
{"timestamp":"2024-11-21T22:33:35.910485Z","level":"DEBUG","fields":{"message":"Connection closed","reason":"logical service nats-e33f.default.svc.cluster.local:4222: route default.opaq: server: Transport endpoint is not connected (os error 107)","client.addr":"10.0.114.159:60930","server.addr":"172.20.39.221:4222"},"target":"linkerd_app_core::serve","threadId":"ThreadId(1)"}
{"timestamp":"2024-11-21T22:33:35.910600Z","level":"DEBUG","fields":{"message":"Awaiting idleness"},"target":"linkerd_idle_cache","threadId":"ThreadId(1)"}
{"timestamp":"2024-11-21T22:33:35.944719Z","level":"DEBUG","fields":{"service.ready":true,"message":"processing request"},"target":"tower::buffer::worker","threadId":"ThreadId(1)"}
{"timestamp":"2024-11-21T22:33:37.616785Z","level":"DEBUG","fields":{"message":"Peeked bytes from TCP stream","sz":0},"target":"linkerd_tls::server","threadId":"ThreadId(2)"}
{"timestamp":"2024-11-21T22:33:37.616850Z","level":"DEBUG","fields":{"message":"Attempting to buffer TLS ClientHello after incomplete peek"},"target":"linkerd_tls::server","threadId":"ThreadId(2)"}
{"timestamp":"2024-11-21T22:33:37.616856Z","level":"DEBUG","fields":{"message":"Reading bytes from TCP stream","buf.capacity":"8192"},"target":"linkerd_tls::server","threadId":"ThreadId(2)"}
{"timestamp":"2024-11-21T22:33:37.616863Z","level":"DEBUG","fields":{"message":"Read bytes from TCP stream","buf.len":"110"},"target":"linkerd_tls::server","threadId":"ThreadId(2)"}
{"timestamp":"2024-11-21T22:33:37.616884Z","level":"DEBUG","fields":{"message":"Detected protocol","protocol":"Some(HTTP/1)","elapsed":"5.284µs"},"target":"linkerd_detect","threadId":"ThreadId(2)"}
{"timestamp":"2024-11-21T22:33:37.616893Z","level":"DEBUG","fields":{"message":"Creating HTTP service","version":"HTTP/1"},"target":"linkerd_proxy_http::server","threadId":"ThreadId(2)"}
{"timestamp":"2024-11-21T22:33:37.616913Z","level":"DEBUG","fields":{"message":"Handling as HTTP","version":"HTTP/1"},"target":"linkerd_proxy_http::server","threadId":"ThreadId(2)"}
{"timestamp":"2024-11-21T22:33:37.616933Z","level":"DEBUG","fields":{"message":"parsed 4 headers"},"target":"hyper::proto::h1::io","threadId":"ThreadId(2)"}
{"timestamp":"2024-11-21T22:33:37.616939Z","level":"DEBUG","fields":{"message":"incoming body is empty"},"target":"hyper::proto::h1::conn","threadId":"ThreadId(2)"}
{"timestamp":"2024-11-21T22:33:37.616957Z","level":"DEBUG","fields":{"message":"Request authorized","server.group":"","server.kind":"default","server.name":"all-unauthenticated","route.group":"","route.kind":"default","route.name":"probe","authz.group":"","authz.kind":"default","authz.name":"probe","client.tls":"None(NoClientHello)","client.ip":"10.0.101.156"},"target":"linkerd_app_inbound::policy::http","threadId":"ThreadId(2)"}
{"timestamp":"2024-11-21T22:33:37.617066Z","level":"DEBUG","fields":{"message":"flushed 107 bytes"},"target":"hyper::proto::h1::io","threadId":"ThreadId(2)"}
{"timestamp":"2024-11-21T22:33:37.617092Z","level":"DEBUG","fields":{"message":"The client is shutting down the connection","res":"Ok(())"},"target":"linkerd_proxy_http::server","threadId":"ThreadId(2)"}
{"timestamp":"2024-11-21T22:33:37.617123Z","level":"DEBUG","fields":{"message":"Connection closed"},"target":"linkerd_app_core::serve","threadId":"ThreadId(2)"}
{"timestamp":"2024-11-21T22:33:37.617138Z","level":"DEBUG","fields":{"message":"Peeked bytes from TCP stream","sz":0},"target":"linkerd_tls::server","threadId":"ThreadId(2)"}
{"timestamp":"2024-11-21T22:33:37.617143Z","level":"DEBUG","fields":{"message":"Attempting to buffer TLS ClientHello after incomplete peek"},"target":"linkerd_tls::server","threadId":"ThreadId(2)"}
{"timestamp":"2024-11-21T22:33:37.617147Z","level":"DEBUG","fields":{"message":"Reading bytes from TCP stream","buf.capacity":"8192"},"target":"linkerd_tls::server","threadId":"ThreadId(2)"}
{"timestamp":"2024-11-21T22:33:37.617153Z","level":"DEBUG","fields":{"message":"Read bytes from TCP stream","buf.len":"109"},"target":"linkerd_tls::server","threadId":"ThreadId(2)"}
{"timestamp":"2024-11-21T22:33:37.617162Z","level":"DEBUG","fields":{"message":"Detected protocol","protocol":"Some(HTTP/1)","elapsed":"2.215µs"},"target":"linkerd_detect","threadId":"ThreadId(2)"}
{"timestamp":"2024-11-21T22:33:37.617168Z","level":"DEBUG","fields":{"message":"Creating HTTP service","version":"HTTP/1"},"target":"linkerd_proxy_http::server","threadId":"ThreadId(2)"}
{"timestamp":"2024-11-21T22:33:37.617179Z","level":"DEBUG","fields":{"message":"Handling as HTTP","version":"HTTP/1"},"target":"linkerd_proxy_http::server","threadId":"ThreadId(2)"}
{"timestamp":"2024-11-21T22:33:37.617189Z","level":"DEBUG","fields":{"message":"parsed 4 headers"},"target":"hyper::proto::h1::io","threadId":"ThreadId(2)"}
{"timestamp":"2024-11-21T22:33:37.617193Z","level":"DEBUG","fields":{"message":"incoming body is empty"},"target":"hyper::proto::h1::conn","threadId":"ThreadId(2)"}
{"timestamp":"2024-11-21T22:33:37.617204Z","level":"DEBUG","fields":{"message":"Request authorized","server.group":"","server.kind":"default","server.name":"all-unauthenticated","route.group":"","route.kind":"default","route.name":"probe","authz.group":"","authz.kind":"default","authz.name":"probe","client.tls":"None(NoClientHello)","client.ip":"10.0.101.156"},"target":"linkerd_app_inbound::policy::http","threadId":"ThreadId(2)"}
{"timestamp":"2024-11-21T22:33:37.617259Z","level":"DEBUG","fields":{"message":"flushed 106 bytes"},"target":"hyper::proto::h1::io","threadId":"ThreadId(2)"}
{"timestamp":"2024-11-21T22:33:37.617278Z","level":"DEBUG","fields":{"message":"The client is shutting down the connection","res":"Ok(())"},"target":"linkerd_proxy_http::server","threadId":"ThreadId(2)"}
{"timestamp":"2024-11-21T22:33:37.617315Z","level":"DEBUG","fields":{"message":"Connection closed"},"target":"linkerd_app_core::serve","threadId":"ThreadId(2)"}
{"timestamp":"2024-11-21T22:33:37.880163Z","level":"DEBUG","fields":{"message":"send","frame":"Ping { ack: false, payload: [59, 124, 219, 122, 11, 135, 22, 180] }"},"target":"h2::codec::framed_write","threadId":"ThreadId(1)"}
{"timestamp":"2024-11-21T22:33:37.882167Z","level":"DEBUG","fields":{"message":"received","frame":"Ping { ack: true, payload: [59, 124, 219, 122, 11, 135, 22, 180] }"},"target":"h2::codec::framed_read","threadId":"ThreadId(1)"}
{"timestamp":"2024-11-21T22:33:37.885333Z","level":"DEBUG","fields":{"message":"received","frame":"Ping { ack: false, payload: [59, 124, 219, 122, 11, 135, 22, 180] }"},"target":"h2::codec::framed_read","threadId":"ThreadId(1)"}
{"timestamp":"2024-11-21T22:33:37.886186Z","level":"DEBUG","fields":{"message":"send","frame":"Ping { ack: true, payload: [59, 124, 219, 122, 11, 135, 22, 180] }"},"target":"h2::codec::framed_write","threadId":"ThreadId(1)"}
```

Upstream Target - Linkerd proxy logs

```
nats-e33f-2 linkerd-proxy {"timestamp":"2024-11-21T22:53:40.950964Z","level":"DEBUG","fields":{"message":"Accepted TLS connection","client.id":"Some(ClientId(Dns(Name(\"vault.vault.serviceaccount.identity.linkerd.cluster.local\"))))","alpn":"None"},"target":"linkerd_meshtls_rustls::server","threadId":"ThreadId(1)"}
nats-e33f-2 linkerd-proxy {"timestamp":"2024-11-21T22:53:40.951024Z","level":"DEBUG","fields":{"message":"Could not detect protocol","read":0},"target":"linkerd_proxy_http::detect","threadId":"ThreadId(1)"}
nats-e33f-2 linkerd-proxy {"timestamp":"2024-11-21T22:53:40.951033Z","level":"DEBUG","fields":{"message":"Detected protocol","protocol":"None","elapsed":"25.05µs"},"target":"linkerd_detect","threadId":"ThreadId(1)"}
nats-e33f-2 linkerd-proxy {"timestamp":"2024-11-21T22:53:40.951044Z","level":"DEBUG","fields":{"message":"Connection authorized","permit":"ServerPermit { dst: OrigDstAddr(10.0.178.135:4222), protocol: Detect { http: [Route { hosts: [], rules: [Rule { matches: [MatchRequest { path: Some(Prefix(\"/\")), headers: [], query_params: [], method: None }], policy: RoutePolicy { meta: Default { name: \"default\" }, authorizations: [Authorization { networks: [Network { net: 0.0.0.0/0, except: [] }, Network { net: ::/0, except: [] }], authentication: Unauthenticated, meta: Default { name: \"all-unauthenticated\" } }, Authorization { networks: [Network { net: 127.0.0.1/32, except: [] }, Network { net: ::1/128, except: [] }], authentication: Unauthenticated, meta: Default { name: \"localhost\" } }], filters: [] } }] }], timeout: 10s, tcp_authorizations: [Authorization { networks: [Network { net: 0.0.0.0/0, except: [] }, Network { net: ::/0, except: [] }], authentication: Unauthenticated, meta: Default { name: \"all-unauthenticated\" } }, Authorization { networks: [Network { net: 127.0.0.1/32, except: [] }, Network { net: ::1/128, except: [] }], authentication: Unauthenticated, meta: Default { name: \"localhost\" } }] }, labels: ServerAuthzLabels { server: ServerLabel(Default { name: \"all-unauthenticated\" }), authz: Default { name: \"all-unauthenticated\" } } }","tls":"Some(Established { client_id: Some(ClientId(Dns(Name(\"vault.vault.serviceaccount.identity.linkerd.cluster.local\")))), negotiated_protocol: None })","client":"10.0.114.159:57206"},"target":"linkerd_app_inbound::policy::tcp","threadId":"ThreadId(1)"}
nats-e33f-2 linkerd-proxy {"timestamp":"2024-11-21T22:53:40.951149Z","level":"DEBUG","fields":{"message":"Connecting","server.addr":"10.0.178.135:4222"},"target":"linkerd_proxy_transport::connect","threadId":"ThreadId(1)"}
nats-e33f-2 linkerd-proxy {"timestamp":"2024-11-21T22:53:40.951315Z","level":"DEBUG","fields":{"message":"Connected","local.addr":"10.0.178.135:60814","keepalive":"None"},"target":"linkerd_proxy_transport::connect","threadId":"ThreadId(1)"}
nats-e33f-2 linkerd-proxy {"timestamp":"2024-11-21T22:53:40.951535Z","level":"DEBUG","fields":{"message":"client connection open"},"target":"linkerd_transport_metrics::client","threadId":"ThreadId(1)"}
nats-e33f-2 linkerd-proxy {"timestamp":"2024-11-21T22:53:40.952279Z","level":"DEBUG","fields":{"message":"Sending warning alert CloseNotify","log.target":"rustls::common_state","log.module_path":"rustls::common_state","log.file":"/usr/local/cargo/registry/src/index.crates.io-6f17d22bba15001f/rustls-0.21.12/src/common_state.rs","log.line":498},"target":"rustls::common_state","threadId":"ThreadId(1)"}
nats-e33f-2 linkerd-proxy {"timestamp":"2024-11-21T22:53:40.952476Z","level":"DEBUG","fields":{"message":"Connection closed"},"target":"linkerd_app_core::serve","threadId":"ThreadId(1)"}
```

### output of `linkerd check -o short`

```
linkerd-cni-plugin
------------------
× cni plugin ConfigMap exists
    configmaps "linkerd-cni-config" not found
    see https://linkerd.io/2/checks/#cni-plugin-cm-exists for hints

linkerd-viz
-----------
‼ linkerd-viz pods are injected
    could not find proxy container for linkerd-cni-6kvsj pod
    see https://linkerd.io/2/checks/#l5d-viz-pods-injection for hints
‼ viz extension proxies are up-to-date
    some proxies are not running the current version:
	* linkerd-destination-6844785b58-87vfv (edge-24.11.2)
	* linkerd-destination-6844785b58-9csrc (edge-24.11.2)
	* linkerd-identity-8b6d99bcc-r7vtx (edge-24.11.2)
	* linkerd-identity-8b6d99bcc-s5pr2 (edge-24.11.2)
	* linkerd-proxy-injector-5d996485c4-qbffn (edge-24.11.2)
	* linkerd-proxy-injector-5d996485c4-vhwmr (edge-24.11.2)
	* metrics-api-85bd4f64d6-48jnl (edge-24.11.2)
	* tap-c495f5677-b5qjg (edge-24.11.2)
	* tap-c495f5677-ptwgh (edge-24.11.2)
	* tap-injector-598bd59c9-4fwx4 (edge-24.11.2)
	* tap-injector-598bd59c9-jf9d6 (edge-24.11.2)
	* web-768896dd8f-6b7sg (edge-24.11.2)
	* web-768896dd8f-vlm5p (edge-24.11.2)
    see https://linkerd.io/2/checks/#l5d-viz-proxy-cp-version for hints
‼ viz extension proxies and cli versions match
    linkerd-destination-6844785b58-87vfv running edge-24.11.2 but cli running edge-24.5.1
    see https://linkerd.io/2/checks/#l5d-viz-proxy-cli-version for hints
‼ prometheus is installed and configured correctly
    missing ClusterRoles: linkerd-linkerd-prometheus
    see https://linkerd.io/2/checks/#l5d-viz-prometheus for hints

Status check results are ×
```

### Environment

- EKS: 1.29
- Linkerd: edge-24.11.2

### Would you like to work on fixing this bug?

None

**Comment by fullykubed** [comment]
Some additional testing that did NOT fix the problem:

- removing the upstream target from the linkerd service mesh
- changing opaque ports to skipped ports on the upstream target


The only thing that appears to fix the problem is removing Vault from the service mesh by disabling the linkerd proxy injection.

**Comment by fullykubed** [comment]
Note that there are ***no*** NetworkPolicy resources or Linkerd CRs installed in the cluster at all that should be impacting this network connection.

**Comment by fullykubed** [comment]
Adding `config.linkerd.io/skip-outbound-ports` to the Vault pods for the relevant ports (4222) also resolves the issue.

Oddly,  `config.linkerd.io/skip-inbound-ports` to the upstream pods and/or services does NOT resolve the issue... this seems very odd b/c shouldn't this be the equivalent of adding `config.linkerd.io/skip-outbound-ports` to Vault?

**Comment by fullykubed** [comment]
Update: Appears to impact *any* pod trying to communicate with NATS as long as the pod is in the service mesh and `config.linkerd.io/skip-outbound-ports` does not have `4222` (the NATS server port) in it.

**Comment by fullykubed** [comment]
Given the above, I have created a simplified scenario that demonstrates the problem:

1. Removed the linkerd-proxy from the NATS nodes
2. I have created a pod that runs `nats account info`. This works when the pod does not have a linkerd-proxy sidecar but fails with a connection timeout if the linkerd-proxy sidecar is present (regardless of whether it is a native sidecar or not).
3. Enabled trace logs on the linkerd-proxy sidecar.

Here are the logs from the sidecar when running `nats account info` from the main container:

```
bastion-7dd45cdc99-rj9mf linkerd-proxy [   217.698127s] DEBUG ThreadId(01) linkerd_service_profiles::client: Resolved profile profile=Profile { addr: Some(LogicalAddr(nats-e33f.default.svc.cluster.local:4222)), http_routes: [], targets: [], opaque_protocol: false, endpoint: None }
bastion-7dd45cdc99-rj9mf linkerd-proxy [   217.698144s] TRACE ThreadId(01) linkerd_stack_tracing: drop
bastion-7dd45cdc99-rj9mf linkerd-proxy [   217.698149s] TRACE ThreadId(01) h2::proto::streams::recv: release_capacity; size=482
bastion-7dd45cdc99-rj9mf linkerd-proxy [   217.698150s] TRACE ThreadId(01) h2::proto::streams::recv: release_connection_capacity; size=482, connection in_flight_data=482
bastion-7dd45cdc99-rj9mf linkerd-proxy [   217.698152s] TRACE ThreadId(01) tower::load::peak_ewma: update peak rtt=8.325225ms prior=0.10201515613079733ms
bastion-7dd45cdc99-rj9mf linkerd-proxy [   217.698203s] DEBUG ThreadId(01) linkerd_app_outbound::policy::api: policy=ClientPolicy { parent: Resource { group: "core", kind: "Service", name: "nats-e33f", namespace: "default", section: None, port: Some(4222) }, protocol: Detect { timeout: 10s, http1: Http1 { routes: [Route { hosts: [], rules: [Rule { matches: [MatchRequest { path: Some(Prefix("/")), headers: [], query_params: [], method: None }], policy: RoutePolicy { meta: Default { name: "http" }, filters: [], distribution: FirstAvailable([RouteBackend { filters: [], backend: Backend { meta: Resource { group: "core", kind: "Service", name: "nats-e33f", namespace: "default", section: None, port: Some(4222) }, queue: Queue { capacity: 100, failfast_timeout: 3s }, dispatcher: BalanceP2c(PeakEwma(PeakEwma { decay: 10s, default_rtt: 30ms }), DestinationGet { path: "nats-e33f.default.svc.cluster.local:4222" }) } }]), params: RouteParams { timeouts: Timeouts { response: None, idle: None, request: None }, retry: None, allow_l5d_request_headers: false } } }] }], failure_accrual: None }, http2: Http2 { routes: [Route { hosts: [], rules: [Rule { matches: [MatchRequest { path: Some(Prefix("/")), headers: [], query_params: [], method: None }], policy: RoutePolicy { meta: Default { name: "http" }, filters: [], distribution: FirstAvailable([RouteBackend { filters: [], backend: Backend { meta: Resource { group: "core", kind: "Service", name: "nats-e33f", namespace: "default", section: None, port: Some(4222) }, queue: Queue { capacity: 100, failfast_timeout: 3s }, dispatcher: BalanceP2c(PeakEwma(PeakEwma { decay: 10s, default_rtt: 30ms }), DestinationGet { path: "nats-e33f.default.svc.cluster.local:4222" }) } }]), params: RouteParams { timeouts: Timeouts { response: None, idle: None, request: None }, retry: None, allow_l5d_request_headers: false } } }] }], failure_accrual: None }, opaque: Opaque { routes: Some(Route { policy: RoutePolicy { meta: Default { name: "opaq" }, filters: [], distribution: FirstAvailable([RouteBackend { filters: [], backend: Backend { meta: Resource { group: "core", kind: "Service", name: "nats-e33f", namespace: "default", section: None, port: Some(4222) }, queue: Queue { capacity: 100, failfast_timeout: 3s }, dispatcher: BalanceP2c(PeakEwma(PeakEwma { decay: 10s, default_rtt: 30ms }), DestinationGet { path: "nats-e33f.default.svc.cluster.local:4222" }) } }]), params: () } }) } }, backends: [Backend { meta: Resource { group: "core", kind: "Service", name: "nats-e33f", namespace: "default", section: None, port: Some(4222) }, queue: Queue { capacity: 100, failfast_timeout: 3s }, dispatcher: BalanceP2c(PeakEwma(PeakEwma { decay: 10s, default_rtt: 30ms }), DestinationGet { path: "nats-e33f.default.svc.cluster.local:4222" }) }] }
bastion-7dd45cdc99-rj9mf linkerd-proxy [   217.698243s] DEBUG ThreadId(01) linkerd_app_outbound::discover: Discovered
bastion-7dd45cdc99-rj9mf linkerd-proxy [   217.698247s] DEBUG ThreadId(01) tower::buffer::worker: service.ready=true processing request
bastion-7dd45cdc99-rj9mf linkerd-proxy [   217.698250s] TRACE ThreadId(01) tower::buffer::worker: returning response future
bastion-7dd45cdc99-rj9mf linkerd-proxy [   217.698252s] TRACE ThreadId(01) tower::buffer::worker: worker polling for next message
bastion-7dd45cdc99-rj9mf linkerd-proxy [   217.698276s] TRACE ThreadId(01) linkerd_stack_tracing: service ready=true ok=true
bastion-7dd45cdc99-rj9mf linkerd-proxy [   217.698284s] TRACE ThreadId(01) linkerd_detect: Starting protocol detection capacity=1024 timeout=10s
bastion-7dd45cdc99-rj9mf linkerd-proxy [   217.698289s] TRACE ThreadId(01) linkerd_proxy_http::detect: Reading capacity=1024
bastion-7dd45cdc99-rj9mf linkerd-proxy [   217.698422s] TRACE ThreadId(01) linkerd_idle_cache: Reset
bastion-7dd45cdc99-rj9mf linkerd-proxy [   217.704319s] TRACE ThreadId(01) linkerd_duplex: poll
bastion-7dd45cdc99-rj9mf linkerd-proxy [   217.705066s] TRACE ThreadId(01) linkerd_duplex: already shutdown direction=client->server
bastion-7dd45cdc99-rj9mf linkerd-proxy [   217.705165s] TRACE ThreadId(01) linkerd_duplex: reading direction=server->client
bastion-7dd45cdc99-rj9mf linkerd-proxy [   217.705638s] TRACE ThreadId(01) linkerd_duplex: read 40B direction=server->client
--
bastion-7dd45cdc99-rj9mf linkerd-proxy [   219.684374s] DEBUG ThreadId(01) linkerd_app_outbound::opaq: Using ClientPolicy routes addr=nats-e33f.default.svc.cluster.local:4222
bastion-7dd45cdc99-rj9mf linkerd-proxy [   219.684386s] DEBUG ThreadId(01) linkerd_idle_cache: Caching new value key=Opaq(OpaqSidecar { orig_dst: OrigDstAddr(172.20.39.221:4222), routes: Receiver { shared: Shared { value: RwLock(PhantomData<std::sync::rwlock::RwLock<linkerd_app_outbound::opaq::logical::Routes>>, RwLock { data: Routes { logical: Logical { meta: ParentRef(Resource { group: "core", kind: "Service", name: "nats-e33f", namespace: "default", section: None, port: Some(4222) }), addr: Name(NameAddr { name: Name("nats-e33f.default.svc.cluster.local"), port: 4222 }) }, routes: Some(Route { policy: RoutePolicy { meta: Default { name: "opaq" }, filters: [], distribution: FirstAvailable([RouteBackend { filters: [], backend: Backend { meta: Resource { group: "core", kind: "Service", name: "nats-e33f", namespace: "default", section: None, port: Some(4222) }, queue: Queue { capacity: 100, failfast_timeout: 3s }, dispatcher: BalanceP2c(PeakEwma(PeakEwma { decay: 10s, default_rtt: 30ms }), DestinationGet { path: "nats-e33f.default.svc.cluster.local:4222" }) } }]), params: () } }), backends: [Backend { meta: Resource { group: "core", kind: "Service", name: "nats-e33f", namespace: "default", section: None, port: Some(4222) }, queue: Queue { capacity: 100, failfast_timeout: 3s }, dispatcher: BalanceP2c(PeakEwma(PeakEwma { decay: 10s, default_rtt: 30ms }), DestinationGet { path: "nats-e33f.default.svc.cluster.local:4222" }) }] } }), version: Version(0), is_closed: false, ref_count_rx: 1 }, version: Version(0) } })
bastion-7dd45cdc99-rj9mf linkerd-proxy [   219.684432s] DEBUG ThreadId(01) linkerd_distribute::cache: Adding backend=Concrete { target: Balance(NameAddr { name: Name("nats-e33f.default.svc.cluster.local"), port: 4222 }, EwmaConfig { default_rtt: 30ms, decay: 10s }), parent: Opaq(OpaqSidecar { orig_dst: OrigDstAddr(172.20.39.221:4222), routes: Receiver { shared: Shared { value: RwLock(PhantomData<std::sync::rwlock::RwLock<linkerd_app_outbound::opaq::logical::Routes>>, RwLock { data: Routes { logical: Logical { meta: ParentRef(Resource { group: "core", kind: "Service", name: "nats-e33f", namespace: "default", section: None, port: Some(4222) }), addr: Name(NameAddr { name: Name("nats-e33f.default.svc.cluster.local"), port: 4222 }) }, routes: Some(Route { policy: RoutePolicy { meta: Default { name: "opaq" }, filters: [], distribution: FirstAvailable([RouteBackend { filters: [], backend: Backend { meta: Resource { group: "core", kind: "Service", name: "nats-e33f", namespace: "default", section: None, port: Some(4222) }, queue: Queue { capacity: 100, failfast_timeout: 3s }, dispatcher: BalanceP2c(PeakEwma(PeakEwma { decay: 10s, default_rtt: 30ms }), DestinationGet { path: "nats-e33f.default.svc.cluster.local:4222" }) } }]), params: () } }), backends: [Backend { meta: Resource { group: "core", kind: "Service", name: "nats-e33f", namespace: "default", section: None, port: Some(4222) }, queue: Queue { capacity: 100, failfast_timeout: 3s }, dispatcher: BalanceP2c(PeakEwma(PeakEwma { decay: 10s, default_rtt: 30ms }), DestinationGet { path: "nats-e33f.default.svc.cluster.local:4222" }) }] } }), version: Version(0), is_closed: false, ref_count_rx: 9 }, version: Version(0) } }), logical: Logical { meta: ParentRef(Resource { group: "core", kind: "Service", name: "nats-e33f", namespace: "default", section: None, port: Some(4222) }), addr: Name(NameAddr { name: Name("nats-e33f.default.svc.cluster.local"), port: 4222 }) }, backend_ref: BackendRef(Resource { group: "core", kind: "Service", name: "nats-e33f", namespace: "default", section: None, port: Some(4222) }) }
bastion-7dd45cdc99-rj9mf linkerd-proxy [   219.684463s] TRACE ThreadId(01) linkerd_stack_tracing: new
bastion-7dd45cdc99-rj9mf linkerd-proxy [   219.684468s] DEBUG ThreadId(01) linkerd_proxy_balance: Resolving
bastion-7dd45cdc99-rj9mf linkerd-proxy [   219.684473s] TRACE ThreadId(01) linkerd_proxy_balance: Budilding metrics labels=ConcreteLabels { parent: ParentRef(Resource { group: "core", kind: "Service", name: "nats-e33f", namespace: "default", section: None, port: Some(4222) }), backend: BackendRef(Resource { group: "core", kind: "Service", name: "nats-e33f", namespace: "default", section: None, port: Some(4222) }), logical: "nats-e33f.default.svc.cluster.local:4222", concrete: "nats-e33f.default.svc.cluster.local:4222" }
bastion-7dd45cdc99-rj9mf linkerd-proxy [   219.684499s] DEBUG ThreadId(01) linkerd_proxy_balance: Spawning p2c pool queue capacity=10000 failfast=3s
bastion-7dd45cdc99-rj9mf linkerd-proxy [   219.684511s] TRACE ThreadId(01) linkerd_stack_tracing: drop
bastion-7dd45cdc99-rj9mf linkerd-proxy [   219.684518s] TRACE ThreadId(01) linkerd_stack_tracing: drop
bastion-7dd45cdc99-rj9mf linkerd-proxy [   219.684532s] TRACE ThreadId(01) linkerd_app_outbound::opaq::logical::router: Selecting Opaq route
bastion-7dd45cdc99-rj9mf linkerd-proxy [   219.684535s] DEBUG ThreadId(01) linkerd_app_outbound::opaq::logical::router: Selected route meta=RouteRef(Default { name: "opaq" })
bastion-7dd45cdc99-rj9mf linkerd-proxy [   219.684540s] DEBUG ThreadId(01) linkerd_distribute::stack: New distribution backends=FirstAvailable(ServiceKeys { ids: [KeyId { idx: 0 }], keys: {KeyId { idx: 0 }: Backend { route_ref: RouteRef(Default { name: "opaq" }), concrete: Concrete { target: Balance(NameAddr { name: Name("nats-e33f.default.svc.cluster.local"), port: 4222 }, EwmaConfig { default_rtt: 30ms, decay: 10s }), parent: Opaq(OpaqSidecar { orig_dst: OrigDstAddr(172.20.39.221:4222), routes: Receiver { shared: Shared { value: RwLock(PhantomData<std::sync::rwlock::RwLock<linkerd_app_outbound::opaq::logical::Routes>>, RwLock { data: Routes { logical: Logical { meta: ParentRef(Resource { group: "core", kind: "Service", name: "nats-e33f", namespace: "default", section: None, port: Some(4222) }), addr: Name(NameAddr { name: Name("nats-e33f.default.svc.cluster.local"), port: 4222 }) }, routes: Some(Route { policy: RoutePolicy { meta: Default { name: "opaq" }, filters: [], distribution: FirstAvailable([RouteBackend { filters: [], backend: Backend { meta: Resource { group: "core", kind: "Service", name: "nats-e33f", namespace: "default", section: None, port: Some(4222) }, queue: Queue { capacity: 100, failfast_timeout: 3s }, dispatcher: BalanceP2c(PeakEwma(PeakEwma { decay: 10s, default_rtt: 30ms }), DestinationGet { path: "nats-e33f.default.svc.cluster.local:4222" }) } }]), params: () } }), backends: [Backend { meta: Resource { group: "core", kind: "Service", name: "nats-e33f", namespace: "default", section: None, port: Some(4222) }, queue: Queue { capacity: 100, failfast_timeout: 3s }, dispatcher: BalanceP2c(PeakEwma(PeakEwma { decay: 10s, default_rtt: 30ms }), DestinationGet { path: "nats-e33f.default.svc.cluster.local:4222" }) }] } }), version: Version(0), is_closed: false, ref_count_rx: 28 }, version: Version(0) } }), logical: Logical { meta: ParentRef(Resource { group: "core", kind: "Service", name: "nats-e33f", namespace: "default", section: None, port: Some(4222) }), addr: Name(NameAddr { name: Name("nats-e33f.default.svc.cluster.local"), port: 4222 }) }, backend_ref: BackendRef(Resource { group: "core", kind: "Service", name: "nats-e33f", namespace: "default", section: None, port: Some(4222) }) } }} })
bastion-7dd45cdc99-rj9mf linkerd-proxy [   219.684567s] TRACE ThreadId(01) linkerd_proxy_balance_queue::service: poll=Ready(Ok(()))
bastion-7dd45cdc99-rj9mf linkerd-proxy [   219.684570s] TRACE ThreadId(01) linkerd_stack::gate: Acquired permit
bastion-7dd45cdc99-rj9mf linkerd-proxy [   219.684573s] TRACE ThreadId(01) linkerd_stack_tracing: service ready=true ok=true
bastion-7dd45cdc99-rj9mf linkerd-proxy [   219.684577s] TRACE ThreadId(01) linkerd_proxy_balance_queue::service: Sending request to worker
bastion-7dd45cdc99-rj9mf linkerd-proxy [   219.684582s] TRACE ThreadId(01) linkerd_stack_tracing: drop
bastion-7dd45cdc99-rj9mf linkerd-proxy [   219.684592s] TRACE ThreadId(01) linkerd_proxy_balance_queue::worker: Discovering while awaiting requests
bastion-7dd45cdc99-rj9mf linkerd-proxy [   219.684597s] TRACE ThreadId(01) linkerd_stack_tracing: drop
bastion-7dd45cdc99-rj9mf linkerd-proxy [   219.684600s] TRACE ThreadId(01) linkerd_stack_tracing: drop
bastion-7dd45cdc99-rj9mf linkerd-proxy [   219.684602s] DEBUG ThreadId(01) linkerd_proxy_api_resolve::resolve: Resolving dst=nats-e33f.default.svc.cluster.local:4222 context={"ns":"bastion", "nodeName":"ip-10-0-237-36.us-east-2.compute.internal", "pod":"bastion-7dd45cdc99-rj9mf"}
bastion-7dd45cdc99-rj9mf linkerd-proxy
bastion-7dd45cdc99-rj9mf linkerd-proxy [   219.684606s] TRACE ThreadId(01) linkerd_stack_tracing: drop
bastion-7dd45cdc99-rj9mf linkerd-proxy [   219.684611s] TRACE ThreadId(01) linkerd_proxy_balance_queue::service: poll=Ready(Ok(()))
bastion-7dd45cdc99-rj9mf linkerd-proxy [   219.684614s] TRACE ThreadId(01) linkerd_stack::gate: Acquired permit
bastion-7dd45cdc99-rj9mf linkerd-proxy [   219.684615s] TRACE ThreadId(01) linkerd_stack_tracing: service ready=true ok=true
bastion-7dd45cdc99-rj9mf linkerd-proxy [   219.684626s] TRACE ThreadId(01) linkerd_proxy_balance_queue::service: Sending request to worker
bastion-7dd45cdc99-rj9mf linkerd-proxy [   219.684633s] TRACE ThreadId(01) linkerd_proxy_balance_queue::worker: Driving pool
bastion-7dd45cdc99-rj9mf linkerd-proxy [   219.684635s] TRACE ThreadId(01) linkerd_pool_p2c: Polling pending
bastion-7dd45cdc99-rj9mf linkerd-proxy [   219.684638s] TRACE ThreadId(01) linkerd_proxy_balance_queue::worker: Pool driven
bastion-7dd45cdc99-rj9mf linkerd-proxy [   219.684640s] TRACE ThreadId(01) linkerd_proxy_balance_queue::worker: Waiting for inner service readiness
bastion-7dd45cdc99-rj9mf linkerd-proxy [   219.684643s] TRACE ThreadId(01) linkerd_pool_p2c: Polling pending pending=0
bastion-7dd45cdc99-rj9mf linkerd-proxy [   219.684645s] TRACE ThreadId(01) linkerd_pool_p2c: All endpoints are ready
--
bastion-7dd45cdc99-rj9mf linkerd-proxy [   219.703314s] TRACE ThreadId(01) linkerd_proxy_resolve::recover: update=Reset([(10.0.212.213:4222, Metadata { labels: {"namespace": "default", "pod": "nats-e33f-1", "service": "nats-e33f", "serviceaccount": "nats-e33f", "statefulset": "nats-e33f", "zone": "us-east-2c", "zone_locality": "local"}, weight: 10000, protocol_hint: Unknown, tagged_transport_port: None, identity: None, authority_override: None, http2: ClientParams { flow_control: None, keep_alive: None, max_concurrent_reset_streams: None, max_frame_size: None, max_send_buf_size: None }, is_zone_local: Some(true) }), (10.0.107.131:4222, Metadata { labels: {"namespace": "default", "pod": "nats-e33f-0", "service": "nats-e33f", "serviceaccount": "nats-e33f", "statefulset": "nats-e33f", "zone": "us-east-2a", "zone_locality": "remote"}, weight: 10000, protocol_hint: Unknown, tagged_transport_port: None, identity: None, authority_override: None, http2: ClientParams { flow_control: None, keep_alive: None, max_concurrent_reset_streams: None, max_frame_size: None, max_send_buf_size: None }, is_zone_local: Some(false) }), (10.0.181.87:4222, Metadata { labels: {"namespace": "default", "pod": "nats-e33f-2", "service": "nats-e33f", "serviceaccount": "nats-e33f", "statefulset": "nats-e33f", "zone": "us-east-2b", "zone_locality": "remote"}, weight: 10000, protocol_hint: Unknown, tagged_transport_port: None, identity: None, authority_override: None, http2: ClientParams { flow_control: None, keep_alive: None, max_concurrent_reset_streams: None, max_frame_size: None, max_send_buf_size: None }, is_zone_local: Some(false) })])
bastion-7dd45cdc99-rj9mf linkerd-proxy [   219.703337s] DEBUG ThreadId(01) linkerd_proxy_balance_queue::worker: Discovered update=Reset([(10.0.212.213:4222, Metadata { labels: {"namespace": "default", "pod": "nats-e33f-1", "service": "nats-e33f", "serviceaccount": "nats-e33f", "statefulset": "nats-e33f", "zone": "us-east-2c", "zone_locality": "local"}, weight: 10000, protocol_hint: Unknown, tagged_transport_port: None, identity: None, authority_override: None, http2: ClientParams { flow_control: None, keep_alive: None, max_concurrent_reset_streams: None, max_frame_size: None, max_send_buf_size: None }, is_zone_local: Some(true) }), (10.0.107.131:4222, Metadata { labels: {"namespace": "default", "pod": "nats-e33f-0", "service": "nats-e33f", "serviceaccount": "nats-e33f", "statefulset": "nats-e33f", "zone": "us-east-2a", "zone_locality": "remote"}, weight: 10000, protocol_hint: Unknown, tagged_transport_port: None, identity: None, authority_override: None, http2: ClientParams { flow_control: None, keep_alive: None, max_concurrent_reset_streams: None, max_frame_size: None, max_send_buf_size: None }, is_zone_local: Some(false) }), (10.0.181.87:4222, Metadata { labels: {"namespace": "default", "pod": "nats-e33f-2", "service": "nats-e33f", "serviceaccount": "nats-e33f", "statefulset": "nats-e33f", "zone": "us-east-2b", "zone_locality": "remote"}, weight: 10000, protocol_hint: Unknown, tagged_transport_port: None, identity: None, authority_override: None, http2: ClientParams { flow_control: None, keep_alive: None, max_concurrent_reset_streams: None, max_frame_size: None, max_send_buf_size: None }, is_zone_local: Some(false) })])
bastion-7dd45cdc99-rj9mf linkerd-proxy [   219.703352s]  INFO ThreadId(01) linkerd_pool_p2c: Adding endpoint addr=10.0.212.213:4222
bastion-7dd45cdc99-rj9mf linkerd-proxy [   219.703356s] TRACE ThreadId(01) linkerd_app_outbound::opaq::concrete: Resolved endpoint addr=10.0.212.213:4222 metadata=Metadata { labels: {"namespace": "default", "pod": "nats-e33f-1", "service": "nats-e33f", "serviceaccount": "nats-e33f", "statefulset": "nats-e33f", "zone": "us-east-2c", "zone_locality": "local"}, weight: 10000, protocol_hint: Unknown, tagged_transport_port: None, identity: None, authority_override: None, http2: ClientParams { flow_control: None, keep_alive: None, max_concurrent_reset_streams: None, max_frame_size: None, max_send_buf_size: None }, is_zone_local: Some(true) } target=Balance { addr: NameAddr { name: Name("nats-e33f.default.svc.cluster.local"), port: 4222 }, ewma: EwmaConfig { default_rtt: 30ms, decay: 10s }, queue: QueueConfig { capacity: 10000, failfast_timeout: 3s }, parent: Concrete { target: Balance(NameAddr { name: Name("nats-e33f.default.svc.cluster.local"), port: 4222 }, EwmaConfig { default_rtt: 30ms, decay: 10s }), parent: Opaq(OpaqSidecar { orig_dst: OrigDstAddr(172.20.39.221:4222), routes: Receiver { shared: Shared { value: RwLock(PhantomData<std::sync::rwlock::RwLock<linkerd_app_outbound::opaq::logical::Routes>>, RwLock { data: Routes { logical: Logical { meta: ParentRef(Resource { group: "core", kind: "Service", name: "nats-e33f", namespace: "default", section: None, port: Some(4222) }), addr: Name(NameAddr { name: Name("nats-e33f.default.svc.cluster.local"), port: 4222 }) }, routes: Some(Route { policy: RoutePolicy { meta: Default { name: "opaq" }, filters: [], distribution: FirstAvailable([RouteBackend { filters: [], backend: Backend { meta: Resource { group: "core", kind: "Service", name: "nats-e33f", namespace: "default", section: None, port: Some(4222) }, queue: Queue { capacity: 100, failfast_timeout: 3s }, dispatcher: BalanceP2c(PeakEwma(PeakEwma { decay: 10s, default_rtt: 30ms }), DestinationGet { path: "nats-e33f.default.svc.cluster.local:4222" }) } }]), params: () } }), backends: [Backend { meta: Resource { group: "core", kind: "Service", name: "nats-e33f", namespace: "default", section: None, port: Some(4222) }, queue: Queue { capacity: 100, failfast_timeout: 3s }, dispatcher: BalanceP2c(PeakEwma(PeakEwma { decay: 10s, default_rtt: 30ms }), DestinationGet { path: "nats-e33f.default.svc.cluster.local:4222" }) }] } }), version: Version(0), is_closed: false, ref_count_rx: 32 }, version: Version(0) } }), logical: Logical { meta: ParentRef(Resource { group: "core", kind: "Service", name: "nats-e33f", namespace: "default", section: None, port: Some(4222) }), addr: Name(NameAddr { name: Name("nats-e33f.default.svc.cluster.local"), port: 4222 }) }, backend_ref: BackendRef(Resource { group: "core", kind: "Service", name: "nats-e33f", namespace: "default", section: None, port: Some(4222) }) } }
bastion-7dd45cdc99-rj9mf linkerd-proxy [   219.703398s] TRACE ThreadId(01) linkerd_stack_tracing: new
bastion-7dd45cdc99-rj9mf linkerd-proxy [   219.703406s]  INFO ThreadId(01) linkerd_pool_p2c: Adding endpoint addr=10.0.107.131:4222
bastion-7dd45cdc99-rj9mf linkerd-proxy [   219.703408s] TRACE ThreadId(01) linkerd_app_outbound::opaq::concrete: Resolved endpoint addr=10.0.107.131:4222 metadata=Metadata { labels: {"namespace": "default", "pod": "nats-e33f-0", "service": "nats-e33f", "serviceaccount": "nats-e33f", "statefulset": "nats-e33f", "zone": "us-east-2a", "zone_locality": "remote"}, weight: 10000, protocol_hint: Unknown, tagged_transport_port: None, identity: None, authority_override: None, http2: ClientParams { flow_control: None, keep_alive: None, max_concurrent_reset_streams: None, max_frame_size: None, max_send_buf_size: None }, is_zone_local: Some(false) } target=Balance { addr: NameAddr { name: Name("nats-e33f.default.svc.cluster.local"), port: 4222 }, ewma: EwmaConfig { default_rtt: 30ms, decay: 10s }, queue: QueueConfig { capacity: 10000, failfast_timeout: 3s }, parent: Concrete { target: Balance(NameAddr { name: Name("nats-e33f.default.svc.cluster.local"), port: 4222 }, EwmaConfig { default_rtt: 30ms, decay: 10s }), parent: Opaq(OpaqSidecar { orig_dst: OrigDstAddr(172.20.39.221:4222), routes: Receiver { shared: Shared { value: RwLock(PhantomData<std::sync::rwlock::RwLock<linkerd_app_outbound::opaq::logical::Routes>>, RwLock { data: Routes { logical: Logical { meta: ParentRef(Resource { group: "core", kind: "Service", name: "nats-e33f", namespace: "default", section: None, port: Some(4222) }), addr: Name(NameAddr { name: Name("nats-e33f.default.svc.cluster.local"), port: 4222 }) }, routes: Some(Route { policy: RoutePolicy { meta: Default { name: "opaq" }, filters: [], distribution: FirstAvailable([RouteBackend { filters: [], backend: Backend { meta: Resource { group: "core", kind: "Service", name: "nats-e33f", namespace: "default", section: None, port: Some(4222) }, queue: Queue { capacity: 100, failfast_timeout: 3s }, dispatcher: BalanceP2c(PeakEwma(PeakEwma { decay: 10s, default_rtt: 30ms }), DestinationGet { path: "nats-e33f.default.svc.cluster.local:4222" }) } }]), params: () } }), backends: [Backend { meta: Resource { group: "core", kind: "Service", name: "nats-e33f", namespace: "default", section: None, port: Some(4222) }, queue: Queue { capacity: 100, failfast_timeout: 3s }, dispatcher: BalanceP2c(PeakEwma(PeakEwma { decay: 10s, default_rtt: 30ms }), DestinationGet { path: "nats-e33f.default.svc.cluster.local:4222" }) }] } }), version: Version(0), is_closed: false, ref_count_rx: 34 }, version: Version(0) } }), logical: Logical { meta: ParentRef(Resource { group: "core", kind: "Service", name: "nats-e33f", namespace: "default", section: None, port: Some(4222) }), addr: Name(NameAddr { name: Name("nats-e33f.default.svc.cluster.local"), port: 4222 }) }, backend_ref: BackendRef(Resource { group: "core", kind: "Service", name: "nats-e33f", namespace: "default", section: None, port: Some(4222) }) } }
bastion-7dd45cdc99-rj9mf linkerd-proxy [   219.703429s] TRACE ThreadId(01) linkerd_stack_tracing: new
bastion-7dd45cdc99-rj9mf linkerd-proxy [   219.703432s]  INFO ThreadId(01) linkerd_pool_p2c: Adding endpoint addr=10.0.181.87:4222
bastion-7dd45cdc99-rj9mf linkerd-proxy [   219.703434s] TRACE ThreadId(01) linkerd_app_outbound::opaq::concrete: Resolved endpoint addr=10.0.181.87:4222 metadata=Metadata { labels: {"namespace": "default", "pod": "nats-e33f-2", "service": "nats-e33f", "serviceaccount": "nats-e33f", "statefulset": "nats-e33f", "zone": "us-east-2b", "zone_locality": "remote"}, weight: 10000, protocol_hint: Unknown, tagged_transport_port: None, identity: None, authority_override: None, http2: ClientParams { flow_control: None, keep_alive: None, max_concurrent_reset_streams: None, max_frame_size: None, max_send_buf_size: None }, is_zone_local: Some(false) } target=Balance { addr: NameAddr { name: Name("nats-e33f.default.svc.cluster.local"), port: 4222 }, ewma: EwmaConfig { default_rtt: 30ms, decay: 10s }, queue: QueueConfig { capacity: 10000, failfast_timeout: 3s }, parent: Concrete { target: Balance(NameAddr { name: Name("nats-e33f.default.svc.cluster.local"), port: 4222 }, EwmaConfig { default_rtt: 30ms, decay: 10s }), parent: Opaq(OpaqSidecar { orig_dst: OrigDstAddr(172.20.39.221:4222), routes: Receiver { shared: Shared { value: RwLock(PhantomData<std::sync::rwlock::RwLock<linkerd_app_outbound::opaq::logical::Routes>>, RwLock { data: Routes { logical: Logical { meta: ParentRef(Resource { group: "core", kind: "Service", name: "nats-e33f", namespace: "default", section: None, port: Some(4222) }), addr: Name(NameAddr { name: Name("nats-e33f.default.svc.cluster.local"), port: 4222 }) }, routes: Some(Route { policy: RoutePolicy { meta: Default { name: "opaq" }, filters: [], distribution: FirstAvailable([RouteBackend { filters: [], backend: Backend { meta: Resource { group: "core", kind: "Service", name: "nats-e33f", namespace: "default", section: None, port: Some(4222) }, queue: Queue { capacity: 100, failfast_timeout: 3s }, dispatcher: BalanceP2c(PeakEwma(PeakEwma { decay: 10s, default_rtt: 30ms }), DestinationGet { path: "nats-e33f.default.svc.cluster.local:4222" }) } }]), params: () } }), backends: [Backend { meta: Resource { group: "core", kind: "Service", name: "nats-e33f", namespace: "default", section: None, port: Some(4222) }, queue: Queue { capacity: 100, failfast_timeout: 3s }, dispatcher: BalanceP2c(PeakEwma(PeakEwma { decay: 10s, default_rtt: 30ms }), DestinationGet { path: "nats-e33f.default.svc.cluster.local:4222" }) }] } }), version: Version(0), is_closed: false, ref_count_rx: 36 }, version: Version(0) } }), logical: Logical { meta: ParentRef(Resource { group: "core", kind: "Service", name: "nats-e33f", namespace: "default", section: None, port: Some(4222) }), addr: Name(NameAddr { name: Name("nats-e33f.default.svc.cluster.local"), port: 4222 }) }, backend_ref: BackendRef(Resource { group: "core", kind: "Service", name: "nats-e33f", namespace: "default", section: None, port: Some(4222) }) } }
bastion-7dd45cdc99-rj9mf linkerd-proxy [   219.703546s] TRACE ThreadId(01) linkerd_stack_tracing: new
bastion-7dd45cdc99-rj9mf linkerd-proxy [   219.703553s] TRACE ThreadId(01) linkerd_proxy_resolve::recover: polling
bastion-7dd45cdc99-rj9mf linkerd-proxy [   219.703557s] TRACE ThreadId(01) linkerd_pool_p2c: Polling pending pending=3
bastion-7dd45cdc99-rj9mf linkerd-proxy [   219.703560s] TRACE ThreadId(01) linkerd_stack_tracing: service ready=true ok=true
bastion-7dd45cdc99-rj9mf linkerd-proxy [   219.703563s] TRACE ThreadId(01) tower::ready_cache::cache: endpoint ready
bastion-7dd45cdc99-rj9mf linkerd-proxy [   219.703567s] TRACE ThreadId(01) linkerd_stack_tracing: service ready=true ok=true
bastion-7dd45cdc99-rj9mf linkerd-proxy [   219.703569s] TRACE ThreadId(01) tower::ready_cache::cache: endpoint ready
bastion-7dd45cdc99-rj9mf linkerd-proxy [   219.703571s] TRACE ThreadId(01) linkerd_stack_tracing: service ready=true ok=true
bastion-7dd45cdc99-rj9mf linkerd-proxy [   219.703573s] TRACE ThreadId(01) tower::ready_cache::cache: endpoint ready
bastion-7dd45cdc99-rj9mf linkerd-proxy [   219.703575s] TRACE ThreadId(01) linkerd_pool_p2c: All endpoints are ready
bastion-7dd45cdc99-rj9mf linkerd-proxy [   219.703578s] TRACE ThreadId(01) tower::load::peak_ewma: update rtt=000ms decay=000079ns; next=030ms
bastion-7dd45cdc99-rj9mf linkerd-proxy [   219.703580s] TRACE ThreadId(01) tower::load::peak_ewma: load estimate=30ms pending=0 cost=Cost(29999920.7401047)
```

Hope that helps narrow the scope of what might potentially be going wrong.

**Comment by fullykubed** [comment]
I do believe that the request is reaching the NATS server, but weirdly the only logs that get generated even in the highest possible log level are:

```
nats-e33f-2 nats [1] 2024/11/22 02:13:44.520469 [DBG] 10.0.191.109:44152 - cid:39 - Client connection created
nats-e33f-2 nats [1] 2024/11/22 02:13:44.520736 [DBG] 10.0.191.109:44152 - cid:39 - Client connection closed: Client Closed
```

**Comment by fullykubed** [comment]
All of this said, I still think this is a bug in linkerd (vs in NATS) b/c I do not believe that adding the linkerd-proxy sidecar to a pod should prevent network connectivity via server-first protocols such as NATS (regardless of whether the upstream is in the mesh or not).

**Comment by fullykubed** [comment]
Here are the linkerd-debug logs from the client pod that get generated when running `nats account info`:

```
bastion-6b595b8c78-cml7n linkerd-debug 10405 213.008936557 10.0.232.205 → 10.0.191.102 TCP 76 57162 → 4222 [SYN] Seq=0 Win=62727 Len=0 MSS=8961 SACK_PERM TSval=1958404338 TSecr=0 WS=128
bastion-6b595b8c78-cml7n linkerd-debug 10406 213.009368700 10.0.191.102 → 10.0.232.205 TCP 76 4222 → 57162 [SYN, ACK] Seq=0 Ack=1 Win=62643 Len=0 MSS=8961 SACK_PERM TSval=3788962269 TSecr=1958404338 WS=128
bastion-6b595b8c78-cml7n linkerd-debug 10407 213.009384979 10.0.232.205 → 10.0.191.102 TCP 68 57162 → 4222 [ACK] Seq=1 Ack=1 Win=62848 Len=0 TSval=1958404339 TSecr=3788962269
bastion-6b595b8c78-cml7n linkerd-debug 10408 213.009428208 10.0.232.205 → 10.0.191.102 TCP 68 57162 → 4222 [FIN, ACK] Seq=1 Ack=1 Win=62848 Len=0 TSval=1958404339 TSecr=3788962269
bastion-6b595b8c78-cml7n linkerd-debug 10409 213.009867945 10.0.191.102 → 10.0.232.205 TCP 582 4222 → 57162 [PSH, ACK] Seq=1 Ack=2 Win=62720 Len=514 TSval=3788962269 TSecr=1958404339
bastion-6b595b8c78-cml7n linkerd-debug 10410 213.009876929 10.0.232.205 → 10.0.191.102 TCP 68 57162 → 4222 [ACK] Seq=2 Ack=515 Win=62336 Len=0 TSval=1958404339 TSecr=3788962269
bastion-6b595b8c78-cml7n linkerd-debug 10413 213.009917903 10.0.191.102 → 10.0.232.205 TCP 68 4222 → 57162 [FIN, ACK] Seq=515 Ack=2 Win=62720 Len=0 TSval=3788962269 TSecr=1958404339
bastion-6b595b8c78-cml7n linkerd-debug 10414 213.009923806 10.0.232.205 → 10.0.191.102 TCP 68 57162 → 4222 [ACK] Seq=2 Ack=516 Win=62336 Len=0 TSval=1958404339 TSecr=3788962269
```

**Comment by olix0r** [comment]
If you configure NATS to be marked as opaque, things should work.

> Ideally, we would like to mark 4222 opaque rather than skipping it; however, opaque ports do not fix this issue.

How did you try to enable opaque ports?

**Comment by fullykubed** [comment]
@olix0r Both `4222` (the client port) and `6222` (the internal cluster communication ports) port were marked opaque via pod annotation (also tried via service annotation).

I can confirm that I verified opaque ports were enabled via the logs.

However, let me reiterate a key point: if the client has a linkerd sidecar but the NATS server does not, the problem persists. The only way I am able to resolve the problem was either (a) removing the linkerd sidecar from the client pods or (b) by setting `config.linkerd.io/skip-outbound-ports` to `4222` on the client pods (even setting `config.linkerd.io/skip-inbound-ports` to `4222` on the NATS server pods did not work).

**Comment by olix0r** [comment]
There is some [documentation](https://linkerd.io/2.17/features/protocol-detection/#protocols-that-may-require-configuration) on this (that has been updated relatively recently) which may help clarify things.

If your server is not meshed and the client is meshed, it's critical that the _Service_ that clients connect to is annotated with an opaque ports configuration. Let's confirm that behavior:

```yaml
metadata:
  annotations:
    config.linkerd.io/opaque-ports: "4222,6222,8222"
```

Once that annotation is set, you can confirm the policy controller is providing the proper protocol configuration:

```
:; linkerd diagnostics policy svc/"$svc" 4222 -o json | jq .protocol.Kind
{
  "Opaque": {
    "routes": [
      {
        "metadata": {
          "Kind": {
            "Default": "opaq"
          }
        },
        "rules": [
          {
            "backends": {
              "Kind": {
                "FirstAvailable": {
                  "backends": [
                    {
                      "backend": {
                        "metadata": {
                          "Kind": {
                            "Resource": {
                              "group": "core",
                              "kind": "Service",
                              "name": "nats",
                              "namespace": "default",
                              "port": 4222
                            }
                          }
                        },
                        "Kind": {
                          "Balancer": {
                            "discovery": {
                              "Kind": {
                                "Dst": {
                                  "path": "nats.default.svc.cluster.local:4222"
                                }
                              }
                            },
                            "Load": {
                              "PeakEwma": {
                                "default_rtt": {
                                  "nanos": 30000000
                                },
                                "decay": {
                                  "seconds": 10
                                }
                              }
                            }
                          }
                        },
                        "queue": {
                          "capacity": 100,
                          "failfast_timeout": {
                            "seconds": 3
                          }
                        }
                      }
                    }
                  ]
                }
              }
            }
          }
        ]
      }
    ]
  }
}
```

**Comment by Nikoolayy1** [comment]
What about a case where we want to upload client certificate made with the same issuer to an external device ? I see simillar issue that linkerd closes the connection.

<img width="1412" height="231" alt="Image" src="https://github.com/user-attachments/assets/1e06ca8c-2396-4063-bfbc-7478bd3f8fd1" />

**Comment by PROxZIMA** [comment]
I ran into the same problem. After a quick discussion with Linkerd support, I was able to resolve the timeout/connectivity issue. You can also check the comments in this PR for more details: https://github.com/PROxZIMA/nats-mtls/pull/1.
