### ISSUE TITLE
Redis Sentinel not working as expected with mTLS

### ISSUE THREAD

**Issue by y25ean** [linkerd/linkerd2#6863]
### What is the issue?

Unable to use Linkerd's mTLS with Redis Sentinel provided by Bitnami. Without ports being skipped, Redis Sentinel does not launch correctly and communication between and to Redis Sentinel does not work.

### How can it be reproduced?

Step 1: Create Namespace for Redis Sentinel with the following configuration:

```
apiVersion: v1
kind: Namespace
metadata:
  annotations:
    linkerd.io/inject: enabled
    config.linkerd.io/opaque-ports: "26379,6379"
    config.linkerd.io/proxy-log-level: debug,warn
  name: redis
  labels:
    app: redis
```

Step 2: Install Redis Sentinel with the following:

Helm Chart Values: https://gist.github.com/y25ean/9b464589ecc86c443d08e572f6743367

Install Command: `helm install --values values.yaml redis bitnami/redis -n redis`

#### Redis Sentinel Output

```
04 Aug 2021 09:58:03.631 * MASTER <-> REPLICA sync started
04 Aug 2021 09:58:03.631 * Non blocking connect for SYNC fired the event.
04 Aug 2021 09:58:03.631 * Master replied to PING, replication can continue...
04 Aug 2021 09:58:03.631 * Trying a partial resynchronization (request 1d5a9c9b53203f8181e1dcbbd46d2cd95e5a4497:2513).
04 Aug 2021 09:58:03.631 * Master is currently unable to PSYNC but should be in the future: -NOMASTERLINK Can't SYNC while not connected with my master
```

#### Redis Client Error

When trying to connect to the Redis Sentinel with a client, we experienced the following error: `redis.sentinel.MasterNotFoundError: No master found for 'mymaster' error.`

#### Linkerd Proxy Output

No errors were found in the Linkerd Proxy.

```
[   722.440674s] DEBUG ThreadId(01) outbound:accept{client.addr=20.1.135.96:41134}:server{orig_dst=20.1.131.180:6379}:tcp:tcp.forward{server.addr=20.1.131.180:6379}: linkerd_app_outbound::tcp::opaque_transport: Using opaque transport target_port=6379 opaque_port=4143
[   722.440697s] DEBUG ThreadId(01) outbound:accept{client.addr=20.1.135.96:41134}:server{orig_dst=20.1.131.180:6379}:tcp:tcp.forward{server.addr=20.1.131.180:6379}: linkerd_tls::client: Initiating TLS connection server.id=redis.redis-dev.serviceaccount.identity.linkerd.cluster.local
[   722.440703s] DEBUG ThreadId(01) outbound:accept{client.addr=20.1.135.96:41134}:server{orig_dst=20.1.131.180:6379}:tcp:tcp.forward{server.addr=20.1.131.180:6379}: linkerd_proxy_transport::connect: Connecting server.addr=20.1.131.180:4143
[   722.441501s] DEBUG ThreadId(01) outbound:accept{client.addr=20.1.135.96:41134}:server{orig_dst=20.1.131.180:6379}:tcp:tcp.forward{server.addr=20.1.131.180:6379}: linkerd_proxy_transport::connect: Connected local.addr=20.1.135.96:39976 keepalive=Some(10s)
[   722.443050s] DEBUG ThreadId(01) outbound:accept{client.addr=20.1.135.96:41134}:server{orig_dst=20.1.131.180:6379}:tcp:tcp.forward{server.addr=20.1.131.180:6379}: linkerd_tls::client: alpn=Ok("transport.l5d.io/v1")
[   722.443082s] DEBUG ThreadId(01) outbound:accept{client.addr=20.1.135.96:41134}:server{orig_dst=20.1.131.180:6379}:tcp:tcp.forward{server.addr=20.1.131.180:6379}: linkerd_app_outbound::tcp::opaque_transport: Wrote transport header sz=30
[   722.443092s] DEBUG ThreadId(01) outbound:accept{client.addr=20.1.135.96:41134}:server{orig_dst=20.1.131.180:6379}:tcp:tcp.forward{server.addr=20.1.131.180:6379}: linkerd_proxy_transport::metrics: client connection open
[   722.447214s] DEBUG ThreadId(01) outbound:accept{client.addr=20.1.135.96:41134}: linkerd_app_core::serve: Connection closed
```

#### Linkerd Debug Sidecar Output
We can see packets being transferred on the problematic port, 6379, using the Debug Sidecar.

```
129665 713.548309030  20.1.162.41 → 20.1.166.115 TCP 68 6379 → 37800 [ACK] Seq=1 Ack=292 Win=28160 Len=0 TSval=2197868507 TSecr=274946884
129666 713.548627422  20.1.162.41 → 20.1.166.115 TLSv1.3 1583 Server Hello, Change Cipher Spec, Application Data, Application Data, Application Data, Application Data, Application Data
129667 713.549259731 20.1.166.115 → 20.1.162.41  TCP 68 37800 → 6379 [ACK] Seq=292 Ack=1516 Win=30208 Len=0 TSval=274946885 TSecr=2197868507
129668 713.549684003 20.1.166.115 → 20.1.162.41  TLSv1.3 1328 Change Cipher Spec, Application Data, Application Data, Application Data
129669 713.549728243 20.1.166.115 → 20.1.162.41  TLSv1.3 104 Application Data
129670 713.549732646  20.1.162.41 → 20.1.166.115 TCP 68 6379 → 37800 [ACK] Seq=1516 Ack=1588 Win=30720 Len=0 TSval=2197868508 TSecr=274946886
129671 713.550040394    127.0.0.1 → 127.0.0.1    TCP 76 52944 → 6379 [SYN] Seq=0 Win=65535 Len=0 MSS=65495 SACK_PERM=1 TSval=2747614537 TSecr=0 WS=512
129672 713.550047469    127.0.0.1 → 127.0.0.1    TCP 76 6379 → 52944 [SYN, ACK] Seq=0 Ack=1 Win=65535 Len=0 MSS=65495 SACK_PERM=1 TSval=2747614538 TSecr=2747614537 WS=512
129673 713.550053004    127.0.0.1 → 127.0.0.1    TCP 68 52944 → 6379 [ACK] Seq=1 Ack=1 Win=131072 Len=0 TSval=2747614538 TSecr=2747614538
129674 713.550120782    127.0.0.1 → 127.0.0.1    TCP 82 52944 → 6379 [PSH, ACK] Seq=1 Ack=1 Win=131072 Len=14 TSval=2747614538 TSecr=2747614538
129675 713.550127702    127.0.0.1 → 127.0.0.1    TCP 68 6379 → 52944 [ACK] Seq=1 Ack=15 Win=131072 Len=0 TSval=2747614538 TSecr=2747614538
129676 713.550155885    127.0.0.1 → 127.0.0.1    TCP 102 6379 → 52944 [PSH, ACK] Seq=1 Ack=15 Win=131072 Len=34 TSval=2747614538 TSecr=2747614538
129677 713.550161965    127.0.0.1 → 127.0.0.1    TCP 68 52944 → 6379 [ACK] Seq=15 Ack=35 Win=131072 Len=0 TSval=2747614538 TSecr=2747614538
129678 713.550186302  20.1.162.41 → 20.1.166.115 TLSv1.3 124 Application Data
129679 713.550916612 20.1.166.115 → 20.1.162.41  TLSv1.3 127 Application Data
129680 713.550937201    127.0.0.1 → 127.0.0.1    TCP 105 52944 → 6379 [PSH, ACK] Seq=15 Ack=35 Win=131072 Len=37 TSval=2747614538 TSecr=2747614538
129681 713.550959557    127.0.0.1 → 127.0.0.1    TCP 73 6379 → 52944 [PSH, ACK] Seq=35 Ack=52 Win=131072 Len=5 TSval=2747614538 TSecr=2747614538
129682 713.550980083  20.1.162.41 → 20.1.166.115 TLSv1.3 95 Application Data
129683 713.551642194 20.1.166.115 → 20.1.162.41  TLSv1.3 198 Application Data
129684 713.551672900    127.0.0.1 → 127.0.0.1    TCP 176 52944 → 6379 [PSH, ACK] Seq=52 Ack=40 Win=131072 Len=108 TSval=2747614539 TSecr=2747614538
129685 713.551694062    127.0.0.1 → 127.0.0.1    TCP 78 6379 → 52944 [PSH, ACK] Seq=40 Ack=160 Win=131072 Len=10 TSval=2747614539 TSecr=2747614539
129686 713.551713907  20.1.162.41 → 20.1.166.115 TLSv1.3 100 Application Data
129687 713.552406010 20.1.166.115 → 20.1.162.41  TLSv1.3 162 Application Data
129688 713.552423683    127.0.0.1 → 127.0.0.1    TCP 140 52944 → 6379 [PSH, ACK] Seq=160 Ack=50 Win=131072 Len=72 TSval=2747614540 TSecr=2747614539
129689 713.552439947    127.0.0.1 → 127.0.0.1    TCP 129 6379 → 52944 [PSH, ACK] Seq=50 Ack=232 Win=131072 Len=61 TSval=2747614540 TSecr=2747614540
129690 713.552458369  20.1.162.41 → 20.1.166.115 TLSv1.3 151 Application Data
129691 713.553235399 20.1.166.115 → 20.1.162.41  TLSv1.3 92 Application Data
129692 713.553250065 20.1.166.115 → 20.1.162.41  TCP 68 37800 → 6379 [FIN, ACK] Seq=1895 Ack=1714 Win=30208 Len=0 TSval=274946889 TSecr=2197868511
129693 713.553269469    127.0.0.1 → 127.0.0.1    TCP 68 52944 → 6379 [FIN, ACK] Seq=232 Ack=111 Win=131072 Len=0 TSval=2747614541 TSecr=2747614540
129694 713.553292048    127.0.0.1 → 127.0.0.1    TCP 68 6379 → 52944 [FIN, ACK] Seq=111 Ack=233 Win=131072 Len=0 TSval=2747614541 TSecr=2747614541
```

#### `linkerd check` output

```
kubernetes-api
--------------
√ can initialize the client
√ can query the Kubernetes API

kubernetes-version
------------------
√ is running the minimum Kubernetes API version
√ is running the minimum kubectl version

linkerd-existence
-----------------
√ 'linkerd-config' config map exists
√ heartbeat ServiceAccount exist
√ control plane replica sets are ready
√ no unschedulable pods
√ controller pod is running

linkerd-config
--------------
√ control plane Namespace exists
√ control plane ClusterRoles exist
√ control plane ClusterRoleBindings exist
√ control plane ServiceAccounts exist
√ control plane CustomResourceDefinitions exist
√ control plane MutatingWebhookConfigurations exist
√ control plane ValidatingWebhookConfigurations exist
W0913 12:41:35.630400    5287 warnings.go:67] policy/v1beta1 PodSecurityPolicy is deprecated in v1.21+, unavailable in v1.25+
√ control plane PodSecurityPolicies exist

linkerd-cni-plugin
------------------
√ cni plugin ConfigMap exists
W0913 12:41:35.638389    5287 warnings.go:67] policy/v1beta1 PodSecurityPolicy is deprecated in v1.21+, unavailable in v1.25+
√ cni plugin PodSecurityPolicy exists
√ cni plugin ClusterRole exists
√ cni plugin ClusterRoleBinding exists
√ cni plugin Role exists
√ cni plugin RoleBinding exists
√ cni plugin ServiceAccount exists
√ cni plugin DaemonSet exists
√ cni plugin pod is running on all nodes

linkerd-identity
----------------
√ certificate config is valid
√ trust anchors are using supported crypto algorithm
√ trust anchors are within their validity period
√ trust anchors are valid for at least 60 days
√ issuer cert is using supported crypto algorithm
√ issuer cert is within its validity period
‼ issuer cert is valid for at least 60 days
    issuer certificate will expire on 2021-09-14T20:09:45Z
    see https://linkerd.io/2.10/checks/#l5d-identity-issuer-cert-not-expiring-soon for hints
√ issuer cert is issued by the trust anchor

linkerd-webhooks-and-apisvc-tls
-------------------------------
√ proxy-injector webhook has valid cert
‼ proxy-injector cert is valid for at least 60 days
    certificate will expire on 2021-09-13T20:10:09Z
    see https://linkerd.io/2.10/checks/#l5d-proxy-injector-webhook-cert-not-expiring-soon for hints
√ sp-validator webhook has valid cert
‼ sp-validator cert is valid for at least 60 days
    certificate will expire on 2021-09-13T20:10:09Z
    see https://linkerd.io/2.10/checks/#l5d-sp-validator-webhook-cert-not-expiring-soon for hints

linkerd-api
-----------
√ control plane pods are ready
√ can initialize the client
√ can query the control plane API

linkerd-version
---------------
√ can determine the latest version
√ cli is up-to-date

control-plane-version
---------------------
√ control plane is up-to-date
√ control plane and cli versions match

linkerd-ha-checks
-----------------
√ pod injection disabled on kube-system

Status check results are √

Linkerd extensions checks
=========================

linkerd-viz
-----------
√ linkerd-viz Namespace exists
√ linkerd-viz ClusterRoles exist
√ linkerd-viz ClusterRoleBindings exist
√ tap API server has valid cert
‼ tap API server cert is valid for at least 60 days
    certificate will expire on 2021-09-13T20:10:10Z
    see https://linkerd.io/2.10/checks/#l5d-tap-cert-not-expiring-soon for hints
√ tap API service is running
√ linkerd-viz pods are injected
√ viz extension pods are running
√ prometheus is installed and configured correctly
√ can initialize the client
√ viz extension self-check

Status check results are √
```

### Environment

- Kubernetes Version: 1.21.0
- Cluster Environment: kOps
- Host OS: Amazon Linux 2 AMI 2.0.20210303.0 x86_64 HVM gp2
- Linkerd version: Client version: stable-2.10.2 Server version: stable-2.10.2

### Possible solution

Using the following Namespace configuration we were able to get Redis Sentinel working correctly. However, we need mTLS on Redis Sentinel so this solution is not suitable.

```
apiVersion: v1
kind: Namespace
metadata:
  annotations:
    linkerd.io/inject: enabled
    config.linkerd.io/skip-inbound-ports: "6379"
    config.linkerd.io/skip-outbound-ports: "6379"
    config.linkerd.io/opaque-ports: "26379"
    config.linkerd.io/proxy-log-level: linkerd_detect=trace,linkerd=debug,warn
  name: redis-ephemeral-tokens
  labels:
    app: redis-ephemeral-tokens
```

### Additional context

More information can be found on Slack: https://linkerd.slack.com/archives/C89RTCWJF/p1628071396145900

More logs / information can be given upon request.

**Comment by michaellzc** [comment]
We ran into a similar issue with bitnami chart a while ago, don't remember the exact reason why it is not working on top of my head. We ended up using a more reliable chart https://github.com/DandyDeveloper/charts/tree/master/charts/redis-ha, and it has been working great for us. Notes, just keep the `config.linkerd.io/opaque-ports: "6379,26379"` annotation.

**Comment by HighWatersDev** [comment]
I was facing the same issue. I recently upgraded Helm chart to version 15.4.0 and the issue went away. I do see a ton of readiness probe failures but that might be related to redis chart rather than Linkerd.

**Comment by adleong** [comment]
It sounds like this is working as expected with the latest charts.  I'm going to close this issue but please feel free to reopen or open a new issue if there is any action that needs to be taken on the Linkerd side.
