### ISSUE TITLE
ReadTimeouts on the api if used with linkerd2 injection

### ISSUE THREAD

**Issue by mittalsuraj18** [linkerd/linkerd2#4592]
Linkerd in causing connections to be dropped or timed out in python fastapi server on kubernetes.

### How can it be reproduced?

Create a simple async fastapi server using the below code
```python
from fastapi import FastAPI
from fastapi.background import BackgroundTasks
import asyncio
import httpx

app = FastAPI()


async def sleep():
    async with httpx.AsyncClient(timeout=60) as client:
         _ = await client.get("https://httpbin.org/delay/10")
    await asyncio.sleep(10)

@app.get("/")
def root():
    return "okay"

@app.get("/health")
def health():
    return "okay"

@app.get("/background")
async def background(bk:BackgroundTasks):
    bk.add_task(sleep)
    return "running in background"

if __name__=="__main__":
    import uvicorn
    uvicorn.run(app=app, host="0.0.0.0", port=8080)


```

The Dockerfile contents would be as follows

```Dockerfile
FROM python:3.7
RUN pip install fastapi[all] uvicorn httpx --no-cache-dir
RUN mkdir /app
WORKDIR /app
COPY server.py ./
CMD ["python","server.py"]
```

The kubernetes deployment as the linkerd sidecar proxy injection enabled

the yaml is as follows

```yaml
apiVersion: apps/v1
kind: Deployment
metadata:
  name: test-app
spec:
  selector:
    matchLabels:
      app: test-app
  template:
    metadata:
      annotations:
        linkerd.io/inject: enabled
      labels:
        app: test-app
    spec:
      terminationGracePeriodSeconds: 30
      containers:
      - name: test-app
        image: "<REPO_URL>"
        imagePullPolicy: "Always"
        resources:
          requests:
            cpu: 500m
            memory: 512Mi
---
apiVersion: v1
kind: Service
metadata:
  name: "test-app"
spec:
  type: NodePort
  selector:
    app: "test-app"
  ports:
    - port: 8080
      targetPort: 8080
```

Try to hit `/backgound` api from another deployment running linkerd proxy injection or from outside using virtual machine assigned nodeport and ip.

### Expected Behavior

- the api returns immediately and runs the sleep in background.
- hitting the api second time should result in the same case as above where the api returns the response immediately and runs in the background async task

### Observed Behavior

- the first call returns immediately. but the second calls hangs or timeouts.

#### `linkerd check` output

```text
kubernetes-api
--------------
√ can initialize the client
√ can query the Kubernetes API

kubernetes-version
------------------
√ is running the minimum Kubernetes API version
√ is running the minimum kubectl version

linkerd-existence
-----------------
√ 'linkerd-config' config map exists
√ heartbeat ServiceAccount exist
√ control plane replica sets are ready
√ no unschedulable pods
√ controller pod is running
√ can initialize the client
√ can query the control plane API

linkerd-config
--------------
√ control plane Namespace exists
√ control plane ClusterRoles exist
√ control plane ClusterRoleBindings exist
√ control plane ServiceAccounts exist
√ control plane CustomResourceDefinitions exist
√ control plane MutatingWebhookConfigurations exist
√ control plane ValidatingWebhookConfigurations exist
√ control plane PodSecurityPolicies exist

linkerd-identity
----------------
√ certificate config is valid
√ trust roots are using supported crypto algorithm
√ trust roots are within their validity period
√ trust roots are valid for at least 60 days
√ issuer cert is using supported crypto algorithm
√ issuer cert is within its validity period
√ issuer cert is valid for at least 60 days
√ issuer cert is issued by the trust root

linkerd-api
-----------
√ control plane pods are ready
√ control plane self-check
√ [kubernetes] control plane can talk to Kubernetes
√ [prometheus] control plane can talk to Prometheus
√ tap api service is running

linkerd-version
---------------
√ can determine the latest version
√ cli is up-to-date

control-plane-version
---------------------
√ control plane is up-to-date
√ control plane and cli versions match
   
linkerd-ha-checks
-----------------
√ pod injection disabled on kube-system

Status check results are √
```

### Environment

- Kubernetes Version: 
    - Client: v1.16.6-beta.0
    - Server: v1.16.8-gke.15
- Cluster Environment: GKE
- Host OS: Container-Optimized OS (cos)
- Linkerd version: 2.8.0

### Additional Context

- `exec` ing into the `test-app` container and hitting the api via `http://localhost:8000/backgound` causes the expected behavior.
- Hitting the pod from another pod or from external system causes the observed behavior.
- Disabling linkerd by removing the injection causes the issue to disappear

**Comment by grampelberg** [comment]
How are you calling it in the non-localhost case?

**Comment by mittalsuraj18** [comment]
there are two cases for non localhost case.
- The first one is calling from another pod. In this case i am directly using the service name and port like this `http://test-app:8080/background`
- The second one is from the NodePort. In this case i am using the ip of the VM and the nodeport randomly assigned to me by kubernetes. like this `http://<VM_IP>:31000/background` . Where 31000 is the port randomly assigned to me by kubernetes.

**Comment by grampelberg** [comment]
So, I just tested exactly with what you shared and everything's working for me. Could you share some more details?

**Comment by mittalsuraj18** [comment]
In the actual code, the background task was making a long running connection [60 seconds timeout and average of 30-40 seconds response time] to an external third party api.
i have changed the sample code to reflect that situation. can you check with it once.

**Comment by grampelberg** [comment]
Same behavior for me, works for lots of requests to `/background`.

**Comment by mittalsuraj18** [comment]
@grampelberg can you point me in the right direction as to how to debug the issue in the cluster?
and what logs would be needed to identify the issue.
i am sure that it happens because of linkerd. however i too am unable to reproduce it locally or in some other cluster.
apart from the above info, i would mention that i have installed these agents inside the cluster

1. logdna agent
2. botkube
3. nginx ingress controller.

remaining all settings are at their default values.

**Comment by grampelberg** [comment]
You could look in the logs for the proxy and see if there's anything in there. Your application logs might help as well.

**Comment by mittalsuraj18** [comment]
Application logs don’t have anything since The request doesn’t reach the application itself.

I will to look at the proxy logs and see if I am able to catch anything

**Comment by grampelberg** [comment]
How'd you verify that the request isn't reaching the application?

**Comment by mittalsuraj18** [comment]
I have a middleware in the app which logs every request and the time it takes to execute the request.
The time taken to execute the request is still in sub milliseconds even after timeouts.

Which confirms the suspicion that the request is being blocked by something from outside. The only other thing is the sidecar proxy. 

I have also tried removing linkerd from all the all pods and adding linkerd only to this specific pod and the problem starts appearing again.

I am still investigating it and will post more logs

**Comment by grampelberg** [comment]
I would recommend using `tap` or `lsof` to verify that the connections are being dropped. The middleware is likely logging completed requests, not in-flight requests (which this one is).

**Comment by mittalsuraj18** [comment]
Thanks for the pointers @grampelberg . I will run these and try to debug the service.

**Comment by mittalsuraj18** [comment]
So, i ran tcp-dump inside the cluster 
and below is the output

```
13:37:41.683348 IP gke-test--cluster-08891d23-hift.c.test-project-23456.internal.37872 > CUSTOM-SERVICE-5447666644-z9nsl.http-alt: Flags [S], seq 2248114780, win 42600, options [mss 1420,sackOK,TS val 5905755 ecr 0,nop,wscale 7], length 0
13:37:41.683410 IP CUSTOM-SERVICE-5447666644-z9nsl.http-alt > gke-test--cluster-08891d23-hift.c.test-project-23456.internal.37872: Flags [S.], seq 1996698095, ack 2248114781, win 43648, options [mss 1420,sackOK,TS val 1804477094 ecr 5905755,nop,wscale 7], length 0
13:37:41.684974 IP gke-test--cluster-08891d23-hift.c.test-project-23456.internal.37872 > CUSTOM-SERVICE-5447666644-z9nsl.http-alt: Flags [.], ack 1, win 333, options [nop,nop,TS val 5905758 ecr 1804477094], length 0
13:37:41.685047 IP gke-test--cluster-08891d23-hift.c.test-project-23456.internal.37872 > CUSTOM-SERVICE-5447666644-z9nsl.http-alt: Flags [P.], seq 1:251, ack 1, win 333, options [nop,nop,TS val 5905758 ecr 1804477094], length 250: HTTP: POST /background HTTP/1.1
13:37:41.685057 IP CUSTOM-SERVICE-5447666644-z9nsl.http-alt > gke-test--cluster-08891d23-hift.c.test-project-23456.internal.37872: Flags [.], ack 251, win 340, options [nop,nop,TS val 1804477096 ecr 5905758], length 0
13:37:41.685113 IP gke-test--cluster-08891d23-hift.c.test-project-23456.internal.37872 > CUSTOM-SERVICE-5447666644-z9nsl.http-alt: Flags [P.], seq 251:1197, ack 1, win 333, options [nop,nop,TS val 5905758 ecr 1804477094], length 946: HTTP
13:37:41.685118 IP CUSTOM-SERVICE-5447666644-z9nsl.http-alt > gke-test--cluster-08891d23-hift.c.test-project-23456.internal.37872: Flags [.], ack 1197, win 333, options [nop,nop,TS val 1804477096 ecr 5905758], length 0
13:37:41.701175 IP localhost.http-alt > localhost.38102: Flags [P.], seq 3672429677:3672429867, ack 2287756045, win 342, options [nop,nop,TS val 2395352073 ecr 2395352057], length 190: HTTP: HTTP/1.1 200 OK
13:37:41.701194 IP localhost.38102 > localhost.http-alt: Flags [.], ack 190, win 341, options [nop,nop,TS val 2395352073 ecr 2395352073], length 0
13:37:41.701768 IP CUSTOM-SERVICE-5447666644-z9nsl.http-alt > gke-test--cluster-08891d23-hift.c.test-project-23456.internal.37872: Flags [P.], seq 1:191, ack 1197, win 333, options [nop,nop,TS val 1804477112 ecr 5905758], length 190: HTTP: HTTP/1.1 200 OK
13:37:41.702320 IP gke-test--cluster-08891d23-hift.c.test-project-23456.internal.37872 > CUSTOM-SERVICE-5447666644-z9nsl.http-alt: Flags [.], ack 191, win 332, options [nop,nop,TS val 5905775 ecr 1804477112], length 0
13:37:41.704267 IP gke-test--cluster-08891d23-hift.c.test-project-23456.internal.37872 > CUSTOM-SERVICE-5447666644-z9nsl.http-alt: Flags [F.], seq 1197, ack 191, win 332, options [nop,nop,TS val 5905777 ecr 1804477112], length 0
13:37:41.704335 IP CUSTOM-SERVICE-5447666644-z9nsl.http-alt > gke-test--cluster-08891d23-hift.c.test-project-23456.internal.37872: Flags [F.], seq 191, ack 1198, win 333, options [nop,nop,TS val 1804477115 ecr 5905777], length 0
13:37:41.704665 IP gke-test--cluster-08891d23-hift.c.test-project-23456.internal.37872 > CUSTOM-SERVICE-5447666644-z9nsl.http-alt: Flags [.], ack 192, win 332, options [nop,nop,TS val 5905778 ecr 1804477115], length 0
13:37:43.653173 IP gke-test--cluster-08891d23-hift.c.test-project-23456.internal.37874 > CUSTOM-SERVICE-5447666644-z9nsl.http-alt: Flags [S], seq 870266777, win 42600, options [mss 1420,sackOK,TS val 5907726 ecr 0,nop,wscale 7], length 0
13:37:43.653209 IP CUSTOM-SERVICE-5447666644-z9nsl.http-alt > gke-test--cluster-08891d23-hift.c.test-project-23456.internal.37874: Flags [S.], seq 2021878276, ack 870266778, win 43648, options [mss 1420,sackOK,TS val 1804479064 ecr 5907726,nop,wscale 7], length 0
13:37:43.653623 IP gke-test--cluster-08891d23-hift.c.test-project-23456.internal.37874 > CUSTOM-SERVICE-5447666644-z9nsl.http-alt: Flags [.], ack 1, win 333, options [nop,nop,TS val 5907727 ecr 1804479064], length 0
13:37:43.653770 IP gke-test--cluster-08891d23-hift.c.test-project-23456.internal.37874 > CUSTOM-SERVICE-5447666644-z9nsl.http-alt: Flags [P.], seq 1:251, ack 1, win 333, options [nop,nop,TS val 5907727 ecr 1804479064], length 250: HTTP: POST /background HTTP/1.1
13:37:43.653781 IP CUSTOM-SERVICE-5447666644-z9nsl.http-alt > gke-test--cluster-08891d23-hift.c.test-project-23456.internal.37874: Flags [.], ack 251, win 340, options [nop,nop,TS val 1804479064 ecr 5907727], length 0
13:37:43.653782 IP gke-test--cluster-08891d23-hift.c.test-project-23456.internal.37874 > CUSTOM-SERVICE-5447666644-z9nsl.http-alt: Flags [P.], seq 251:1198, ack 1, win 333, options [nop,nop,TS val 5907727 ecr 1804479064], length 947: HTTP
13:37:43.653788 IP CUSTOM-SERVICE-5447666644-z9nsl.http-alt > gke-test--cluster-08891d23-hift.c.test-project-23456.internal.37874: Flags [.], ack 1198, win 333, options [nop,nop,TS val 1804479064 ecr 5907727], length 0
13:37:43.654427 IP localhost.38102 > localhost.http-alt: Flags [P.], seq 1:1174, ack 190, win 342, options [nop,nop,TS val 2395354026 ecr 2395352073], length 1173: HTTP: POST /background HTTP/1.1
13:37:43.694758 IP localhost.http-alt > localhost.38102: Flags [.], ack 1174, win 342, options [nop,nop,TS val 2395354066 ecr 2395354026], length 0
13:37:48.658490 IP gke-test--cluster-08891d23-hift.c.test-project-23456.internal.37874 > CUSTOM-SERVICE-5447666644-z9nsl.http-alt: Flags [F.], seq 1198, ack 1, win 333, options [nop,nop,TS val 5912731 ecr 1804479064], length 0
13:37:48.698721 IP CUSTOM-SERVICE-5447666644-z9nsl.http-alt > gke-test--cluster-08891d23-hift.c.test-project-23456.internal.37874: Flags [.], ack 1199, win 333, options [nop,nop,TS val 1804484109 ecr 5912731], length 0
13:37:59.065664 IP CUSTOM-SERVICE-5447666644-z9nsl.http-alt > gke-test--cluster-08891d23-hift.c.test-project-23456.internal.37874: Flags [.], ack 1199, win 333, options [nop,nop,TS val 1804494475 ecr 5912731], length 0
13:37:59.068134 IP gke-test--cluster-08891d23-hift.c.test-project-23456.internal.37874 > CUSTOM-SERVICE-5447666644-z9nsl.http-alt: Flags [.], ack 1, win 333, options [nop,nop,TS val 5923139 ecr 1804484109], length 0
13:38:01.625667 IP CUSTOM-SERVICE-5447666644-z9nsl.36970 > linkerd-identity.linkerd.svc.cluster.local.http-alt: Flags [.], ack 1173998013, win 331, options [nop,nop,TS val 3743564276 ecr 1699778094], length 0
13:38:01.625752 IP linkerd-identity.linkerd.svc.cluster.local.http-alt > CUSTOM-SERVICE-5447666644-z9nsl.36970: Flags [.], ack 1, win 331, options [nop,nop,TS val 1699855911 ecr 3743486459], length 0
13:38:01.625758 IP CUSTOM-SERVICE-5447666644-z9nsl.36970 > linkerd-identity.linkerd.svc.cluster.local.http-alt: Flags [.], ack 1, win 331, options [nop,nop,TS val 3743564277 ecr 1699778094], length 0
13:38:01.625769 IP linkerd-identity.linkerd.svc.cluster.local.http-alt > CUSTOM-SERVICE-5447666644-z9nsl.36970: Flags [.], ack 1, win 331, options [nop,nop,TS val 1699855912 ecr 3743486459], length 0
```

Both the requests were hit within 1 second. But as i can see, there is 10 second delay in response to the seconds request
```
13:37:48.658490 IP gke-test--cluster-08891d23-hift.c.test-project-23456.internal.37874 > CUSTOM-SERVICE-5447666644-z9nsl.http-alt: Flags [F.], seq 1198, ack 1, win 333, options [nop,nop,TS val 5912731 ecr 1804479064], length 0
13:37:48.698721 IP CUSTOM-SERVICE-5447666644-z9nsl.http-alt > gke-test--cluster-08891d23-hift.c.test-project-23456.internal.37874: Flags [.], ack 1199, win 333, options [nop,nop,TS val 1804484109 ecr 5912731], length 0
13:37:59.065664 IP CUSTOM-SERVICE-5447666644-z9nsl.http-alt > gke-test--cluster-08891d23-hift.c.test-project-23456.internal.37874: Flags [.], ack 1199, win 333, options [nop,nop,TS val 1804494475 ecr 5912731], length 0
```

**Comment by grampelberg** [comment]
That looks like a 10s delay from your application to the proxy though?

**Comment by mittalsuraj18** [comment]
tcp dump without linkerd
```
16:29:33.367973 IP gke-test--cluster-08891d23-hift.c.test-project-23456.internal.46406 > CUSTOM-SERVICE-7d7b649bdb-gnllp.http-alt: Flags [S], seq 2581604671, win 42600, options [mss 1420,sackOK,TS val 16216554 ecr 0,nop,wscale 7], length 0
16:29:33.368021 IP CUSTOM-SERVICE-7d7b649bdb-gnllp.http-alt > gke-test--cluster-08891d23-hift.c.test-project-23456.internal.46406: Flags [S.], seq 3068172772, ack 2581604672, win 43648, options [mss 1420,sackOK,TS val 3741616226 ecr 16216554,nop,wscale 7], length 0
16:29:33.369825 IP gke-test--cluster-08891d23-hift.c.test-project-23456.internal.46406 > CUSTOM-SERVICE-7d7b649bdb-gnllp.http-alt: Flags [.], ack 1, win 333, options [nop,nop,TS val 16216558 ecr 3741616226], length 0
16:29:33.369870 IP gke-test--cluster-08891d23-hift.c.test-project-23456.internal.46406 > CUSTOM-SERVICE-7d7b649bdb-gnllp.http-alt: Flags [P.], seq 1:251, ack 1, win 333, options [nop,nop,TS val 16216558 ecr 3741616226], length 250: HTTP: POST /background HTTP/1.1
16:29:33.369878 IP CUSTOM-SERVICE-7d7b649bdb-gnllp.http-alt > gke-test--cluster-08891d23-hift.c.test-project-23456.internal.46406: Flags [.], ack 251, win 340, options [nop,nop,TS val 3741616228 ecr 16216558], length 0
16:29:33.369973 IP gke-test--cluster-08891d23-hift.c.test-project-23456.internal.46406 > CUSTOM-SERVICE-7d7b649bdb-gnllp.http-alt: Flags [P.], seq 251:1199, ack 1, win 333, options [nop,nop,TS val 16216558 ecr 3741616226], length 948: HTTP
16:29:33.369977 IP CUSTOM-SERVICE-7d7b649bdb-gnllp.http-alt > gke-test--cluster-08891d23-hift.c.test-project-23456.internal.46406: Flags [.], ack 1199, win 333, options [nop,nop,TS val 3741616228 ecr 16216558], length 0
16:29:33.383392 IP CUSTOM-SERVICE-7d7b649bdb-gnllp.http-alt > gke-test--cluster-08891d23-hift.c.test-project-23456.internal.46406: Flags [P.], seq 1:191, ack 1199, win 333, options [nop,nop,TS val 3741616241 ecr 16216558], length 190: HTTP: HTTP/1.1 200 OK
16:29:33.383993 IP gke-test--cluster-08891d23-hift.c.test-project-23456.internal.46406 > CUSTOM-SERVICE-7d7b649bdb-gnllp.http-alt: Flags [.], ack 191, win 332, options [nop,nop,TS val 16216572 ecr 3741616241], length 0
16:29:33.385434 IP gke-test--cluster-08891d23-hift.c.test-project-23456.internal.46406 > CUSTOM-SERVICE-7d7b649bdb-gnllp.http-alt: Flags [F.], seq 1199, ack 191, win 332, options [nop,nop,TS val 16216574 ecr 3741616241], length 0
16:29:33.385522 IP CUSTOM-SERVICE-7d7b649bdb-gnllp.http-alt > gke-test--cluster-08891d23-hift.c.test-project-23456.internal.46406: Flags [F.], seq 191, ack 1200, win 333, options [nop,nop,TS val 3741616243 ecr 16216574], length 0
16:29:33.385883 IP gke-test--cluster-08891d23-hift.c.test-project-23456.internal.46406 > CUSTOM-SERVICE-7d7b649bdb-gnllp.http-alt: Flags [.], ack 192, win 332, options [nop,nop,TS val 16216574 ecr 3741616243], length 0
16:29:35.558567 IP gke-test--cluster-08891d23-hift.c.test-project-23456.internal.46408 > CUSTOM-SERVICE-7d7b649bdb-gnllp.http-alt: Flags [S], seq 202770581, win 42600, options [mss 1420,sackOK,TS val 16218746 ecr 0,nop,wscale 7], length 0
16:29:35.558613 IP CUSTOM-SERVICE-7d7b649bdb-gnllp.http-alt > gke-test--cluster-08891d23-hift.c.test-project-23456.internal.46408: Flags [S.], seq 3236491714, ack 202770582, win 43648, options [mss 1420,sackOK,TS val 3741618416 ecr 16218746,nop,wscale 7], length 0
16:29:35.558958 IP gke-test--cluster-08891d23-hift.c.test-project-23456.internal.46408 > CUSTOM-SERVICE-7d7b649bdb-gnllp.http-alt: Flags [.], ack 1, win 333, options [nop,nop,TS val 16218747 ecr 3741618416], length 0
16:29:35.559026 IP gke-test--cluster-08891d23-hift.c.test-project-23456.internal.46408 > CUSTOM-SERVICE-7d7b649bdb-gnllp.http-alt: Flags [P.], seq 1:251, ack 1, win 333, options [nop,nop,TS val 16218747 ecr 3741618416], length 250: HTTP: POST /background HTTP/1.1
16:29:35.559034 IP CUSTOM-SERVICE-7d7b649bdb-gnllp.http-alt > gke-test--cluster-08891d23-hift.c.test-project-23456.internal.46408: Flags [.], ack 251, win 340, options [nop,nop,TS val 3741618417 ecr 16218747], length 0
16:29:35.559150 IP gke-test--cluster-08891d23-hift.c.test-project-23456.internal.46408 > CUSTOM-SERVICE-7d7b649bdb-gnllp.http-alt: Flags [P.], seq 251:1199, ack 1, win 333, options [nop,nop,TS val 16218747 ecr 3741618416], length 948: HTTP
16:29:35.559213 IP CUSTOM-SERVICE-7d7b649bdb-gnllp.http-alt > gke-test--cluster-08891d23-hift.c.test-project-23456.internal.46408: Flags [.], ack 1199, win 333, options [nop,nop,TS val 3741618417 ecr 16218747], length 0
16:29:35.572621 IP CUSTOM-SERVICE-7d7b649bdb-gnllp.http-alt > gke-test--cluster-08891d23-hift.c.test-project-23456.internal.46408: Flags [P.], seq 1:191, ack 1199, win 333, options [nop,nop,TS val 3741618430 ecr 16218747], length 190: HTTP: HTTP/1.1 200 OK
16:29:35.573221 IP gke-test--cluster-08891d23-hift.c.test-project-23456.internal.46408 > CUSTOM-SERVICE-7d7b649bdb-gnllp.http-alt: Flags [.], ack 191, win 332, options [nop,nop,TS val 16218761 ecr 3741618430], length 0
16:29:35.574975 IP gke-test--cluster-08891d23-hift.c.test-project-23456.internal.46408 > CUSTOM-SERVICE-7d7b649bdb-gnllp.http-alt: Flags [F.], seq 1199, ack 191, win 332, options [nop,nop,TS val 16218763 ecr 3741618430], length 0
16:29:35.575090 IP CUSTOM-SERVICE-7d7b649bdb-gnllp.http-alt > gke-test--cluster-08891d23-hift.c.test-project-23456.internal.46408: Flags [F.], seq 191, ack 1200, win 333, options [nop,nop,TS val 3741618433 ecr 16218763], length 0
16:29:35.575468 IP gke-test--cluster-08891d23-hift.c.test-project-23456.internal.46408 > CUSTOM-SERVICE-7d7b649bdb-gnllp.http-alt: Flags [.], ack 192, win 332, options [nop,nop,TS val 16218763 ecr 3741618433], length 0
```

**Comment by mittalsuraj18** [comment]
So i tried to destroy my current cluster and reinstall everything from scratch. and i am still facing this issue.
do we need to enable anything special on GKE?

**Comment by grampelberg** [comment]
Nope, I actually tested your repro case on GKE.
