### ISSUE TITLE
Debug container sometimes logs gLib-CRITICAL error

### ISSUE THREAD

**Issue by dadjeibaah** [linkerd/linkerd2#2860]
When running the emojivoto example app with the debug container enabled. Logs from `linkerd-debug` in any of the emojivoto pods output 
`(process:1): GLib-CRITICAL **: g_hash_table_lookup: assertion 'hash_table != NULL' failed`

```bash 
$ curl -s https://run.linkerd.io/emojivoto.yml | bin/linkerd inject --enable-debug-sidecar --manual -| kubectl apply -f -
$ kubectl -n emojivoto logs emoji-xxxx-xxx linkerd-debug | head -n 100
```
```bash
Running as user "root" and group "root". This could be dangerous.
Capturing on 'any'
tshark: cap_set_proc() fail return: Operation not permitted

tshark: cap_set_proc() fail return: Operation not permitted

    1 0.000000000 8a:74:ab:2f:8d:aa →              ARP 44 Who has 10.1.24.175? Tell 10.1.24.165
    2 0.468633300     10.1.0.1 → 10.1.24.172  TCP 76 43364 → 4191 [SYN] Seq=0 Win=29200 Len=0 MSS=1460 SACK_PERM=1 TSval=2972856 TSecr=0 WS=128
    3 0.468674100  10.1.24.172 → 10.1.0.1     TCP 76 4191 → 43364 [SYN, ACK] Seq=0 Ack=1 Win=28960 Len=0 MSS=1460 SACK_PERM=1 TSval=2972856 TSecr=2972856 WS=128
    4 0.468759400     10.1.0.1 → 10.1.24.172  TCP 68 43364 → 4191 [ACK] Seq=1 Ack=1 Win=29312 Len=0 TSval=2972856 TSecr=2972856
    5 0.469249400     10.1.0.1 → 10.1.24.172  HTTP 186 GET /ready HTTP/1.1
    6 0.469279800  10.1.24.172 → 10.1.0.1     TCP 68 4191 → 43364 [ACK] Seq=1 Ack=119 Win=29056 Len=0 TSval=2972856 TSecr=2972856
    7 0.470472500  10.1.24.172 → 10.1.0.1     HTTP 149 HTTP/1.1 200 OK
    8 0.470526000     10.1.0.1 → 10.1.24.172  TCP 68 43364 → 4191 [ACK] Seq=119 Ack=82 Win=29312 Len=0 TSval=2972856 TSecr=2972856
    9 0.470578900  10.1.24.172 → 10.1.0.1     TCP 68 4191 → 43364 [FIN, ACK] Seq=82 Ack=119 Win=29056 Len=0 TSval=2972856 TSecr=2972856
   10 0.470773200     10.1.0.1 → 10.1.24.172  TCP 68 43364 → 4191 [FIN, ACK] Seq=119 Ack=83 Win=29312 Len=0 TSval=2972856 TSecr=2972856
   11 0.470802500  10.1.24.172 → 10.1.0.1     TCP 68 4191 → 43364 [ACK] Seq=83 Ack=120 Win=29056 Len=0 TSval=2972856 TSecr=2972856
   12 1.754333200 3a:be:21:85:93:91 →              ARP 44 Who has 10.1.24.173? Tell 10.1.24.175
   13 1.778059600 aa:13:65:db:75:08 →              ARP 44 Who has 10.1.24.173? Tell 10.1.24.163
   14 3.796309500 8a:74:ab:2f:8d:aa →              ARP 44 Who has 10.1.24.172? Tell 10.1.24.165
   15 3.796661200 96:d7:35:28:6d:93 →              ARP 44 10.1.24.172 is at 96:d7:35:28:6d:93
   16 3.796779900  10.1.24.165 → 10.1.24.172  TCP 76 52336 → 4191 [SYN] Seq=0 Win=29200 Len=0 MSS=1460 SACK_PERM=1 TSval=2973189 TSecr=0 WS=128
   17 3.796816500  10.1.24.172 → 10.1.24.165  TCP 76 4191 → 52336 [SYN, ACK] Seq=0 Ack=1 Win=28960 Len=0 MSS=1460 SACK_PERM=1 TSval=2973189 TSecr=2973189 WS=128
   18 3.796909900  10.1.24.165 → 10.1.24.172  TCP 68 52336 → 4191 [ACK] Seq=1 Ack=1 Win=29312 Len=0 TSval=2973189 TSecr=2973189
   19 3.797274200  10.1.24.165 → 10.1.24.172  HTTP 349 GET /metrics HTTP/1.1
   20 3.797333400  10.1.24.172 → 10.1.24.165  TCP 68 4191 → 52336 [ACK] Seq=1 Ack=282 Win=30080 Len=0 TSval=2973189 TSecr=2973189
   21 3.798457800  10.1.24.172 → 10.1.24.165  HTTP 952 HTTP/1.1 200 OK  (text/plain)
   22 3.798573600  10.1.24.165 → 10.1.24.172  TCP 68 52336 → 4191 [ACK] Seq=282 Ack=885 Win=30976 Len=0 TSval=2973189 TSecr=2973189
   23 4.808322700 32:f1:61:21:40:37 →              ARP 44 Who has 10.1.24.172? Tell 10.1.24.173
   24 4.808643600 96:d7:35:28:6d:93 →              ARP 44 10.1.24.172 is at 96:d7:35:28:6d:93
   25 4.808739900  10.1.24.173 → 10.1.24.172  TCP 76 44468 → 8080 [SYN] Seq=0 Win=29200 Len=0 MSS=1460 SACK_PERM=1 TSval=2973290 TSecr=0 WS=128
   26 4.808773700  10.1.24.172 → 10.1.24.173  TCP 76 8080 → 44468 [SYN, ACK] Seq=0 Ack=1 Win=28960 Len=0 MSS=1460 SACK_PERM=1 TSval=2973290 TSecr=2973290 WS=128
   27 4.808850700  10.1.24.173 → 10.1.24.172  TCP 68 44468 → 8080 [ACK] Seq=1 Ack=1 Win=29312 Len=0 TSval=2973290 TSecr=2973290
   28 4.809372100  10.1.24.173 → 10.1.24.172  TCP 312 44468 → 8080 [PSH, ACK] Seq=1 Ack=1 Win=29312 Len=244 TSval=2973290 TSecr=2973290
   29 4.809411500  10.1.24.172 → 10.1.24.173  TCP 68 8080 → 44468 [ACK] Seq=1 Ack=245 Win=30080 Len=0 TSval=2973290 TSecr=2973290
   30 4.809668500  10.1.24.172 → 10.1.24.173  TCP 162 8080 → 44468 [PSH, ACK] Seq=1 Ack=245 Win=30080 Len=94 TSval=2973290 TSecr=2973290
   31 4.809761100  10.1.24.173 → 10.1.24.172  TCP 68 44468 → 8080 [ACK] Seq=245 Ack=95 Win=29312 Len=0 TSval=2973290 TSecr=2973290
   32 4.809781200  10.1.24.172 → 10.1.24.173  TCP 956 8080 → 44468 [PSH, ACK] Seq=95 Ack=245 Win=30080 Len=888 TSval=2973290 TSecr=2973290
   33 4.809851400  10.1.24.173 → 10.1.24.172  TCP 68 44468 → 8080 [ACK] Seq=245 Ack=983 Win=30976 Len=0 TSval=2973290 TSecr=2973290
   34 4.809870000  10.1.24.172 → 10.1.24.173  TCP 189 8080 → 44468 [PSH, ACK] Seq=983 Ack=245 Win=30080 Len=121 TSval=2973290 TSecr=2973290
   35 4.809922300  10.1.24.173 → 10.1.24.172  TCP 68 44468 → 8080 [ACK] Seq=245 Ack=1104 Win=30976 Len=0 TSval=2973290 TSecr=2973290
   36 4.809934900  10.1.24.172 → 10.1.24.173  TCP 145 8080 → 44468 [PSH, ACK] Seq=1104 Ack=245 Win=30080 Len=77 TSval=2973290 TSecr=2973290
   37 4.809990800  10.1.24.173 → 10.1.24.172  TCP 68 44468 → 8080 [ACK] Seq=245 Ack=1181 Win=30976 Len=0 TSval=2973290 TSecr=2973290
   38 4.810008600  10.1.24.172 → 10.1.24.173  TCP 77 8080 → 44468 [PSH, ACK] Seq=1181 Ack=245 Win=30080 Len=9 TSval=2973290 TSecr=2973290
   39 4.810060800  10.1.24.173 → 10.1.24.172  TCP 68 44468 → 8080 [ACK] Seq=245 Ack=1190 Win=30976 Len=0 TSval=2973290 TSecr=2973290
   40 4.810419900  10.1.24.173 → 10.1.24.172  TCP 951 44468 → 8080 [PSH, ACK] Seq=245 Ack=1190 Win=30976 Len=883 TSval=2973290 TSecr=2973290
   41 4.810492900  10.1.24.173 → 10.1.24.172  TCP 110 44468 → 8080 [PSH, ACK] Seq=1128 Ack=1190 Win=30976 Len=42 TSval=2973290 TSecr=2973290
   42 4.810507600  10.1.24.172 → 10.1.24.173  TCP 68 8080 → 44468 [ACK] Seq=1190 Ack=1170 Win=31872 Len=0 TSval=2973290 TSecr=2973290
   43 4.810577000  10.1.24.173 → 10.1.24.172  TCP 151 44468 → 8080 [PSH, ACK] Seq=1170 Ack=1190 Win=30976 Len=83 TSval=2973290 TSecr=2973290
   44 4.810619700  10.1.24.173 → 10.1.24.172  TCP 74 44468 → 8080 [PSH, ACK] Seq=1253 Ack=1190 Win=30976 Len=6 TSval=2973290 TSecr=2973290
   45 4.810662300  10.1.24.173 → 10.1.24.172  TCP 105 44468 → 8080 [PSH, ACK] Seq=1259 Ack=1190 Win=30976 Len=37 TSval=2973290 TSecr=2973290
   46 4.811390700  10.1.24.172 → 10.1.24.173  TCP 68 8080 → 44468 [ACK] Seq=1190 Ack=1296 Win=31872 Len=0 TSval=2973290 TSecr=2973290
   47 4.811694200  10.1.24.172 → 10.1.24.173  TCP 74 8080 → 44468 [PSH, ACK] Seq=1190 Ack=1296 Win=31872 Len=6 TSval=2973290 TSecr=2973290
   48 4.811761500  10.1.24.172 → 10.1.24.173  TCP 105 8080 → 44468 [PSH, ACK] Seq=1196 Ack=1296 Win=31872 Len=37 TSval=2973290 TSecr=2973290
   49 4.811861500  10.1.24.173 → 10.1.24.172  TCP 68 44468 → 8080 [ACK] Seq=1296 Ack=1233 Win=30976 Len=0 TSval=2973290 TSecr=2973290
   50 4.812060800  10.1.24.173 → 10.1.24.172  TCP 113 44468 → 8080 [PSH, ACK] Seq=1296 Ack=1233 Win=30976 Len=45 TSval=2973290 TSecr=2973290
   51 4.812231700  10.1.24.173 → 10.1.24.172  TCP 104 44468 → 8080 [PSH, ACK] Seq=1341 Ack=1233 Win=30976 Len=36 TSval=2973291 TSecr=2973290
   52 4.812331400  10.1.24.172 → 10.1.24.173  TCP 68 8080 → 44468 [ACK] Seq=1233 Ack=1377 Win=31872 Len=0 TSval=2973291 TSecr=2973290
   53 4.812392900  10.1.24.172 → 10.1.24.173  TCP 98 8080 → 44468 [PSH, ACK] Seq=1233 Ack=1377 Win=31872 Len=30 TSval=2973291 TSecr=2973290
   54 4.812419500  10.1.24.173 → 10.1.24.172  TCP 241 44468 → 8080 [PSH, ACK] Seq=1377 Ack=1233 Win=30976 Len=173 TSval=2973291 TSecr=2973291
   55 4.812491400  10.1.24.172 → 10.1.24.173  TCP 98 8080 → 44468 [PSH, ACK] Seq=1263 Ack=1550 Win=33664 Len=30 TSval=2973291 TSecr=2973291
   56 4.812518100  10.1.24.173 → 10.1.24.172  TCP 98 44468 → 8080 [PSH, ACK] Seq=1550 Ack=1263 Win=30976 Len=30 TSval=2973291 TSecr=2973291
   57 4.812993300    127.0.0.1 → 127.0.0.1    TCP 76 42668 → 8080 [SYN] Seq=0 Win=43690 Len=0 MSS=65495 SACK_PERM=1 TSval=2973291 TSecr=0 WS=128
   58 4.813024400    127.0.0.1 → 127.0.0.1    TCP 76 8080 → 42668 [SYN, ACK] Seq=0 Ack=1 Win=43690 Len=0 MSS=65495 SACK_PERM=1 TSval=2973291 TSecr=2973291 WS=128
   59 4.813054500    127.0.0.1 → 127.0.0.1    TCP 68 42668 → 8080 [ACK] Seq=1 Ack=1 Win=43776 Len=0 TSval=2973291 TSecr=2973291
   60 4.813721400    127.0.0.1 → 127.0.0.1    TCP 77 8080 → 42668 [PSH, ACK] Seq=1 Ack=1 Win=43776 Len=9 TSval=2973291 TSecr=2973291
   61 4.814080000    127.0.0.1 → 127.0.0.1    TCP 68 42668 → 8080 [ACK] Seq=1 Ack=10 Win=43776 Len=0 TSval=2973291 TSecr=2973291
   62 4.814240700    127.0.0.1 → 127.0.0.1    HTTP2 92 Magic

(process:1): GLib-CRITICAL **: g_hash_table_lookup: assertion 'hash_table != NULL' failed

(process:1): GLib-CRITICAL **: g_hash_table_lookup: assertion 'hash_table != NULL' failed

(process:1): GLib-CRITICAL **: g_hash_table_lookup: assertion 'hash_table != NULL' failed

(process:1): GLib-CRITICAL **: g_hash_table_lookup: assertion 'hash_table != NULL' failed

(process:1): GLib-CRITICAL **: g_hash_table_lookup: assertion 'hash_table != NULL' failed

(process:1): GLib-CRITICAL **: g_hash_table_lookup: assertion 'hash_table != NULL' failed

(process:1): GLib-CRITICAL **: g_hash_table_lookup: assertion 'hash_table != NULL' failed

(process:1): GLib-CRITICAL **: g_hash_table_lookup: assertion 'hash_table != NULL' failed

(process:1): GLib-CRITICAL **: g_hash_table_lookup: assertion 'hash_table != NULL' failed

(process:1): GLib-CRITICAL **: g_hash_table_lookup: assertion 'hash_table != NULL' failed

(process:1): GLib-CRITICAL **: g_hash_table_lookup: assertion 'hash_table != NULL' failed

(process:1): GLib-CRITICAL **: g_hash_table_lookup: assertion 'hash_table != NULL' failed

(process:1): GLib-CRITICAL **: g_hash_table_lookup: assertion 'hash_table != NULL' failed

(process:1): GLib-CRITICAL **: g_hash_table_lookup: assertion 'hash_table != NULL' failed

(process:1): GLib-CRITICAL **: g_hash_table_lookup: assertion 'hash_table != NULL' failed

(process:1): GLib-CRITICAL **: g_hash_table_lookup: assertion 'hash_table != NULL' failed
```
A quick google search suggests that the assertions are harmless as described [here](https://osqa-ask.wireshark.org/questions/36635/tshark-h-name-resolution-broken-in-1121). However, the issue described in that ticket might not be related to what we are seeing here.

**Comment by ihcsim** [comment]
Will it make a difference if we run the sidecar as a privilege container?

**Comment by dadjeibaah** [comment]
I am not 100% sure, but I think the container is already privileged?

**Comment by dadjeibaah** [comment]
@ihcsim, the errors still show up even after setting privileged to true on the `securityContext` for the linkerd-debug container.

**Comment by dadjeibaah** [comment]
So I think this might be a race condition of sorts with tshark. When I change the `ENTRYPOINT` of the container to `"tail", "-f", "/dev/null"` and then get the `tshark` output using `kubectl -n emojivoto exec -it emoji-cc7656498-dnzbc -c linkerd-debug -- tshark -i any` I no longer run into that warning.

**Comment by dadjeibaah** [comment]
The messages are mostly warnings and show up for a subset of workloads. They don't really affect functionality as well. I am going to close this ticket for now until there is more data about this.
