### ISSUE TITLE
linkerd-proxy not terminating after receiving shutdown via admin interface

### ISSUE THREAD

**Issue by svend** [linkerd/linkerd2#8033]
### What is the issue?

We have a Kubernetes cronjob that runs a backup job. We have the backup job wrapped with linkerd-await. 

1. The linkerd-await-wrapped command in the main container completes
2. linkerd-await sends the shutdown request to the proxy, and the main container terminates
3. The linkerd-proxy process receives the shutdown request (confirmed via `Received shutdown via admin interface` in the logs)
4. The linkerd-proxy does not terminate
5. The linkerd-proxy container is killed by kubelet because it is failing its liveness probe
6. Since the linkerd-proxy exits with a non-zero status, the Job's pod is considered a Failure and the Job creates a new pod (Job has restart policy `Never`)

### How can it be reproduced?

I can consistently reproduce this with the specific backup command in our environment. If I replace the backup command with a sleep that lasts about the same duration as the backup process, the problem goes away. I haven't found a reproduction case that works outside of our environment.

Here's the command and arguments.

``` yaml
    spec:
      containers:
      - args:
        - --shutdown
        - --
        - /backup.py
        command:
        - /linkerd/linkerd-await
```

I can manually inject the proxy, and comment out the linkerd-proxy liveness probe. In this case, the proxy is still running an hour after it receives the shutdown request. If `strace` on the running proxy would be helpful, let me know.
### Logs, error output, etc

Last lines of linkerd-proxy (`config.linkerd.io/proxy-log-level: "linkerd=debug"`):
```
[  2345.838203s]  INFO ThreadId(01) linkerd2_proxy: Received shutdown via admin interface
[  2345.838258s] DEBUG ThreadId(02) daemon:admin{listen.addr=0.0.0.0:4191}:accept{client.addr=127.0.0.1:53324}: linkerd_proxy_http::server: The process is shutting down the connection
[  2345.838302s] DEBUG ThreadId(02) daemon:admin{listen.addr=0.0.0.0:4191}:accept{client.addr=127.0.0.1:53324}: linkerd_app_core::serve: Connection closed
[  2345.838352s] DEBUG ThreadId(02) daemon:admin{listen.addr=0.0.0.0:4191}:accept{client.addr=10.7.21.115:55710}: linkerd_proxy_http::server: The process is shutting down the connection
[  2345.838437s] DEBUG ThreadId(02) daemon:admin{listen.addr=0.0.0.0:4191}:accept{client.addr=10.7.21.115:55710}: linkerd_app_core::serve: Connection closed
```

`kubectl describe` on the pod (default linkerd-proxy log level):

```
  linkerd-proxy:
    State:         Terminated
      Reason:      Error
      Message:     time="2022-03-05T00:04:00Z" level=info msg="running version stable-2.10.2"
[     0.002413s]  INFO ThreadId(01) linkerd2_proxy::rt: Using single-threaded proxy runtime
[     0.003099s]  INFO ThreadId(01) linkerd2_proxy: Admin interface on 0.0.0.0:4191
[     0.003114s]  INFO ThreadId(01) linkerd2_proxy: Inbound interface on 0.0.0.0:4143
[     0.003118s]  INFO ThreadId(01) linkerd2_proxy: Outbound interface on 127.0.0.1:4140
[     0.003121s]  INFO ThreadId(01) linkerd2_proxy: Tap interface on 0.0.0.0:4190
[     0.003124s]  INFO ThreadId(01) linkerd2_proxy: Local identity is default.util.serviceaccount.identity.linkerd.cluster.local
[     0.003132s]  INFO ThreadId(01) linkerd2_proxy: Identity verified via linkerd-identity-headless.linkerd.svc.cluster.local:8080 (linkerd-identity.linkerd.serviceaccount.identity.linkerd.cluster.local)
[     0.003137s]  INFO ThreadId(01) linkerd2_proxy: Destinations resolved via linkerd-dst-headless.linkerd.svc.cluster.local:8086 (linkerd-destination.linkerd.serviceaccount.identity.linkerd.cluster.local)
[     0.019383s]  INFO ThreadId(02) daemon:identity: linkerd_app: Certified identity: default.util.serviceaccount.identity.linkerd.cluster.local
[  2485.883364s]  INFO ThreadId(01) linkerd2_proxy: Received shutdown via admin interface

      Exit Code:    137
      Started:      Sat, 05 Mar 2022 00:04:00 +0000
      Finished:     Sat, 05 Mar 2022 00:46:23 +0000
    Ready:          False
    Restart Count:  0
Events:
  Warning  Unhealthy               83s (x3 over 103s)  kubelet                  Liveness probe failed: Get "http://10.7.10.25:4191/live": dial tcp 10.7.10.25:4191: connect: connection refused
  Normal   Killing                 83s                 kubelet                  Stopping container linkerd-proxy
  Warning  Unhealthy               53s (x7 over 103s)  kubelet                  Readiness probe failed: Get "http://10.7.10.25:4191/ready": dial tcp 10.7.10.25:4191: connect: connection refused
```

### output of `linkerd check -o short`

```
$ linkerd --context=infrastructure.us-west-2 check
kubernetes-api
--------------
√ can initialize the client
√ can query the Kubernetes API

kubernetes-version
------------------
√ is running the minimum Kubernetes API version
√ is running the minimum kubectl version

linkerd-existence
-----------------
√ 'linkerd-config' config map exists
√ heartbeat ServiceAccount exist
√ control plane replica sets are ready
√ no unschedulable pods
√ controller pod is running

linkerd-config
--------------
√ control plane Namespace exists
√ control plane ClusterRoles exist
√ control plane ClusterRoleBindings exist
√ control plane ServiceAccounts exist
√ control plane CustomResourceDefinitions exist
√ control plane MutatingWebhookConfigurations exist
√ control plane ValidatingWebhookConfigurations exist
W0308 15:20:20.489521   48728 warnings.go:67] policy/v1beta1 PodSecurityPolicy is deprecated in v1.21+, unavailable in v1.25+
√ control plane PodSecurityPolicies exist

linkerd-identity
----------------
√ certificate config is valid
√ trust anchors are using supported crypto algorithm
√ trust anchors are within their validity period
√ trust anchors are valid for at least 60 days
√ issuer cert is using supported crypto algorithm
√ issuer cert is within its validity period
√ issuer cert is valid for at least 60 days
√ issuer cert is issued by the trust anchor

linkerd-webhooks-and-apisvc-tls
-------------------------------
√ proxy-injector webhook has valid cert
√ proxy-injector cert is valid for at least 60 days
√ sp-validator webhook has valid cert
√ sp-validator cert is valid for at least 60 days

linkerd-api
-----------
√ control plane pods are ready
√ can initialize the client
√ can query the control plane API

linkerd-version
---------------
√ can determine the latest version
‼ cli is up-to-date
    is running version 2.10.2 but the latest stable version is 2.11.1
    see https://linkerd.io/2.10/checks/#l5d-version-cli for hints

control-plane-version
---------------------
‼ control plane is up-to-date
    is running version 2.10.2 but the latest stable version is 2.11.1
    see https://linkerd.io/2.10/checks/#l5d-version-control for hints
√ control plane and cli versions match

linkerd-ha-checks
-----------------
√ pod injection disabled on kube-system

Status check results are √

Linkerd extensions checks
=========================

linkerd-viz
-----------
√ linkerd-viz Namespace exists
√ linkerd-viz ClusterRoles exist
√ linkerd-viz ClusterRoleBindings exist
√ tap API server has valid cert
√ tap API server cert is valid for at least 60 days
√ tap API service is running
√ linkerd-viz pods are injected
√ viz extension pods are running
√ can initialize the client
√ viz extension self-check

Status check results are √
```

### Environment

* Kubernetes version: `Server Version: version.Info{Major:"1", Minor:"22", GitVersion:"v1.22.3", GitCommit:"c92036820499fedefec0f847e2054d824aea6cd1", GitTreeState:"clean", BuildDate:"2021-10-27T18:35:25Z", GoVersion:"go1.16.9", Compiler:"gc", Platform:"linux/amd64"}`
* Cluster environment: self-managed on AWS EC2
* Linkerd version: `Server version: stable-2.10.2`

### Would you like to work on fixing this bug?

Yes!

**Comment by tspearconquest** [comment]
@cpretzer asked me to comment and @ him

**Comment by olix0r** [comment]
One thing to note is that the proxy won't terminate as long as it has active connections open. It would be helpful to see proxy debug logs to determine whether there are open connections.

It would also be easiest to debug if we had a simple manifest that we could apply to reproduce this.

**Comment by cpretzer** [comment]
thanks @tspearconquest I'll work on getting this set up

**Comment by tspearconquest** [comment]
Hey, you're welcome! I made some additional edits up above to clarify a bit how everything is setup, so I wanted to make sure you catch that as well.

**Comment by cpretzer** [comment]
@tspearconquest  can you set the proxy log level to trace and share them?

**Comment by tspearconquest** [comment]
The only thing I can think of is that the container is firing off the email right away before the proxy has even started fully. Try this Dockerfile.

```
FROM alpine:latest

COPY ssmtp.conf /etc/ssmtp/ssmtp.conf

RUN apk update \
 && apk add ssmtp \
    busybox==1.33.1-r6 \
    ssl_client==1.33.1-r6 \
    libcrypto1.1==1.1.1l-r0 \
    apk-tools==2.12.7-r0 \
    libssl1.1==1.1.1l-r0 \
 && addgroup -S -g 10001 email \
 && adduser --disabled-password -u 10001 -S -g email email \
 && chown -R email:email /etc/ssmtp/ \
 && chmod -R 774 /etc/ssmtp/

USER email:email

# simply added sleep 180 to give the proxy container time to start
CMD sleep 180 && cd ~ \
    # "from" file needs to be built manually
 && echo "To: your-email@example.com" >> from \
 && echo "From: cluster-email@example.com" >> from \
 && echo "Subject: Test" >> from \
 && echo "" >> from \
 && echo "Test email" >> from \
 && cat ~/from | { ssmtp -vv your-email@example.com || cat ~/dead.letter || echo "Unable to send email and unable to find email failure report."; } \
    # Shuts down linkerd but doesn't fail the job if linkerd-proxy isn't available in the pod
 && { curl -X POST -d hello=shutdown http://localhost:4191/shutdown || /bin/true; }
```

**Comment by tspearconquest** [comment]
> @tspearconquest can you set the proxy log level to trace and share them?

I'll test it out tonight and let you know.

**Comment by cpretzer** [comment]
@tspearconquest after adding the sleep command, I'm seeing pods running to completion and being cleaned up. 

Here's a sample of the linkerd-proxy state from `kubectl describe`:

```
  linkerd-proxy:
    Container ID:   containerd://03dbd11cae104bccb2738654afbda4c0ff6a04e145cae2f5292cb3ed7ff25add
    Image:          cr.l5d.io/linkerd/proxy:stable-2.10.2
    Image ID:       cr.l5d.io/linkerd/proxy@sha256:7dd7f009acc6b5662acd1166ef9e99be583ae63362c3643e163955870f304ef8
    Ports:          4143/TCP, 4191/TCP
    Host Ports:     0/TCP, 0/TCP
    State:          Terminated
      Reason:       Completed
      Exit Code:    0
      Started:      Wed, 16 Mar 2022 11:09:02 -0700
      Finished:     Wed, 16 Mar 2022 11:12:02 -0700
```

Perhaps the example is too simple?

**Comment by tspearconquest** [comment]
I was afraid of that, but no problem I have a dev environment for a reason. :)
I will get you the trace logs as soon as I can.

**Comment by tspearconquest** [comment]
I do notice you're using proxy stable-2.10.2. Can you try with stable-2.11.1 with the example?

**Comment by cpretzer** [comment]
@tspearconquest sure, I can test with 2.11.1, I'm using 2.10.2 because that's what @svend used in his original post

**Comment by tspearconquest** [comment]
Oh, you're right, I hadn't noticed that. Thanks for mentioning it, no need to test on the higher version in this case.

**Comment by tspearconquest** [comment]
Hi, I wanted to let you know I haven't had an opportunity to get this yet but I am planning on getting this info to you this week.

**Comment by cpretzer** [comment]
Thanks for the update @tspearconquest 

@svend have you had a chance to collect the log and metric info from your scenario?

**Comment by svend** [comment]
> @svend have you had a chance to collect the log and metric info from your scenario?

I set `config.linkerd.io/proxy-log-level: linkerd=trace`. Here is the tail of the linkerd-proxy logs:

```
[  2289.392871s] DEBUG ThreadId(02) daemon:admin{listen.addr=0.0.0.0:4191}:accept{client.addr=10.140.9.27:59896}: linkerd_tls::server: Peeked bytes from TCP stream sz=107
[  2289.392927s] DEBUG ThreadId(02) daemon:admin{listen.addr=0.0.0.0:4191}:accept{client.addr=10.140.9.27:59896}: linkerd_detect: DetectResult protocol=Some(Http1) elapsed=6.861µs
[  2289.392936s] DEBUG ThreadId(02) daemon:admin{listen.addr=0.0.0.0:4191}:accept{client.addr=10.140.9.27:59896}: linkerd_proxy_http::server: Creating HTTP service version=Http1
[  2289.392947s] DEBUG ThreadId(02) daemon:admin{listen.addr=0.0.0.0:4191}:accept{client.addr=10.140.9.27:59896}: linkerd_proxy_http::server: Handling as HTTP version=Http1
[  2289.393069s] DEBUG ThreadId(02) daemon:admin{listen.addr=0.0.0.0:4191}:accept{client.addr=10.140.9.27:59896}: linkerd_proxy_http::server: The client is shutting down the connection res=Ok(())
[  2289.393096s] DEBUG ThreadId(02) daemon:admin{listen.addr=0.0.0.0:4191}:accept{client.addr=10.140.9.27:59896}: linkerd_app_core::serve: Connection closed
[  2299.392586s] DEBUG ThreadId(02) daemon:admin{listen.addr=0.0.0.0:4191}:accept{client.addr=10.140.9.27:60048}: linkerd_tls::server: Peeked bytes from TCP stream sz=107
[  2299.392626s] DEBUG ThreadId(02) daemon:admin{listen.addr=0.0.0.0:4191}:accept{client.addr=10.140.9.27:60048}: linkerd_detect: DetectResult protocol=Some(Http1) elapsed=7.175µs
[  2299.392634s] DEBUG ThreadId(02) daemon:admin{listen.addr=0.0.0.0:4191}:accept{client.addr=10.140.9.27:60048}: linkerd_proxy_http::server: Creating HTTP service version=Http1
[  2299.392644s] DEBUG ThreadId(02) daemon:admin{listen.addr=0.0.0.0:4191}:accept{client.addr=10.140.9.27:60048}: linkerd_proxy_http::server: Handling as HTTP version=Http1
[  2299.392785s] DEBUG ThreadId(02) daemon:admin{listen.addr=0.0.0.0:4191}:accept{client.addr=10.140.9.27:60048}: linkerd_proxy_http::server: The client is shutting down the connection res=Ok(())
[  2299.392817s] DEBUG ThreadId(02) daemon:admin{listen.addr=0.0.0.0:4191}:accept{client.addr=10.140.9.27:60048}: linkerd_app_core::serve: Connection closed
[  2309.392020s] DEBUG ThreadId(02) daemon:admin{listen.addr=0.0.0.0:4191}:accept{client.addr=10.140.9.27:60386}: linkerd_tls::server: Peeked bytes from TCP stream sz=107
[  2309.392063s] DEBUG ThreadId(02) daemon:admin{listen.addr=0.0.0.0:4191}:accept{client.addr=10.140.9.27:60386}: linkerd_detect: DetectResult protocol=Some(Http1) elapsed=6.277µs
[  2309.392073s] DEBUG ThreadId(02) daemon:admin{listen.addr=0.0.0.0:4191}:accept{client.addr=10.140.9.27:60386}: linkerd_proxy_http::server: Creating HTTP service version=Http1
[  2309.392083s] DEBUG ThreadId(02) daemon:admin{listen.addr=0.0.0.0:4191}:accept{client.addr=10.140.9.27:60386}: linkerd_proxy_http::server: Handling as HTTP version=Http1
[  2309.392199s] DEBUG ThreadId(02) daemon:admin{listen.addr=0.0.0.0:4191}:accept{client.addr=10.140.9.27:60386}: linkerd_proxy_http::server: The client is shutting down the connection res=Ok(())
[  2309.392225s] DEBUG ThreadId(02) daemon:admin{listen.addr=0.0.0.0:4191}:accept{client.addr=10.140.9.27:60386}: linkerd_app_core::serve: Connection closed
[  2319.392381s] DEBUG ThreadId(02) daemon:admin{listen.addr=0.0.0.0:4191}:accept{client.addr=10.140.9.27:60884}: linkerd_tls::server: Peeked bytes from TCP stream sz=107
[  2319.392424s] DEBUG ThreadId(02) daemon:admin{listen.addr=0.0.0.0:4191}:accept{client.addr=10.140.9.27:60884}: linkerd_detect: DetectResult protocol=Some(Http1) elapsed=6.479µs
[  2319.392435s] DEBUG ThreadId(02) daemon:admin{listen.addr=0.0.0.0:4191}:accept{client.addr=10.140.9.27:60884}: linkerd_proxy_http::server: Creating HTTP service version=Http1
[  2319.392447s] DEBUG ThreadId(02) daemon:admin{listen.addr=0.0.0.0:4191}:accept{client.addr=10.140.9.27:60884}: linkerd_proxy_http::server: Handling as HTTP version=Http1
[  2319.392569s] DEBUG ThreadId(02) daemon:admin{listen.addr=0.0.0.0:4191}:accept{client.addr=10.140.9.27:60884}: linkerd_proxy_http::server: The client is shutting down the connection res=Ok(())
[  2319.392597s] DEBUG ThreadId(02) daemon:admin{listen.addr=0.0.0.0:4191}:accept{client.addr=10.140.9.27:60884}: linkerd_app_core::serve: Connection closed
[  2329.391851s] DEBUG ThreadId(02) daemon:admin{listen.addr=0.0.0.0:4191}:accept{client.addr=10.140.9.27:61308}: linkerd_tls::server: Peeked bytes from TCP stream sz=107
[  2329.391891s] DEBUG ThreadId(02) daemon:admin{listen.addr=0.0.0.0:4191}:accept{client.addr=10.140.9.27:61308}: linkerd_detect: DetectResult protocol=Some(Http1) elapsed=6.649µs
[  2329.391900s] DEBUG ThreadId(02) daemon:admin{listen.addr=0.0.0.0:4191}:accept{client.addr=10.140.9.27:61308}: linkerd_proxy_http::server: Creating HTTP service version=Http1
[  2329.391910s] DEBUG ThreadId(02) daemon:admin{listen.addr=0.0.0.0:4191}:accept{client.addr=10.140.9.27:61308}: linkerd_proxy_http::server: Handling as HTTP version=Http1
[  2329.392060s] DEBUG ThreadId(02) daemon:admin{listen.addr=0.0.0.0:4191}:accept{client.addr=10.140.9.27:61308}: linkerd_proxy_http::server: The client is shutting down the connection res=Ok(())
[  2329.392093s] DEBUG ThreadId(02) daemon:admin{listen.addr=0.0.0.0:4191}:accept{client.addr=10.140.9.27:61308}: linkerd_app_core::serve: Connection closed
[  2339.392535s] DEBUG ThreadId(02) daemon:admin{listen.addr=0.0.0.0:4191}:accept{client.addr=10.140.9.27:61618}: linkerd_tls::server: Peeked bytes from TCP stream sz=107
[  2339.392574s] DEBUG ThreadId(02) daemon:admin{listen.addr=0.0.0.0:4191}:accept{client.addr=10.140.9.27:61618}: linkerd_detect: DetectResult protocol=Some(Http1) elapsed=5.999µs
[  2339.392584s] DEBUG ThreadId(02) daemon:admin{listen.addr=0.0.0.0:4191}:accept{client.addr=10.140.9.27:61618}: linkerd_proxy_http::server: Creating HTTP service version=Http1
[  2339.392595s] DEBUG ThreadId(02) daemon:admin{listen.addr=0.0.0.0:4191}:accept{client.addr=10.140.9.27:61618}: linkerd_proxy_http::server: Handling as HTTP version=Http1
[  2339.392722s] DEBUG ThreadId(02) daemon:admin{listen.addr=0.0.0.0:4191}:accept{client.addr=10.140.9.27:61618}: linkerd_proxy_http::server: The client is shutting down the connection res=Ok(())
[  2339.392755s] DEBUG ThreadId(02) daemon:admin{listen.addr=0.0.0.0:4191}:accept{client.addr=10.140.9.27:61618}: linkerd_app_core::serve: Connection closed
[  2341.879624s] DEBUG ThreadId(01) outbound:accept{client.addr=10.7.8.188:49772}:server{orig_dst=169.254.169.254:80}:http{v=1.x}: linkerd_proxy_http::server: The client is shutting down the connection res=Ok(())
[  2341.879691s] DEBUG ThreadId(01) outbound:accept{client.addr=10.7.8.188:49772}: linkerd_app_core::serve: Connection closed
[  2341.879731s] DEBUG ThreadId(01) evict{target=Accept { orig_dst: OrigDstAddr(169.254.169.254:80), protocol: () }}: linkerd_cache: Awaiting idleness
[  2341.902829s] DEBUG ThreadId(02) daemon:admin{listen.addr=0.0.0.0:4191}:accept{client.addr=127.0.0.1:41350}: linkerd_tls::server: Peeked bytes from TCP stream sz=49
[  2341.902864s] DEBUG ThreadId(02) daemon:admin{listen.addr=0.0.0.0:4191}:accept{client.addr=127.0.0.1:41350}: linkerd_detect: DetectResult protocol=Some(Http1) elapsed=7.08µs
[  2341.902873s] DEBUG ThreadId(02) daemon:admin{listen.addr=0.0.0.0:4191}:accept{client.addr=127.0.0.1:41350}: linkerd_proxy_http::server: Creating HTTP service version=Http1
[  2341.902883s] DEBUG ThreadId(02) daemon:admin{listen.addr=0.0.0.0:4191}:accept{client.addr=127.0.0.1:41350}: linkerd_proxy_http::server: Handling as HTTP version=Http1
[  2341.902944s]  INFO ThreadId(01) linkerd2_proxy: Received shutdown via admin interface
[  2341.903003s] DEBUG ThreadId(02) daemon:admin{listen.addr=0.0.0.0:4191}:accept{client.addr=127.0.0.1:41350}: linkerd_proxy_http::server: The process is shutting down the connection
[  2341.903045s] DEBUG ThreadId(02) daemon:admin{listen.addr=0.0.0.0:4191}:accept{client.addr=127.0.0.1:41350}: linkerd_app_core::serve: Connection closed
[  2341.903086s] DEBUG ThreadId(02) daemon:admin{listen.addr=0.0.0.0:4191}:accept{client.addr=10.7.21.115:39060}: linkerd_proxy_http::server: The process is shutting down the connection
[  2341.903167s] DEBUG ThreadId(02) daemon:admin{listen.addr=0.0.0.0:4191}:accept{client.addr=10.7.21.115:39060}: linkerd_app_core::serve: Connection closed
```

I was not able to get metrics; Connections to the linkerd-proxy admin port are refused.

```
$ kubectl -n util port-forward <pod> 4191:4191 &
Forwarding from 127.0.0.1:4191 -> 4191
Forwarding from [::1]:4191 -> 4191
$ curl localhost:4191/metrics
Handling connection for 4191
E0321 22:58:17.627192   37062 portforward.go:406] an error occurred forwarding 4191 -> 4191: error forwarding port 4191 to pod 17045fd4ba38bea1765c701bf667b28e6e8343c3107a98889b3190dd97f19655, uid : failed to execute portforward in network namespace "/var/run/netns/cni-483ef628-ab18-fc78-54c0-7cbcfe734bf9": failed to dial 4191: dial tcp4 127.0.0.1:4191: connect: connection refused
E0321 22:58:17.627388   37062 portforward.go:234] lost connection to pod
curl: (56) Recv failure: Connection reset by peer
```

All the containers in the pod except linkerd-proxy have exited.

```
$ sudo crictl ps --pod 17045fd4ba38b -a
CONTAINER           IMAGE               CREATED             STATE               NAME                ATTEMPT             POD ID
db458d5cb434f       cd97b62ae8a2d       56 minutes ago      Running             linkerd-proxy       0                   17045fd4ba38b
c1db7c7784fba       60b53f49ba236       56 minutes ago      Exited              backup              0                   17045fd4ba38b
ec9404c085462       01b35dbf8c586       56 minutes ago      Exited              linkerd-init        0                   17045fd4ba38b
07cae1242db16       4bf5bb405b071       56 minutes ago      Exited              linkerd-await       0                   17045fd4ba38b
```

I checked the open network connections for the pod's namespace:

```
ssorensen-local@ip-10-140-9-27:~$ sudo ip netns exec cni-483ef628-ab18-fc78-54c0-7cbcfe734bf9 ss -tupn
Netid          State                Recv-Q            Send-Q                        Local Address:Port                        Peer Address:Port                                                                  
tcp            FIN-WAIT-2           0                 0                                 127.0.0.1:4140                          10.7.8.188:46090            users:(("linkerd2-proxy",pid=18623,fd=23))           
tcp            FIN-WAIT-2           0                 0                                 127.0.0.1:4140                          10.7.8.188:38018            users:(("linkerd2-proxy",pid=18623,fd=29))           
tcp            FIN-WAIT-2           0                 0                                 127.0.0.1:4140                          10.7.8.188:37980            users:(("linkerd2-proxy",pid=18623,fd=24))           
tcp            FIN-WAIT-2           0                 0                                 127.0.0.1:4140                          10.7.8.188:37736            users:(("linkerd2-proxy",pid=18623,fd=25))           
tcp            FIN-WAIT-2           0                 0                                 127.0.0.1:4140                          10.7.8.188:50416            users:(("linkerd2-proxy",pid=18623,fd=42))           
tcp            FIN-WAIT-2           0                 0                                 127.0.0.1:4140                          10.7.8.188:46078            users:(("linkerd2-proxy",pid=18623,fd=28))           
tcp            FIN-WAIT-2           0                 0                                 127.0.0.1:4140                          10.7.8.188:46094            users:(("linkerd2-proxy",pid=18623,fd=26))           
tcp            FIN-WAIT-2           0                 0                                 127.0.0.1:4140                          10.7.8.188:37974            users:(("linkerd2-proxy",pid=18623,fd=36))           
tcp            CLOSE-WAIT           1                 0                                10.7.8.188:40934                         10.7.21.20:8080             users:(("linkerd2-proxy",pid=18623,fd=18))           
tcp            FIN-WAIT-2           0                 0                                 127.0.0.1:4140                          10.7.8.188:43866            users:(("linkerd2-proxy",pid=18623,fd=22))           
tcp            ESTAB                0                 0                                10.7.8.188:53642                         10.7.9.221:8080             users:(("linkerd2-proxy",pid=18623,fd=19))           
tcp            FIN-WAIT-2           0                 0                                 127.0.0.1:4140                          10.7.8.188:60658            users:(("linkerd2-proxy",pid=18623,fd=37))           
tcp            ESTAB                1859              0                                10.7.8.188:40810                         10.7.14.70:8080             users:(("linkerd2-proxy",pid=18623,fd=17))           
tcp            FIN-WAIT-2           0                 0                                 127.0.0.1:4140                          10.7.8.188:37728            users:(("linkerd2-proxy",pid=18623,fd=34))           
```

I checked the connections to `:8080`, and they are all `linkerd-identity` pod IP addresses.

Here is an `strace` of the linkerd-proxy process:

```
$ sudo strace -p 18623
strace: Process 18623 attached
epoll_wait(3, [{EPOLLIN|EPOLLOUT, {u32=7, u64=7}}], 1024, -1) = 1
recvfrom(19, "\27\3\3\0\"Cg\377`\367\217\5\330\367\230A\272\305+{\240Zf\344F6\237\251>\3\215\237"..., 18437, 0, NULL, NULL) = 39
recvfrom(19, 0x560e12738a70, 18437, 0, NULL, NULL) = -1 EAGAIN (Resource temporarily unavailable)
writev(19, [{iov_base="\27\3\3\0\"\375\307{\364:\320\305U\24\3V\220\203!\"\322\ty\3729\223/4\16\266\221\22"..., iov_len=39}], 1) = 39
epoll_wait(3, [{EPOLLIN|EPOLLOUT, {u32=7, u64=7}}], 1024, -1) = 1
recvfrom(19, "\27\3\3\0\"\251$\262\247\34]'0k\374\331\212\337\367\230\377\20\373\337\344J\200\234\222\34\203\265"..., 18437, 0, NULL, NULL) = 39
recvfrom(19, 0x560e12738a70, 18437, 0, NULL, NULL) = -1 EAGAIN (Resource temporarily unavailable)
writev(19, [{iov_base="\27\3\3\0\"\246\262/\274\341\261\23~\217@0\210\21\250\270\3106\376\266\355cR\2363h\243\202"..., iov_len=39}], 1) = 39
epoll_wait(3,   C-c C-cstrace: Process 18623 detached
 <detached ...>
```

FD 19 is one of the established connections to a `linkerd-idenity` pod.

**Comment by cpretzer** [comment]
Thanks for this detail @svend I figured there was a chance that the `/metrics` endpoint would be unavailable, but it was worth a shot. 

Can you describe what the job does and how it compares to the SMTP example that @tspearconquest provided?

It would also help to see the `crictl inspect` output for the linkerd-proxy container, just to get a little more detail. 

If I'm correctly reading your message about the connections to 8080, then the implication is that a connection to the `linkerd-identity` service might be preventing the proxy from shutting down? Have you checked the logs of the identity service for more info? It may be helpful to turn the log-level on the identity service to a verbose setting like debug or trace. I'd have to look at the source to figure out how much additional logging is available at those log levels

**Comment by JacobHenner** [comment]
I'm also experiencing this issue. I'm using edge-22.3.5 in HA mode, with init container injection enabled (as opposed to the CNI), on Kubernetes 1.21 with the [aws-vpc-cni](https://github.com/aws/amazon-vpc-cni-k8s), using docker as the container runtime.

My logs are quite similar to the ones @svend [shared above](https://github.com/linkerd/linkerd2/issues/8033#issuecomment-1074527147). After the job's "main" container exits (using linkerd-await's `--shutdown` mode), the proxy container receives the shutdown command but fails to exit cleanly before it's killed by its liveness probe. 

At the time the linkerd-proxy shutdown was triggered, the only open connections were connections to all three of the linkerd-identity pods running in the cluster, and the proxy connection (src 127.0.0.1:4140) in `FIN-WAIT-2`:

```
Netid    State          Recv-Q      Send-Q            Local Address:Port              Peer Address:Port
tcp      FIN-WAIT-2     0           0                     127.0.0.1:4140             100.64.99.248:57718      users:(("linkerd2-proxy",pid=13368,fd=20))
tcp      ESTAB          0           0                 100.64.99.248:57148           100.64.108.211:8086       users:(("linkerd2-proxy",pid=13368,fd=23))
tcp      ESTAB          0           0                 100.64.99.248:40266           100.64.118.141:8086       users:(("linkerd2-proxy",pid=13368,fd=22))
tcp      ESTAB          0           0                 100.64.99.248:41914            100.64.99.174:8086       users:(("linkerd2-proxy",pid=13368,fd=24))
```

I did not see any interesting entries in the logs of those three pods, although they were running with the default verbosity.

The trace logs from an impacted proxy container (possibly different than the one above) post-shutdown-request are as follows:

```
[   863.870557s]  INFO ThreadId(01) linkerd2_proxy: Received shutdown via admin interface
[   863.870604s] TRACE ThreadId(01) inbound:controller{addr=linkerd-dst-headless.linkerd.svc.cluster.local:8086}: linkerd_stack_tracing: drop
[   863.870606s] DEBUG ThreadId(02) daemon:admin{listen.addr=0.0.0.0:4191}:accept{client.addr=127.0.0.1:53176}: linkerd_proxy_http::server: The process is shutting down the connection
[   863.870641s] TRACE ThreadId(01) inbound:controller{addr=linkerd-dst-headless.linkerd.svc.cluster.local:8086}: linkerd_stack_tracing: drop
[   863.870691s] TRACE ThreadId(01) inbound:controller{addr=linkerd-dst-headless.linkerd.svc.cluster.local:8086}: linkerd_stack_tracing: drop
[   863.870699s] TRACE ThreadId(01) inbound:controller{addr=linkerd-dst-headless.linkerd.svc.cluster.local:8086}: linkerd_stack_tracing: drop
[   863.870703s] TRACE ThreadId(02) daemon:admin{listen.addr=0.0.0.0:4191}:accept{client.addr=127.0.0.1:53176}: linkerd_detect: Connection completed
[   863.870729s] DEBUG ThreadId(02) daemon:admin{listen.addr=0.0.0.0:4191}:accept{client.addr=127.0.0.1:53176}: linkerd_app_core::serve: Connection closed
[   863.870707s] TRACE ThreadId(01) inbound:controller{addr=linkerd-dst-headless.linkerd.svc.cluster.local:8086}: linkerd_stack_tracing: drop
[   863.870800s] TRACE ThreadId(01) inbound:controller{addr=linkerd-dst-headless.linkerd.svc.cluster.local:8086}: linkerd_stack_tracing: drop
[   863.870824s] TRACE ThreadId(01) outbound:controller{addr=linkerd-dst-headless.linkerd.svc.cluster.local:8086}: linkerd_stack_tracing: drop
[   863.870850s] DEBUG ThreadId(01) linkerd_meshtls_rustls::server: ALPN TLS config receivers dropped
[   863.870858s] TRACE ThreadId(01) policy:watch{port=4191}: linkerd_tonic_watch: Receivers dropped
[   863.870873s] TRACE ThreadId(01) policy:watch{port=4191}:controller{addr=linkerd-policy.linkerd.svc.cluster.local:8090}: linkerd_stack_tracing: drop
[   863.870971s] TRACE ThreadId(01) endpoint{addr=100.64.99.174:8090}: linkerd_stack_tracing: drop
[   863.870987s] TRACE ThreadId(01) policy:watch{port=4191}:controller{addr=linkerd-policy.linkerd.svc.cluster.local:8090}:endpoint{addr=100.64.118.141:8090}: linkerd_stack_tracing: drop
[   863.870992s] TRACE ThreadId(01) policy:watch{port=4191}:controller{addr=linkerd-policy.linkerd.svc.cluster.local:8090}:endpoint{addr=100.64.108.211:8090}: linkerd_stack_tracing: drop
[   863.871000s] TRACE ThreadId(01) policy:watch{port=4191}:controller{addr=linkerd-policy.linkerd.svc.cluster.local:8090}: linkerd_proxy_dns_resolve: Closed
[   867.505023s] TRACE ThreadId(01) evict{target=Accept { orig_dst: OrigDstAddr(172.65.251.78:443), protocol: () }}: linkerd_cache: Cache already dropped
```

Please let me know if there are other logs that would help narrow down the cause of this issue.

**Comment by olix0r** [comment]
What does the application container traffic look like on these pods (when it is running)? Does the application expose any servers (e.g., for probes)? What sorts of clients does the application build?

**Comment by JacobHenner** [comment]
> What does the application container traffic look like on these pods (when it is running)?

Outbound: Typical HTTP traffic, TCP traffic on port 4373, and connections to the Kubernetes control plane. Destinations include meshed services, non-meshed services on an internal network, and services on the internet.
Inbound: None expected. No probes, no ports defined, etc.

> Does the application expose any servers (e.g., for probes)?

No

> Is this behavior observed with a variety of application types? If we were going to try to get a more realistic repro together, what would the application pod do?

No. So far we've only seen it with one application. Identical copies of this application exist in several similarly-configured clusters, and only two clusters have been affected. Interestingly, the issue seems to have resolved itself in one of those two clusters, but persists in the other. The only linkerd configuration difference between these two clusters is the memory request/limit values for the proxy-injector and destination service. The outbound traffic of this application in both clusters is similar in protocol, but to a different set of destinations.

> what would the application pod do?

In this case, it connects to some services within our internal network, clones a git repository, pushes changes to a git remote on the internet, and makes several read/write operations against the Kubernetes control plane of the cluster the application is running in.

**Comment by JacobHenner** [comment]
I've collected additional logs for linkerd-identity, linkerd-destination, the application, and their linkerd proxies. See https://gist.github.com/JacobHenner/e5968f80fb0f5627241f533d88cd51f4, and let me know if additional logs would be helpful.

**Comment by JacobHenner** [comment]
In my case, it appears as if an outbound connection to a non-meshed HTTPS service on the internet is not closed. In the debug tshark output I see FIN ACKs from the service to my application, followed by a bunch of TCP keepalives, but it does not look like the application finished closing the connection. The connection does not appear to be reset either. Oddly, the application explicitly attempts to close all connections to that destination. Perhaps something is going wrong there. I'll look into this in greater detail and report back.

**Comment by JacobHenner** [comment]
> Oddly, the application explicitly attempts to close all connections to that destination. Perhaps something is going wrong there. I'll look into this in greater detail and report back.

I've identified the pattern responsible for the failure:

* An application using Python's [requests](https://docs.python-requests.org/en/latest/) library creates a "session" (which manages connection pooling).
* Within the context of the session, an HTTP (https) request is made to a non-meshed service. A response is received, but the connection remains open due to the requests session's connection pooling.
* That non-meshed service has TCP keepalives enabled, with keepalive packets being sent every 15 seconds.
* After 400 seconds, the destination closes its side of the TCP connection (TCP FIN). The source (application) side keeps its connection open at this point. The non-meshed destination continues to send TCP keepalives.
* After some time has passed, the application exits. A TCP RST is transmitted. In the failure case, tshark indicates that the RST was directed to the non-meshed destination service's IP address and port, with a source port that typically sends traffic to the linkerd-proxy on 4140. In non-failure cases, tshark indicates that the RST was directed to linkerd-proxy on 4140.
  * I haven't yet determined why this difference exists, but I have some suspicions (see below).
* In the success case, the RST to linkerd-proxy causes linkerd-proxy to send a TCP FIN to the non-meshed destination service, and the connection is closed.
* In the failure case, no TCP FIN is transmitted to the non-meshed destination. The non-meshed destination continues to send keepalives while linkerd-proxy is attempting to shut down. Eventually, after linkerd-proxy fails its livenessProbe, linkerd-proxy sends a TCP FIN to the non-meshed destination service.

Other helpful observations/notes:

* The failure does not occur unless the destination has closed its side of the TCP connection. This complicated identification of the cause, as only some instances of this application run for longer than 400s in our environment (the time at which the destination sends a TCP FIN).
* The same category of issue (unexpected continuation of keepalives) does not occur if the client attempts to reuse the half-opened connection before exiting. In this case the app will transmit a TCP RST and linkerd-proxy will transmit TCP FIN before establishing a new connection.
* This issue does not occur when outbound port 443 is excluded from proxying (as expected).
* I have not experimented with destinations other than the ones in my example (GitLab.com). I'm unsure if the 15 second keepalive period and 400 second maximum connection duration is determined by GitLab. I'm pretty confident the 15 second period is, but less sure about the 400 second max duration. I assume this class of issue might affect some combination of TCP keepalive configuration and atypical TCP connection close behavior.

As for the observed difference in RST destinations - I have not been able to reliably reproduce the success case, but I have reliably reproduced the failure case. 

* To reproduce the failure case, I call `sys.exit(0)` without explicitly closing the session object's connection pool. 
* To reproduce the success case, I [explicitly close the session](https://2.python-requests.org/en/master/api/#requests.Session.close) before exiting.  However, If `session.close()` is immediately followed by `sys.exit()`, the results have been inconsistent in my experiments.

### Packet capture examples

#### Failure case

HTTP call made at approximately 50 seconds. At 451 seconds, the non-meshed destination (GitLab.com) closes its side of the connection:

```
 1121 451.239184090 172.65.251.78 → 100.64.98.109 TCP 56 443 → 51262 [FIN, ACK] Seq=20493 Ack=1091 Win=70656 Len=0
 1123 451.239411842 172.65.251.78 → 100.64.98.109 TCP 68 443 → 51260 [FIN, ACK] Seq=20493 Ack=1091 Win=65536 Len=0 TSval=2115215706 TSecr=1869662329
 1125 451.244259029 100.64.98.109 → 172.65.251.78 TCP 68 51262 → 443 [ACK] Seq=1091 Ack=20494 Win=56576 Len=0 SLE=20493 SRE=20494
 1127 451.252722052 100.64.98.109 → 127.0.0.1    TCP 80 51260 → 4140 [ACK] Seq=1091 Ack=20494 Win=56704 Len=0 TSval=1870062344 TSecr=2115215706 SLE=20493 SRE=20494

```

However, keepalives continue:

```
 1416 563.969278904 172.65.251.78 → 100.64.98.109 TCP 56 [TCP Keep-Alive] 443 → 51262 [ACK] Seq=20493 Ack=1091 Win=70656 Len=0                      [15/9653]
 1417 563.969306274 100.64.98.109 → 172.65.251.78 TCP 56 [TCP Keep-Alive ACK] 51262 → 443 [ACK] Seq=1091 Ack=20494 Win=56576 Len=0
 1418 569.090222161 172.65.251.78 → 100.64.98.109 TCP 56 [TCP Keep-Alive] 443 → 51262 [ACK] Seq=20493 Ack=1091 Win=70656 Len=0
 1419 569.090249411 100.64.98.109 → 172.65.251.78 TCP 56 [TCP Keep-Alive ACK] 51262 → 443 [ACK] Seq=1091 Ack=20494 Win=56576 Len=0
 1440 574.209242933 172.65.251.78 → 100.64.98.109 TCP 56 [TCP Keep-Alive] 443 → 51262 [ACK] Seq=20493 Ack=1091 Win=70656 Len=0
 1441 574.209267883 100.64.98.109 → 172.65.251.78 TCP 56 [TCP Keep-Alive ACK] 51262 → 443 [ACK] Seq=1091 Ack=20494 Win=56576 Len=0
```

When the application exits, an RST is sent from the application. The destination appears to be port 443 on the remote service, but the source port (51260) appears to be the port that has previously communicated with port 4140 on localhost instead of the remote service (which typically uses 51262). linkerd-proxy does not sent a FIN (or RST) to the destination, and the destination continues to send TCP keepalives.

```
 1442 575.836787088 100.64.98.109 → 172.65.251.78 TCP 68 51260 → 443 [RST, ACK] Seq=1091 Ack=20494 Win=443 Len=0 TSval=1870186928 TSecr=2115215706
 1443 579.329592525 172.65.251.78 → 100.64.98.109 TCP 56 [TCP Keep-Alive] 443 → 51262 [ACK] Seq=20493 Ack=1091 Win=70656 Len=0
 1444 579.329622635 100.64.98.109 → 172.65.251.78 TCP 56 [TCP Keep-Alive ACK] 51262 → 443 [ACK] Seq=1091 Ack=20494 Win=56576 Len=0
```

Note that in this example of failure, `session.close()` was called immediately before `sys.exit(0)`.

#### Success case

After ~400 seconds, the destination sends a TCP FIN:

```
 5127 2200.553589462 172.65.251.78 → 100.64.96.98 TCP 56 443 → 56938 [FIN, ACK] Seq=19996 Ack=1400 Win=72704 Len=0
 5128 2200.553682723 172.65.251.78 → 100.64.96.98 TCP 68 443 → 56936 [FIN, ACK] Seq=19996 Ack=1400 Win=65536 Len=0 TSval=210667629 TSecr=2576612910
 5129 2200.597470214 100.64.96.98 → 172.65.251.78 TCP 56 56938 → 443 [ACK] Seq=1400 Ack=19997 Win=56576 Len=0
 5130 2200.597498575 100.64.96.98 → 127.0.0.1    TCP 68 56936 → 4140 [ACK] Seq=1400 Ack=19997 Win=56704 Len=0 TSval=2576612954 TSecr=210667629
```

Keepalives continue until the application closes its side of the connection by sending a TCP RST. In this case, the RST appears to be sent to linkerd-proxy instead of the destination service. Linkerd-proxy then sends a TCP FIN to the destination service, and the keepalives stop:

```
 5165 2210.995295248 172.65.251.78 → 100.64.96.98 TCP 56 [TCP Keep-Alive] 443 → 56938 [ACK] Seq=19996 Ack=1400 Win=72704 Len=0
 5166 2210.995314268 100.64.96.98 → 172.65.251.78 TCP 56 [TCP Keep-Alive ACK] 56938 → 443 [ACK] Seq=1400 Ack=19997 Win=56576 Len=0
 5187 2216.115307333 172.65.251.78 → 100.64.96.98 TCP 56 [TCP Keep-Alive] 443 → 56938 [ACK] Seq=19996 Ack=1400 Win=72704 Len=0
 5188 2216.115327063 100.64.96.98 → 172.65.251.78 TCP 56 [TCP Keep-Alive ACK] 56938 → 443 [ACK] Seq=1400 Ack=19997 Win=56576 Len=0
 5189 2218.841877580 100.64.96.98 → 127.0.0.1    TCP 68 56936 → 4140 [RST, ACK] Seq=1400 Ack=19997 Win=56704 Len=0 TSval=2576631198 TSecr=210667629
 5190 2218.842021581 100.64.96.98 → 172.65.251.78 TCP 56 56938 → 443 [FIN, ACK] Seq=1400 Ack=19997 Win=56576 Len=0
 5191 2218.842970461 172.65.251.78 → 100.64.96.98 TCP 56 443 → 56938 [ACK] Seq=19997 Ack=1401 Win=72704 Len=0
```

In this case, `sys.exit()` was not called immediately following `session.close()`. 

#### Pre-half-closed case (not impacted)

Including for comparison. If the connection is closed from the application side before the destination has sent a FIN, the traffic looks like:

```
249 4040.701494092 100.64.96.98 → 172.65.251.78 TCP 56 [TCP Keep-Alive] 37028 → 443 [ACK] Seq=1090 Ack=20303 Win=56576 Len=0
10250 4040.702340221 172.65.251.78 → 100.64.96.98 TCP 56 [TCP Keep-Alive ACK] 443 → 37028 [ACK] Seq=20303 Ack=1091 Win=70656 Len=0
10277 4045.702313357 172.65.251.78 → 100.64.96.98 TCP 56 [TCP Keep-Alive] 443 → 37028 [ACK] Seq=20302 Ack=1091 Win=70656 Len=0
10278 4045.702327607 100.64.96.98 → 172.65.251.78 TCP 56 [TCP Keep-Alive ACK] 37028 → 443 [ACK] Seq=1091 Ack=20303 Win=56576 Len=0
10311 4057.458379618 100.64.96.98 → 127.0.0.1    TCP 68 37026 → 4140 [FIN, ACK] Seq=1091 Ack=20303 Win=56704 Len=0 TSval=2578469815 TSecr=212497767
10312 4057.458469059 100.64.96.98 → 172.65.251.78 TCP 56 37028 → 443 [FIN, ACK] Seq=1091 Ack=20303 Win=56576 Len=0
10313 4057.459716962 172.65.251.78 → 100.64.96.98 TCP 56 443 → 37028 [FIN, ACK] Seq=20303 Ack=1092 Win=70656 Len=0
10314 4057.459749363 100.64.96.98 → 172.65.251.78 TCP 56 37028 → 443 [ACK] Seq=1092 Ack=20304 Win=56576 Len=0
10315 4057.459780943 172.65.251.78 → 100.64.96.98 TCP 68 443 → 37026 [FIN, ACK] Seq=20303 Ack=1092 Win=65536 Len=0 TSval=212524535 TSecr=2578469815
10316 4057.459793063 100.64.96.98 → 127.0.0.1    TCP 68 37026 → 4140 [ACK] Seq=1092 Ack=20304 Win=56704 Len=0 TSval=2578469816 TSecr=212524535

```


### Reproducer

```python
import requests
import sys
import time

s = requests.session()
s.get("https://gitlab.com")
time.sleep(415)

# # Experiment by uncommenting combinations of the following lines

# s.close()
# sys.exit(0)
```

If I have a chance I'll look for a socket-focused reproducer, and take a deeper look at the close behavior and timing.

**Comment by JacobHenner** [comment]
I figured out the exact cause of the issues I've been experiencing. The general outline is as follows:

* Application opens HTTPS connection to an out-of-cluster service. The out of cluster service has HTTP and TCP keep-alive enabled, with an idle timeout of 4 minutes for HTTP keepalive, and a 15s interval for TCP keep-alives.
  * This connection is redirected through the linkerd proxy by iptables NAT redirect rules.
* The connection remains idle for 4 minutes. The out-of-cluster service sends a TLS close_notify message, followed by a TCP FIN. The application-side ACKs that FIN. The connection is now half-closed (both parts - between the app and the proxy, and the proxy and the out-of-cluster service), with status CLOSE_WAIT.
* More time passes before the application exits. The application executes synchronously, and no calls have been made to the HTTP-handling code since the out-of-cluster service closed its side of the connection. After 60s of remaining in CLOSE_WAIT, the conntrack entry for the connection between the application and the linkerd proxy is dropped (`net.netfilter.nf_conntrack_tcp_timeout_close_wait = 60`). Meanwhile, TCP keepalives continue between linkerd-proxy and the out-of-cluster service.
* Eventually, the application exits. It sends a TCP RST. Since the conntrack entry for the connection between the application and linkerd-proxy is gone, iptables does not know to rewrite the destination of this RST. The destination remains the original destination (the out-of-cluster service) instead of the linkerd-proxy.
* Since the linkerd-proxy never receives this RST (or a FIN), it keeps the connection to the out-of-cluster service half-open, and continues to respond to TCP keep-alives.
* linkerd-await (or equivalent) triggers a proxy shutdown. The proxy fails to shut down cleanly before failing its liveness probe, as it believes the connection to the out-of-cluster service is still open.

I intend to attempt to work around this issue within my application(s) by closing HTTP connection pools somewhat prematurely, in anticipation of the possibility of this condition.

Perhaps the linkerd-proxy shutdown feature should allow a force-exit timeout to be specified. If that timeout is exceeded before all connections are closed, perhaps the proxy could close all remaining connections and exit with success instead of failing its liveness probe.

**Comment by adleong** [comment]
Thank you for digging into this, @JacobHenner, this is a really great write-up!  

We've seen other instances of conntrack losing track of half-closed connections, especially when the conntrack close wait timeout is short (i.e. 60s).  See: https://github.com/linkerd/linkerd2/issues/4276

We support a Helm value https://github.com/linkerd/linkerd2/blob/main/charts/linkerd-control-plane/values.yaml#L212 or an annotation https://linkerd.io/2.11/reference/proxy-configuration/ for configuring `net.netfilter.nf_conntrack_tcp_timeout_close_wait` and we've found that a value of 3600s works a lot better.

**Comment by adleong** [comment]
I wanted to check in here and see if the configuration I mentioned above fixed this.  If there's nothing else actionable, I'd like to close this issue.

**Comment by JacobHenner** [comment]
> I wanted to check in here and see if the configuration I mentioned above fixed this. If there's nothing else actionable, I'd like to close this issue.

It did not. We're still seeing the issue periodically (it only happens for some fraction of runs of application in question). I'll try to collect additional information to narrow the issue down further. I suspect that one of the other conntrack timeouts might be at play.

As a more general approach, would it make sense to add a proxy option that instructs the proxy to terminate as soon as it receives a SIGTERM (without regard for connections that it still views as open)?

**Comment by tspearconquest** [comment]
I'd vote for a timeout over just an immediate shutdown.

A pod level annotation like `config.linkerd.io/proxy-force-stop-timeout: (number)` with a configurable value of how many seconds to wait before shutting down once a SIGTERM has been received if the proxy still sees open connections.

**Comment by hawkw** [comment]
linkerd/linkerd2-proxy#1815 will add support for configuring the proxy with a maximum grace period duration for graceful shutdown, ensuring that it will terminate after that timeout even if some connections remain open. This is essentially what @tspearconquest suggested in https://github.com/linkerd/linkerd2/issues/8033#issuecomment-1176578369.

**Comment by hawkw** [comment]
To resolve this, we've added a timeout for the maximum grace period the proxy itself will wait for connections to close gracefully (see #8923). By default, the proxy will now wait for connections to close gracefully for a maximum of two minutes, and will then shut down regardless of any remaining "open" TCP connections. You can override the default value of two minutes with an annotation like this:
```yaml
annotations:
  config.linkerd.io/shutdown-grace-period: "30s"
```

The shutdown grace period timeout should ensure that your `linkerd-proxy` containers always terminate in a timely manner, even if some connections don't close, or if the proxy misses a connection closing due to conntrack issues.

The `shutdown-grace-period` annotation is available in [`edge-22.7.2`](https://github.com/linkerd/linkerd2/releases/tag/edge-22.7.2) and later. It will be available on stable in `stable-2.12.0`.

I'm going to go ahead and close this issue, but if anyone is still having problems after updating to `edge-22.7.2` or later, please let us know!
