### ISSUE TITLE
Intermittent [RST, ACK] received by sidecar resulting in 502 errors

### ISSUE THREAD

**Issue by ael-g** [linkerd/linkerd2#5211]
## Bug Report
Intermittent 502 errors on pod with linkerd side-car.

### What is the issue?
I have Kubernetes liveness/readiness HTTP probe getting 502 errors to a NodeJS v12 container proxified by linkerd.
The 502 errors are quite irregular in time but happens to any http node listening service, every 10-30 minutes.

### How can it be reproduced?
Deploy a Kubernetes deployment like this:
```
apiVersion: apps/v1
kind: Deployment
metadata:
  labels:
    app: test-errors
  name: test-errors
spec:
  replicas: 10
  selector:
    matchLabels:
      app: test-errors
  template:
    metadata:
      annotations:
        config.linkerd.io/enable-debug-sidecar: "true"
    spec:
      containers:
      - args:
        - --trace_gc
        - index
        command:
        - node
        image: duluca/minimal-node-web-server
        livenessProbe:
          failureThreshold: 3
          httpGet:
            path: /
            port: 3000
            scheme: HTTP
          periodSeconds: 5
          successThreshold: 1
          timeoutSeconds: 3
        name: node
``` 

### Logs, error output, etc
When starting the debug container with `config.linkerd.io/enable-debug-sidecar: "true"`, I observed that 502 errors happened when the connection looks closed on NodeJS side, but linkerd-proxy thinks it's still open:
```
# Connection open at the start of the container
6 0.000934966    127.0.0.1 → 127.0.0.1    TCP 76 48066 → 3000 [SYN] Seq=0 Win=43690 Len=0 MSS=65495 SACK_PERM=1 TSval=1980822319 TSecr=0 WS=128
....
28 5.000358282 127.0.0.1 → 127.0.0.1 HTTP 162 GET / HTTP/1.1
29 5.002003529 127.0.0.1 → 127.0.0.1 HTTP 1044 HTTP/1.1 200 OK (text/html)
30 5.002024416    127.0.0.1 → 127.0.0.1    TCP 68 48066 → 3000 [ACK] Seq=189 Ack=1953 Win=42880 Len=0 TSval=1980827320 TSecr=1980827320
....
# this probe is OK, lots of following probes are OK too, then:
2637 495.008389651 127.0.0.1 → 127.0.0.1 HTTP 162 GET / HTTP/1.1
2638 495.008881120    127.0.0.1 → 127.0.0.1    TCP 68 3000 → 48066 [RST, ACK] Seq=96625 Ack=9401 Win=43776 Len=0 TSval=1981317283 TSecr=198131728

-> makes the 502 error and then linkerd-proxy connects again
2659 500.001281043    127.0.0.1 → 127.0.0.1    TCP 76 52230 → 3000 [SYN] Seq=0 Win=43690 Len=0 MSS=65495 SACK_PERM=1 TSval=1981322275 TSecr=0 WS=128
2660 500.001292384    127.0.0.1 → 127.0.0.1    TCP 76 3000 → 52230 [SYN, ACK] Seq=0 Ack=1 Win=43690 Len=0 MSS=65495 SACK_PERM=1 TSval=1981322275 TSecr=1981322275 WS=128
```
I cannot see any RST packet before warning linkerd-proxy that node is closing the connection.
But it seems to have something to do with nodejs because I cannot reproduce if I switch my node container for a nginx container.

#### `linkerd check` output

```
kubernetes-api
--------------
√ can initialize the client
√ can query the Kubernetes API

kubernetes-version
------------------
√ is running the minimum Kubernetes API version
√ is running the minimum kubectl version

linkerd-existence
-----------------
√ 'linkerd-config' config map exists
√ heartbeat ServiceAccount exist
√ control plane replica sets are ready
√ no unschedulable pods
√ controller pod is running
√ can initialize the client
√ can query the control plane API

linkerd-config
--------------
√ control plane Namespace exists
√ control plane ClusterRoles exist
√ control plane ClusterRoleBindings exist
√ control plane ServiceAccounts exist
√ control plane CustomResourceDefinitions exist
√ control plane MutatingWebhookConfigurations exist
√ control plane ValidatingWebhookConfigurations exist
√ control plane PodSecurityPolicies exist

linkerd-identity
----------------
√ certificate config is valid
√ trust anchors are using supported crypto algorithm
√ trust anchors are within their validity period
√ trust anchors are valid for at least 60 days
√ issuer cert is using supported crypto algorithm
√ issuer cert is within its validity period
√ issuer cert is valid for at least 60 days
√ issuer cert is issued by the trust anchor

linkerd-api
-----------
√ control plane pods are ready
√ control plane self-check
√ [kubernetes] control plane can talk to Kubernetes
√ [prometheus] control plane can talk to Prometheus
√ tap api service is running

linkerd-version
---------------
√ can determine the latest version
‼ cli is up-to-date
    is running version 2.8.1 but the latest stable version is 2.9.0
    see https://linkerd.io/checks/#l5d-version-cli for hints

control-plane-version
---------------------
‼ control plane is up-to-date
    is running version 2.8.1 but the latest stable version is 2.9.0
    see https://linkerd.io/checks/#l5d-version-control for hints
√ control plane and cli versions match

linkerd-addons
--------------
√ 'linkerd-config-addons' config map exists

Status check results are √
```

### Environment

- Kubernetes Version: v1.16.13-gke.401
- Cluster Environment: GKE
- Linkerd version: stable-2.8.1

**Comment by olix0r** [comment]
Thanks for the report, @ael-g. It sounds like Linkerd's connection pool is retaining connections and the application is idling them out. The HTTP/1 client can't necessarily detect that these connections have been closed before it tries to write on the socket, and so this can manifest as an error.

Currently, connections can remain idle from 60-90s. In the last week or so, we've decided that these timeouts should be reduced substantially (see #5200 & linkerd/linkerd2-proxy#734).

I'd recommend the following:

* Check to see whether your application is enforcing an idle timeout; we'll probably want that to be coordinated with its proxy.
* _If you are able to upgrade to **stable-2.9.0**_, you can try this new proxy by setting workload annotations:
  * `config.linkerd.io/proxy-image: ghcr.io/olix0r/l2-proxy`
  * `config.linkerd.io/proxy-version: v2.119.0`
  Note, however, that this proxy version requires the stable-2.9.0 control plane and is not expected to work with stable-2.8.1.
* If you are unable to upgrade your control plane, you can use `linkerd inject --manual` on your worload. This will generate a resource that includes the proxy sidecar containers (instead of the simple annotation). You can then add the following environment variables to the proxy container:
  * {name: `LINKERD2_PROXY_INBOUND_ROUTER_MAX_IDLE_AGE`, value: "20s"}
  * {name: `LINKERD2_PROXY_OUTBOUND_ROUTER_MAX_IDLE_AGE`, value: "5s"}

We're in the process of preparing a stable-2.9.1 with this configuration change and some other small fixes for issues that have been reported this week; so we'd love to know whether these configuration changes are enough to solve your problem, or whether we need to expose a richer set of configurations for you to tune these timeouts for your application.

**Comment by ael-g** [comment]
Thanks @olix0r for you detailed answer, I upgraded to **stable-2.9.0** and set the annotations as you said on my test service, but I still observe intermittent 502 errors on liveness and readiness probes.

Interesting thing is that it is more frequent: on 10 runnings pods of the same service, it happened ~60secs on at least one pod, against ~10/15min for the previous situation.

So I'm gonna make some tests with my Node/Express container to see how it goes when changing TCP idle timeout.

But to be sure I understand, what looks strange to me is that my node processes does not seem to send [FIN] packet to tell linkerd-proxy the connection is over. And those 502 happened at unpredictable time interval, whereas there is traffic on the socket every 5sec for the liveness/readiness probes.

Could there be situations where userland processes (Node in this cas) drops the connection without sending [FIN] packet, under "normal" running circumstances (no crash and so)?

**Comment by olix0r** [comment]
> Could there be situations where userland processes (Node in this cas) drops the connection without sending [FIN] packet, under "normal" running circumstances (no crash and so)?

It's a bit surprising, but these interactions can be pretty subtle...

If you have the time to put together an isolated repro, I'd love to dig in deeper into what's going on. I.e., if you can create a public repo with a minimal version of the application stack with a docker container + k8s manifest that we could apply, we'd be happy to help debug that. It will probably be difficult for us to come up with a high-confidence resolution to this without a reproducible example, though.

**Comment by ael-g** [comment]
Sure, I'll be off till next Wednesday but I'll do that when coming back.

**Comment by ael-g** [comment]
Here's the kube's manifest to reproduce, embedding a public Docker image for a minimal NodeJS server:
`kubectl apply -f https://gist.githubusercontent.com/ael-g/886fa2b01e79ab6c1a9d54d735de905e/raw/50b05c170da80d4d91c018d4f3271e16e0ec6b48/linkerd-rst.yaml`

So I ran the previous command against a **v1.16.13-gke.401** GKE cluster, and a **stable-2.9.0** installed.
Around 10 minutes after running the command, I have 
```
"Liveness probe failed: HTTP probe failed with statuscode: 502"
```
concerning test pods within thze stackdriver console.
